MODIFIED,INSTITUTIONCODE,COLLECTIONCODE,CATALOGNUMBER,BASISOFRECORD,KINGDOM,PHYLUM,CLASS,ORDER,FAMILY,GENUS,SPECIFICEPITHET,INFRASPECIFICEPITHET,SCIENTIFICNAME,SCIENTIFICNAMEAUTHORSHIP,IDENTIFIEDBY,YEARIDENTIFIED,MONTHIDENTIFIED,DAYIDENTIFIED,TYPESTATUS,RECORDEDBY,RECORDNUMBER,FIELDNUMBER,YEAR,MONTH,DAY,EVENTTIME,CONTINENTOCEAN,COUNTRY,STATEPROVINCE,COUNTY,LOCALITY,DECIMALLONGITUDE,DECIMALLATITUDE,VERBATIMLONGITUDE,VERBATIMLATITUDE,COORDINATEPRECISION,BOUNDINGBOX,MINIMUMELEVATIONINMETERS,MAXIMUMELEVATIONINMETERS,MINIMUMDEPTHINMETERS,MAXIMUMDEPTHINMETERS,SEX,PREPARATIONTYPE,INDIVIDUALCOUNT,PREVIOUSCATALOGNUMBER,RELATIONSHIPTYPE,RELATEDCATALOGITEM,OCCURRENCEREMARKS,BARCODE,IMAGECODE,GEOFLAG
2021-06-30 13:04:04-03,MBM,MBM,62852,S,Plantae,,,,Araceae,Anthurium,microphyllum,,Anthurium microphyllum,(Hook.) G. Don,"Mayo, S.",,,,,"Hatschbach, G.; et al.; et al.",40365,,1977,10,08,,Southern America,Brazil,Santa Catarina,Laguna,Praia do GI,-48.7807998657227,-28.4825000762939,0,0,21199,,,,,,,,,,,,,MBM062852,,auto
2021-06-25 18:17:26-03,UFV,VIC,052704,PreservedSpecimen,Plantae,,,,Araceae,Anthurium,microphyllum,,Anthurium microphyllum,(Raf.) G.Don,H.V. Pinto Junior,2019,05,17,,"H.V. Pinto Junior; Muller, L.A.C.; Sperandio, T.",495,,2019,01,25,,,Brasil,Espírito Santo,Nova Venécia,"APA Pedra do Elefante, Topo de inselberg, vertente leste",-40.766667,-19.288889,-40.766667,-19.288889,,,674,674,,,,,,,,,"Planta com +/- 15cm, ilha de vegetação, folhas verdes, inflorescência passada, sol, abundante.",VIC052704,VIC052704,
2020-04-27 16:08:42-03,UFES,VIES,24489,S,Plantae,,,,Araceae,Anthurium,microphyllum,,Anthurium microphyllum,(Raf.) G.Don,R.T. Valadares,2018,04,27,,"Gomes, J.M.L",2572,,1999,08,14,,,Brasil,Espírito Santo,Domingos Martins,Pedra do Cachorro e Pedra das Flores.,-40.6591987609863,-20.3633003234863,,,48150,,,,,,,,,,,,,VIES024489,VIES024489,auto
2015-12-11 16:42:00-02,MNHN,RECOLNAT_MNHN_P,P01750088,PreservedSpecimen,,,,,Araceae,Anthurium,microphyllum,,Anthurium microphyllum,(Hook.) G.Don,,,,,,"Glaziou, A.",,8046,1875,6,29,,,Brasil,Rio de Janeiro,Rio de Janeiro,"Brésil. Gávea, na pedra. Rio de Janeiro, Rio de Janeiro, Sudeste, Brasil, América do Sul",-43.2075004577637,-22.9027996063232,,,57442,,,,,,,hb,,,,,". . Herbier de A. Glaziou, donné par Mme Simard, sa fille, en 1907 <a href='http://coldb.mnhn.fr/catalognumber/mnhn/p/p01750088' target='other'> <mi>dwc_moreinfo</mi></a>",P01750088,P01750088_01,auto
2015-12-11 16:42:00-02,MNHN,RECOLNAT_MNHN_P,P01750089,PreservedSpecimen,,,,,Araceae,Anthurium,microphyllum,,Anthurium microphyllum,(Hook.) G.Don,Andrade & Mayo,,,,,Glaziou,,9037,1876,11,9,,,Brasil,Rio de Janeiro,Rio de Janeiro,"Brésil, R.J., S. Cristovão. Rio de Janeiro, Rio de Janeiro, Sudeste, Brasil, América do Sul",-43.2075004577637,-22.9027996063232,,,57442,,,,,,,hb,,,,,". . No. 44. Herbier de A. Glaziou, donné par Mme Simard, sa fille, en 1907 <a href='http://coldb.mnhn.fr/catalognumber/mnhn/p/p01750089' target='other'> <mi>dwc_moreinfo</mi></a>",P01750089,P01750089_01,auto
2015-09-03 19:09:23-03,MNHN,RECOLNAT_MNHN_P,P01750091,PreservedSpecimen,,,,,Araceae,Anthurium,microphyllum,,Anthurium microphyllum,(Hook.) G.Don,Andrade & Mayo,,,,,"Glaziou, A.",,8046,1875,6,29,,,Brasil,Rio de Janeiro,Rio de Janeiro,"Gavea. Rio de Janeiro, Rio de Janeiro, Sudeste, Brasil, América do Sul",-43.2075004577637,-22.9027996063232,,,57442,,,,,,,hb,,,,,. . Reçu le A. Octobre 1876 <a href='http://coldb.mnhn.fr/catalognumber/mnhn/p/p01750091' target='other'> <mi>dwc_moreinfo</mi></a>,P01750091,P01750091_01,auto
2015-10-22 10:02:28-02,UNIOESTE,UNOP,4198,S,Plantae,,,,Araceae,Anthurium,microphyllum,,Anthurium microphyllum,(Hook.) G.Don,"Temponi, L.G.",2004,02,,,"Temponi, L.G.; Abreu, C.R.M.; Abreu, C.R.M.",320,,2004,02,01,,,Brasil,Rio de Janeiro,Rio de Janeiro,"Pão de Açucar, Estrada Cláudio Coutinho, Paredão CEPI, base da vida da escalada: Italianos",-43.2075004577637,-22.9027996063232,0,0,57442,,150,150,,,,,,,,,"Rupícula. Catafilo fibroso. Lâmina concolor, cartácea, nervuras laterais pouco aparentes, mais escuras e salientes na abaxial. Peciolo reto na adaxial, cilíndrico na abaxial. Espádice nigrescente, espata verde, pedúnculo cilíndrico.",,,auto
2016-08-23 11:12:16-03,NHMLondon,NHM-LONDON-BOT,BM000957046,S,Plantae,,,,Araceae,Anthurium,microphyllum,,Anthurium microphyllum,(Raf.) G.Don,Label determination,,,,,Heinrich Gustav Adolf Engler; b.1844; d.1930; Engl.,182,,,,,,,Brasil,,,,-53.08982,-10.773109,-53.08982,-10.773109,,,,,,,,,,NHMUK:ecatalogue:2309028,,,,,,
2016-08-23 11:12:16-03,NHMLondon,NHM-LONDON-BOT,BM000957047,S,Plantae,,,,Araceae,Anthurium,microphyllum,,Anthurium microphyllum,(Raf.) G.Don,,,,,,John Miers; b.1789; d.1879; Miers,3428,,,,,,,Brasil,Rio de Janeiro,,,-42.64735,-22.531489,-42.64735,-22.531489,,,,,,,,,,NHMUK:ecatalogue:2309039,,,,,,
2016-08-23 11:12:16-03,NHMLondon,NHM-LONDON-BOT,BM000957048,S,Plantae,,,,Araceae,Anthurium,microphyllum,,Anthurium microphyllum,(Raf.) G.Don,Fredrik Pieter Jonker; b.1912; d.1995; Jonker,1952,,,,George Gardner; b.1812; d.1849; Gardner,171,,1836,,,,,Brasil,Rio de Janeiro,,,-42.64735,-22.531489,-42.64735,-22.531489,,,,,,,,,,NHMUK:ecatalogue:2309044,,,,,,
2017-09-11 16:26:26-03,UnB,HBVIRTFLBRAS,,O,Plantae,,,,Araceae,Anthurium,microphyllum,,Anthurium microphyllum,(Raf.) G.Don,,,,,,"Schott, HW",s.n.,,,,,,Southern America,Brazil,Rio de Janeiro,Rio de Janeiro,"IBB/Corcovado, Rio de Janeiro, RJ, Monte Corcovado",-43.13,-22.57,-43.13,-22.57,,,,,,,,,,,,,,,,
2019-11-21 09:59:10-03,IBt,SP,50738,S,Plantae,,,,Araceae,Anthurium,microphyllum,,Anthurium microphyllum,(Hook.) G.Don,"Barroso, GM",,,,,"Handro, O",4,,1948,09,25,,,Brasil,São Paulo,São Paulo,"Jardim Botânico, Procedência ignorada. Cultivada no Jardim Bot.",-46.6300010681152,-23.5400009155273,0,0,53584,,,,,,,,,,,,,SP049254,SP049254,auto
2020-07-10 09:43:27-03,MBML,MBML-HERBARIO,34253,,Plantae,,,,Araceae,Anthurium,cf. microphyllum,,Anthurium cf. microphyllum,G.Don,R.T. Valadares/27-03-2018,,,,,C. N. de Fraga; et al,1911,,2008,02,19,,,Brasil,Espírito Santo,Nova Venécia,Área de Proteção Ambiental da Pedra do Elefante,-40.457778,-18.766944,40W27'28,18S46'1,,,,,,,,,,,,,,MBML034253,MBML034253,
2020-07-10 09:43:27-03,MBML,MBML-HERBARIO,36133,,Plantae,,,,Araceae,Anthurium,cf. microphyllum,,Anthurium cf. microphyllum,G.Don,R.T. Valadares/27-03-2018,,,,,R. C. Forzza; et al,5173,,2008,07,17,,,Brasil,Espírito Santo,Nova Venécia,Área de Proteção Ambiental da Pedra do Elefante,-40.443889,-18.776944,40W26'38,18S46'37,,,,,,,,,,,,,,MBML036133,MBML036133,
2020-07-10 09:43:27-03,MBML,MBML-HERBARIO,46891,,Plantae,,,,Araceae,Anthurium,cf. microphyllum,,Anthurium cf. microphyllum,G.Don,R.T. Valadares/27-03-2018,,,,,A. M. Assis; M.D.S. Demuner & M. B. Redighieri,2494,,2010,04,26,,,Brasil,Espírito Santo,Nova Venécia,APA Pedra do Elefante - Pedra do Elefante,-40.457611,-18.767,"40W27'27,4","18S46'1,2",,,630,630,,,,,,,,,"Rupícola, espata verde e espádice vináceo",MBML046891,MBML046891,
2020-07-10 09:43:28-03,MBML,MBML-HERBARIO,34452,,Plantae,,,,Araceae,Anthurium,microphyllum,,Anthurium microphyllum,G.Don,R.T. Valadares/27-03-2018,,,,,A. P. Fontana; et al,5265,,2008,05,10,,,Brasil,Espírito Santo,Nova Venécia,Área de Proteção Ambiental da Pedra do Elefante,-40.466667,-18.766667,40W27'60,18S46'0,,,,,,,,,,,,,,MBML034452,MBML034452,
