MODIFIED,INSTITUTIONCODE,COLLECTIONCODE,CATALOGNUMBER,BASISOFRECORD,KINGDOM,PHYLUM,CLASS,ORDER,FAMILY,GENUS,SPECIFICEPITHET,INFRASPECIFICEPITHET,SCIENTIFICNAME,SCIENTIFICNAMEAUTHORSHIP,IDENTIFIEDBY,YEARIDENTIFIED,MONTHIDENTIFIED,DAYIDENTIFIED,TYPESTATUS,RECORDEDBY,RECORDNUMBER,FIELDNUMBER,YEAR,MONTH,DAY,EVENTTIME,CONTINENTOCEAN,COUNTRY,STATEPROVINCE,COUNTY,LOCALITY,DECIMALLONGITUDE,DECIMALLATITUDE,VERBATIMLONGITUDE,VERBATIMLATITUDE,COORDINATEPRECISION,BOUNDINGBOX,MINIMUMELEVATIONINMETERS,MAXIMUMELEVATIONINMETERS,MINIMUMDEPTHINMETERS,MAXIMUMDEPTHINMETERS,SEX,PREPARATIONTYPE,INDIVIDUALCOUNT,PREVIOUSCATALOGNUMBER,RELATIONSHIPTYPE,RELATEDCATALOGITEM,OCCURRENCEREMARKS,BARCODE,IMAGECODE,GEOFLAG
2020-07-23 11:58:47-03,CEPLAC,CEPEC,130355,PreservedSpecimen,Plantae,,,,Asteraceae,Baccharis,platypoda,,Baccharis platypoda,,C. N. Fraga,,,,,C. N. Fraga,2449,,,,,,,Brasil,Espírito Santo,castelo,,-41.184700012207,-20.6035995483398,,,23588,,,,,,,,,,,,<ll>dwc_commonname:</ll>,,,auto
2020-07-23 11:58:47-03,CEPLAC,CEPEC,129768,PreservedSpecimen,Plantae,,,,Asteraceae,Baccharis,platypoda,,Baccharis platypoda,,M. M. Saavedra,,,,,M. M. Saavedra,749,,,,,,,Brasil,Espírito Santo,castelo,,-41.184700012207,-20.6035995483398,,,23588,,,,,,,,,,,,<ll>dwc_commonname:</ll>,,,auto
2020-07-23 11:58:47-03,CEPLAC,CEPEC,38867,PreservedSpecimen,Plantae,,,,Asteraceae,Baccharis,platypoda,,Baccharis platypoda,,H. Robinson,,,,,G. Hatschbach,49410,,1985,06,15,,,Brasil,Espírito Santo,domingos martins,Pedra Azul.,-40.6591987609863,-20.3633003234863,,,48150,,,,,,,,,,,30/12/1985,,,,auto
2020-07-23 11:58:47-03,CEPLAC,CEPEC,37425,PreservedSpecimen,Plantae,,,,Asteraceae,Baccharis,platypoda,,Baccharis platypoda,,G. Hatschbach,,,,,G. Hatschbach,49395,,1985,06,14,,,Brasil,Espírito Santo,iuna,Corrego Sao Joao.,-41.5358009338379,-20.3458003997803,0W0'0,0S0'0,32198,,,,,,,,,,,01/07/1985,,,,auto
2020-07-23 11:58:47-03,CEPLAC,CEPEC,63060,PreservedSpecimen,Plantae,,,,Asteraceae,Baccharis,platypoda,,Baccharis platypoda,,G. M. Barroso,,,,,H. Q. B. Fernandes,1922,,1986,04,16,,,Brasil,Espírito Santo,SANTA TERESA,Alto da Pedra da Onça.,-40.6002998352051,-19.9356002807617,,,23813,,,,,,,,,,,30/12/1990,,,,auto
2020-07-23 11:58:47-03,CEPLAC,CEPEC,69949,PreservedSpecimen,Plantae,,,,Asteraceae,Baccharis,platypoda,,Baccharis platypoda,,G. M. Barroso,,,,,D. Sucre,6675,,1970,05,11,,,Brasil,Minas Gerais,LIMA DUARTE,"Serra de Ibitipoca, Pico do Pião.",-43.793098449707,-21.8425006866455,,,30417,,,,,,,,,,,30/08/1972,,,,auto
2020-08-20 20:38:01-03,UFSC,FLOR,8371,PreservedSpecimen,Plantae,,,Asterales,Asteraceae,Baccharis,platypoda,,Baccharis platypoda,DC.,"Hatschbach, G.",1985,,,,"Hatschbach, G.; Silva, J.M.",49395,,1985,06,14,,,Brasil,Espírito Santo,Ibatiba,Córrego S. João.,-41.5106010437012,-20.2339000701904,,,18895,,,,,,,,,,,,"arbusto, flor capítulo creme, 1,5m altura",FLOR0008371,FLOR0008371,auto
2020-08-20 20:38:01-03,UFSC,FLOR,30964,PreservedSpecimen,Plantae,,,Asterales,Asteraceae,Baccharis,platypoda,,Baccharis platypoda,DC.,"Hatschbach, G.",1998,,,,"Hatschbach, G.; Hatschbach, M. & Barbosa, E.",68063,,1998,07,19,,,Brasil,Minas Gerais,Grão Mogol,"Rio Itacambiruçu, próximo à barra do Escurinho.",-42.8897018432617,-16.5594005584717,,,67219,,,,,,,,,,,,"arbusto, flor capítulo creme, 1,2m altura",FLOR0030964,FLOR0030964,auto
2017-09-11 16:26:35-03,UnB,HBVIRTFLBRAS,,O,Plantae,,,,Asteraceae,Baccharis,platypoda,,Baccharis platypoda,DC.,,,,,,"Claussen, P",606,,,,,,Southern America,Brazil,Minas Gerais,Cachoeira do Campo,Cachoeira do Campo,-43.667255,-20.335379,-43.667255,-20.335379,,,,,,,,,,,,,,,P06P3N0033,
2017-09-11 17:07:39-03,UnB,HBVIRTFLBRAS,,O,Plantae,,,,Asteraceae,Baccharis,platypoda,,Baccharis platypoda,DC.,,,,,,"Vauthier, AC",283,,,,,,Southern America,Brazil,Minas Gerais,Mariana,,-43.4161,-20.3778,0,0,33524,,,,,,,,,,,,Habitat in campis Brasiliae orientalis et australis.; HABITAT: Habitat in campis Brasiliae orientalis et australis.,,P06P3N0033,auto
2021-06-09 09:50:35-03,UFPel,PEL,3611,PreservedSpecimen,Plantae,,,,Asteraceae,Baccharis,platypoda,,Baccharis platypoda,DC.,G. M. Barroso,1905,05,15,,E. Pereira,7084,,1962,06,12,,América do Sul,Brasil,Rio de Janeiro,Itatiaia,,-44.5633010864258,-22.4960994720459,,,19648,,1800,1800,,,,Exsicata,,,,,Frutex metralis floribus albo-viridis,,,auto
2019-11-21 10:00:00-03,IBt,SP,310790,S,Plantae,,,,Asteraceae,Baccharis,platypoda,,Baccharis platypoda,DC.,"Hind, DJN",1997,10,,,"Souza, JP; Souza, VC; Rodrigues, RR; Tamashiro, JY; Ivanauskas, NM",1026,,1996,12,17,,,Brasil,São Paulo,Cunha,Estrada para Pedra da Macela.,-45.042472,-23.257083,-45.042472,-23.257083,,,,,,,,,,,,,,,,
2019-11-21 10:00:00-03,IBt,SP,423702,S,Plantae,,,,Asteraceae,Baccharis,platypoda,,Baccharis platypoda,DC.,"Souza-Buturi, FO",2010,05,24,,"Souza-Buturi, FO",320,,2010,05,24,,,Brasil,Rio de Janeiro,Nova Friburgo,"Cônego. Pedra do Imperador (também conhecida como Pedra do Elefante), após a primeira antena na trilha para a torre",-42.531111,-22.322778,-42.531111,-22.322778,,,1350,1350,,,,,,,,,,,,
2019-11-21 10:00:00-03,IBt,SP,471068,S,Plantae,,,,Asteraceae,Baccharis,platypoda,,Baccharis platypoda,DC.,"Franco, IM",2012,,,,"Franco, IM; Marques, D; Araújo, IM; Silva, KR",1049,,2012,06,28,,,Brasil,Minas Gerais,Diamantina,Parque Estadual do Biribiri. Córrego de São Miguel.,-43.6002998352051,-18.2493991851807,0,0,101169,,,,,,,,,,,,,,,auto
2019-11-21 10:00:00-03,IBt,SP,203779,S,Plantae,,,,Asteraceae,Baccharis,platypoda,,Baccharis platypoda,DC.,"Hind, DJN",1997,10,,,"Cerati, TM; Wanderley, MGL; Kral, R",245,,1985,07,09,,,Brasil,Minas Gerais,Grão Mogol,"Vargem do Quartel, 8 km WSW",-42.8897018432617,-16.5594005584717,0,0,67219,,500,650,,,,,,,,,,,,auto
2019-11-21 10:00:00-03,IBt,SP,143607,S,Plantae,,,,Asteraceae,Baccharis,platypoda,,Baccharis platypoda,DC.,"Leitão Filho, HF",,,,,"Semir, J; et al.",CFSC4392,,1973,09,04,,,Brasil,Minas Gerais,Jaboticatubas,"Serra do Cipó, Km 117",-43.7449989318848,-19.513599395752,0,0,31264,,,,,,,,,,,,,,,auto
2019-11-21 10:00:00-03,IBt,SP,143741,S,Plantae,,,,Asteraceae,Baccharis,platypoda,,Baccharis platypoda,DC.,"Leitão Filho, HF",1986,06,23,,"Joly, AB; Semir, J; Joly, AM; Martins, F",CFSC2190,,1972,05,27,,,Brasil,Minas Gerais,Jaboticatubas,"Serra do Cipó, Km 127",-43.7449989318848,-19.513599395752,0,0,31264,,,,,,,,,,,,,,,auto
2019-11-21 10:00:00-03,IBt,SP,143524,S,Plantae,,,,Asteraceae,Baccharis,platypoda,,Baccharis platypoda,DC.,"Leitão Filho, HF",,,,,"Joly, AB; et al.",CFSC2165,,1972,05,27,,,Brasil,Minas Gerais,Jaboticatubas,"Serra do Cipó, Km 139",-43.7449989318848,-19.513599395752,0,0,31264,,,,,,,,,,,,,,,auto
2019-11-21 10:00:00-03,IBt,SP,192545,S,Plantae,,,,Asteraceae,Baccharis,platypoda,,Baccharis platypoda,DC.,,,,,,"Mautone, L",705,,1979,05,23,,,Brasil,Minas Gerais,Ouro Preto,Cachoeira das Andorinhas,-43.5080986022949,-20.2875003814697,0,0,44599,,,,,,,,,,,,,SP031491,SP031491,auto
2019-11-21 10:00:00-03,IBt,SP,320011,S,Plantae,,,,Asteraceae,Baccharis,platypoda,,Baccharis platypoda,DC.,"Oliveira Deble, AS",2007,10,30,,"Mello-Silva, R; Kawasaki, ML; Rapini, A",1358,,1997,05,22,,,Brasil,Minas Gerais,Santa Bárbara,"Serra do Caraça, Campo de Fora.",-43.4152984619141,-19.959400177002,0,0,33136,,1500,1500,,,,,,,,,,,,auto
2019-11-21 10:00:00-03,IBt,SP,6192,S,Plantae,,,,Asteraceae,Baccharis,platypoda,,Baccharis platypoda,DC.,"Blake, SF",,,,,"Tamandaré; Brade, AC",s.n.,,1913,06,10,,,Brasil,Rio de Janeiro,Itatiaia,Serra do Itatiaia.,-44.5633010864258,-22.4960994720459,0,0,19648,,,,,,,,,,,,,,,auto
2019-11-21 10:00:00-03,IBt,SP,139177,S,Plantae,,,,Asteraceae,Baccharis,platypoda,,Baccharis platypoda,DC.,"Barroso, GM",1979,12,05,,"Eiten, G; Eiten, LT",7725,,1966,07,31,,,Brasil,Rio de Janeiro,Resende,"Parque Nacional de Itatiaia, South face of Mt. Itatiaia. Berween Macieiras, and television relay tower, at head of valley of Rio Itatiaia. On slope above road.",-44.4467010498047,-22.468900680542,0,0,36089,,1900,1900,,,,,,,,,,,,auto
2019-11-21 10:00:00-03,IBt,SP,411778,S,Plantae,,,,Asteraceae,Baccharis,platypoda,,Baccharis platypoda,DC.,"Heiden, G",2007,06,27,,"Heiden, G; et al.",782,,2007,06,27,,,Brasil,Rio de Janeiro,Teresópolis,"Parque Nacional da Serra dos Órgãos, Trilha para a Pedra do Sino, após o gramado do abrigo, 20min. de caminhada antes dos campos de alt.",-42.9655990600586,-22.4122009277344,0,0,38539,,1900,1900,,,,,,,,,,,,auto
2019-11-21 10:00:00-03,IBt,SP,139003,S,Plantae,,,,Asteraceae,Baccharis,platypoda,,Baccharis platypoda,DC.,"Barroso, GM",1979,12,11,,"Eiten, G; Eiten, LT",7158,,1966,04,22,,,Brasil,Rio de Janeiro,Teresópolis,"Serra dos Órgãos, Ca. 7km SW of city of Teresópolis. Planalto, base od Pedra do Sino, a bare rock peak.",-42.9655990600586,-22.4122009277344,0,0,38539,,,,,,,,,,,,,,,auto
2019-11-21 10:00:00-03,IBt,SP,192547,S,Plantae,,,,Asteraceae,Baccharis,platypoda,,Baccharis platypoda,DC.,"Nunes, SCP",1980,04,17,,"Lima, HC",589,,1978,06,20,,,Brasil,São Paulo,Cunha,"Divisa Rj.SP., Próximo do Marco da divisa de Campos de Cunha.",-44.9599990844727,-23.0699996948242,0,0,38855,,1380,1380,,,,,,,,,,,,auto
2019-11-21 10:00:00-03,IBt,SP,384507,S,Plantae,,,,Asteraceae,Baccharis,platypoda,,Baccharis platypoda,DC.,"Souza, FO",2006,,,,"Kirizawa, M",3536,,2006,04,15,,,Brasil,São Paulo,Piquete,"Serra da Mantiqueira, Entre o Morro Careca e a morraria dos Marins.",-45.1699981689453,-22.6100006103516,0,0,13434,,1900,1900,,,,,,,,,,SP031490,SP031490,auto
2019-11-21 10:00:00-03,IBt,SP,68366,S,Plantae,,,,Asteraceae,Baccharis,platypoda,,Baccharis platypoda,DC.,"Oliveira Deble, AS",2007,10,30,,"Kuhlmann, M",4403,,1958,05,28,,,Brasil,São Paulo,São José do Barreiro,Campos de Bocaina.,-44.5699996948242,-22.6399993896484,0,0,30784,,,,,,,,,,,,,SP031492,SP031492,auto
2019-11-21 10:00:00-03,IBt,SP,312913,S,Plantae,,,,Asteraceae,Baccharis,platypoda,,Baccharis platypoda,DC.,"Heiden, G",2017,05,16,,"Simão Bianchini, R; Bianchini, S",1164,,1997,05,04,,,Brasil,São Paulo,São José do Barreiro,Serra da Bocaina,-44.5699996948242,-22.6399993896484,0,0,30784,,,,,,,,,,,,,,,auto
2019-11-21 10:00:00-03,IBt,SP,127371,S,Plantae,,,,Asteraceae,Baccharis,platypoda,,Baccharis platypoda,DC.,"Hind, DJN",1997,10,,,"Kuhlmann, M",4402,,1958,05,28,,,Brasil,São Paulo,São José do Barreiro,Serra da Bocaina,-44.5699996948242,-22.6399993896484,0,0,30784,,,,,,,,,,,,,,,auto
2019-11-19 15:43:15-03,UNEB,HUNEB,11947,PreservedSpecimen,Plantae,Angiospermae,Dicotyledoneae,Florideophycidae,Asteraceae,Baccharis,platypoda,,Baccharis platypoda,DC,,,,,,"Almeida, G.S.S.",682,,2007,05,09,,,Brasil,Minas Gerais,Ouro Preto,Parque Estadual do Itacolomi: Trilha da Estrada de Cima.,-43.5080986022949,-20.2875003814697,,,44599,,,,,,,,,,,,,HUNEB0011947,,auto
2019-11-19 15:43:15-03,UNEB,HUNEB,11917,PreservedSpecimen,Plantae,Angiospermae,Dicotyledoneae,Florideophycidae,Asteraceae,Baccharis,platypoda,,Baccharis platypoda,DC,,,,,,"Almeida, G.S.S.",51,,2005,08,22,,,Brasil,Minas Gerais,Ouro Preto,Parque Estadual do Itacolomi: Trilha da Lagoa Seca.,-43.5080986022949,-20.2875003814697,,,44599,,,,,,,,,,,,,HUNEB0011917,,auto
2019-11-19 15:43:15-03,UNEB,HUNEB,11918,PreservedSpecimen,Plantae,Angiospermae,Dicotyledoneae,Florideophycidae,Asteraceae,Baccharis,platypoda,,Baccharis platypoda,DC,,,,,,"Almeida, G.S.S.",363,,2006,04,17,,,Brasil,Minas Gerais,Ouro Preto,Parque Estadual do Itacolomi: Trilha da Lagoa Seca.,-43.5080986022949,-20.2875003814697,,,44599,,,,,,,,,,,,,HUNEB0011918,,auto
2019-11-19 15:43:15-03,UNEB,HUNEB,11959,PreservedSpecimen,Plantae,Angiospermae,Dicotyledoneae,Florideophycidae,Asteraceae,Baccharis,platypoda,,Baccharis platypoda,DC,,,,,,"Almeida, G.S.S.",362,,2006,04,17,,,Brasil,Minas Gerais,Ouro Preto,Parque Estadual do Itacolomi: Trilha do Lagoa Seca.,-43.5080986022949,-20.2875003814697,,,44599,,,,,,,,,,,,,HUNEB0011959,,auto
2019-10-09 11:09:57-03,UFBA,ALCB,122699,PreservedSpecimen,Plantae,Dicotyledon,,,Asteraceae,Baccharis,platypoda,,Baccharis platypoda,DC.,"Verdi, M",2014,08,,,"Verdi, M; Pougi, N; Martinelli, G; Maurenza, D; Martins, E",7107,,2014,01,24,,Southern America,Brasil,Minas Gerais,Grão Mogol,"Parque estadual de Grão Mogol. Serra do Curiacá, a partir do meio da encosta até o topo no ponto georreferenciado.",-42.875,-16.359444,-42.875,-16.359444,,,1202,1202,,,,,,,,,ca. 2 m alt. Folhas verdes. Flor creme.; frequentemente; encontrada em solo arenoso úmido em afloramentos rochosos; no interior do parque há incêndios devido a presença de arbustos queimados e no entorno encontram-se extensos plantios,ALCB009752,ALCB009752,
2019-10-09 11:09:57-03,UFBA,ALCB,122700,PreservedSpecimen,Plantae,Dicotyledon,,,Asteraceae,Baccharis,platypoda,,Baccharis platypoda,DC.,"Verdi, M",2014,08,,,"Verdi, M; Pougi, N; Martinelli, G; Maurenza, D; Martins, E",7120,,2014,06,24,,Southern America,Brasil,Minas Gerais,Grão Mogol,"Parque estadual de Grão Mogol. Serra do Curiacá, a partir do meio da encosta até o topo no ponto georreferenciado.",-42.875,-16.359444,-42.875,-16.359444,,,1202,1202,,,,,,,,,ca 2 m alt. Folhas verdes. Flor creme.; frequentemente; encontrada em solo arenoso úmido em afloramentos rochosos; no interior do parque há incêndios devido a presença de arbustos queimados e no entorno encontram-se extensos plantios,ALCB009753,ALCB009753,
2019-10-09 11:09:57-03,UFBA,ALCB,127370,PreservedSpecimen,Plantae,Dicotyledon,,,Asteraceae,Baccharis,platypoda,,Baccharis platypoda,DC.,"Calvo, J",2017,02,,,"Calvo, J",7400,,2017,02,10,,Southern America,Brasil,Bahia,Palmeiras,"Morro do Pai Inácio, beginning of the forest track to the morro",-41.477778,-12.458056,-41.477778,-12.458056,,,930,930,,,,,,,,,"roadside, dense shrubby vegetation",ALCB044082,ALCB044082,
2019-10-09 11:09:57-03,UFBA,ALCB,131963,PreservedSpecimen,Plantae,Dicotyledon,,,Asteraceae,Baccharis,platypoda,,Baccharis platypoda,DC.,"Nakajima, JN",2018,07,,,"Martinelli, G; Lima, T; Maurenza, D",19757,,2016,11,04,,Southern America,Brasil,Minas Gerais,Diamantina,"Parque Nacional Sempre Vivas, trilha entre a Pedra Redonda e Serra do Galho.",-43.788333,-17.96,-43.788333,-17.96,,,1240,1240,,,,,,,,,"ca 1m de altura, heliófila, folhas verdes, concolores, flores com capitulos paleáceos; Campo rupestre.",ALCB048642,ALCB048642,
2019-10-09 11:09:57-03,UFBA,ALCB,,PreservedSpecimen,Plantae,Dicotyledon,,,Asteraceae,Baccharis,platypoda,,Baccharis platypoda,DC.,"Teles, AM",2006,03,,,"Mattos Silva, LA; Brito, HS; Santos, EB dos",2458,,1988,06,16,,Southern America,Brasil,Bahia,Santa Luzia,"Litoral Sul, km 20 da rodovia Santa Luzia/Canavieiras (BA 270)",-39.333333,-15.416667,-39.333333,-15.416667,,,130,130,,,,,,,,,"2 m de altura, muito frequente nos campos. Flores amarelo-esverdeadas. Coleta de folhas para análises.; solo arenoso.",,,
2019-10-09 11:09:57-03,UFBA,ALCB,126749,PreservedSpecimen,Plantae,Dicotyledon,,,Asteraceae,Baccharis,platypoda,,Baccharis platypoda,DC.,"Roque, N",2017,01,,,"Ferreira, CDM; Fraga, FRM; Feliz, P",349,,2016,09,20,,Southern America,Brasil,Minas Gerais,Espera Feliz,Parque Nacional do Caparaó. Pedra Menina. Cresce na beira da estrada para o acampamento da Macieira.,-41.9071998596191,-20.6502990722656,0,0,21988,,1400,1400,,,,,,,,,"2,2 m. Folhas cartáceas, concolores, aromáticas (odor semelhante ao de terebentina). Periclíneo amarelodo, flores de coloração pardacenta. Heliófita.",ALCB040228,,auto
2019-10-09 11:09:57-03,UFBA,ALCB,,PreservedSpecimen,Plantae,Dicotyledon,,,Asteraceae,Baccharis,platypoda,,Baccharis platypoda,DC.,"Ribas, OS",2005,,,,"Cordeiro, J; Barbosa, E",2174,,2004,05,13,,Southern America,Brasil,Paraná,Bocaiúva do Sul,Serra da Bocaina,-49.1150016784668,-25.2061004638672,0,0,61623,,,,,,,,,,,,"1,60 m. Capítulo creme.",,,auto
2019-02-15 11:33:48-02,IPA,IPA,24875,S,Plantae,Plantae,,,Asteraceae,Baccharis,platypoda,,Baccharis platypoda,DC.,"Heiden, G.",2008,08,12,,"Harley, R.M.",19549,,1977,02,17,,Southern America,Brasil,Bahia,,"Serra das Almas, Lower NE slopes of the Pico das Almas, ca. 25 Km WNW. of the Vila do Rio de Contas. Sandstone, metamorphic and quartzite rock outcrops with associated marsh and flushes.",-41.95,-13.55,-41.95,-13.55,,,,,,,,,,,,,Herb to 2m with fleshy dull green leaves. Panicles Florets white.,IPA0024875,IPA0024875,
2019-11-27 13:46:09-03,UFS,ASE,33723,PreservedSpecimen,Plantae,Magnoliophyta,,,Asteraceae,Baccharis,platypoda,,Baccharis platypoda,DC.,"Franco, IM",2012,,,,"Mello, FNA; Nakajima, JN; Rosa, PO; Santos, APM",39,,2007,10,19,,Southern America,Brasil,Minas Gerais,Diamantina,"Estrada para Biribiri, Campo rupestre",-43.27,-18.075,-43.27,-18.075,,,,,,,,,,,,,"Arbusto ca. de 1,6m. Brácteas involucrais marrom, papílio, beira do rio.",ASE0036373,ASE0036373,
2019-11-27 13:46:09-03,UFS,ASE,15358,PreservedSpecimen,Plantae,Magnoliophyta,,,Asteraceae,Baccharis,platypoda,,Baccharis platypoda,DC.,"Ribas, OS",2009,,,,"Barbosa, E; Cordeiro, J; Lozano, E; Martin",2622,,2009,12,05,,Southern America,Brasil,Paraná,Campina Grande do Sul,Morro Camapuã,-49.0319,-25.182,-49.0319,-25.182,,,,,,,,,,,,,"Subarbusto, 80 cm. Capítulos creme. Alto do morro.; Subarbusto, 80 cm. Capítulos creme. Alto do morro.",ASE0022145,ASE0022145,
2019-11-05 16:43:42-03,UFOP,OUPR,26005,PreservedSpecimen,Plantae,,,,Asteraceae,Baccharis,platypoda,,Baccharis platypoda,DC.,"Cardoso, R.C.",2013,04,05,,"Cardoso, R.C.; Da Silva, T.C.",96,,2012,04,19,,,Brasil,Minas Gerais,Ouro Preto,"Serra de Ouro Preto, Campo Rupestre quartzítico",-43.520556,-20.363889,-43.520556,-20.363889,,,0,0,,,,,,,,,"Arbusto, flores amarelas, cerca de 2,5m de altura",,,
2019-12-18 15:50:33-03,UFOP,OUPR,26341,PreservedSpecimen,Plantae,,,,Asteraceae,Baccharis,platypoda,,Baccharis platypoda,DC.,,,,,,"Silva, T.C. da; Cardoso, R.C.",112,,2012,05,31,,,Brasil,Minas Gerais,Ouro Preto,Serra da Brígida,-43.517,-20.365056,-43.517,-20.365056,,,1586,1586,,,,,,,,,"Subarbusto, ca. 1,5m, flores branca-amareladas. Campo rupestre, ferruginoso, de alta incidência de luz.",,,
2019-11-05 16:43:42-03,UFOP,OUPR,27012,PreservedSpecimen,Plantae,,,,Asteraceae,Baccharis,platypoda,,Baccharis platypoda,DC.,"Messias, M.C.T.B.",2013,02,20,,"Ramos, M.B.C.; Messias, M.C.T.B.; Lelis, S.M. & Lopes, H.N.S.",09,,2012,10,17,,,Brasil,Minas Gerais,Ouro Branco,"Parque Estadual Serra do Ouro Branco, Coletada próximo ao balneário do PESOB",-43.675975,-20.492031,-43.675975,-20.492031,,,1247,1247,,,,,,,,,"Arbusto. Ca 1,8m alt. Papus verde claro. Mata Ripária.",,,
2019-11-05 16:43:42-03,UFOP,OUPR,27220,PreservedSpecimen,Plantae,,,,Asteraceae,Baccharis,platypoda,,Baccharis platypoda,DC.,"Sousa, H.C.",2012,05,12,,"Antunes, D.",s.n.,,2012,05,12,,,Brasil,Minas Gerais,Ouro Preto,"Parque Estadual do Itacolomi, Lagoa Seca. Campo rupestre",-43.4925,-20.431111,-43.4925,-20.431111,,,1344,1344,,,,,,,,,"Erva, flores brancas",,,
2019-11-05 16:43:42-03,UFOP,OUPR,32299,PreservedSpecimen,Plantae,,,,Asteraceae,Baccharis,platypoda,,Baccharis platypoda,DC.,"Messias, M.C.T.B.",2018,02,21,,"Onésimo, C.M.G.; Messias, M.C.T.B.",29,,2018,02,21,,,Brasil,Minas Gerais,Ouro Preto,"APA Estadual Cachoeira das Andorinhas, Experimento com topsoil (área degradada), Serra da Brígida",-43.503267,-20.362889,-43.503267,-20.362889,,,1482,1482,,,,,,,,,Sem observações anotadas,,,
2019-12-18 15:50:33-03,UFOP,OUPR,33394,PreservedSpecimen,Plantae,,,,Asteraceae,Baccharis,platypoda,,Baccharis platypoda,DC.,"Heiden, G.",2010,11,,,"Souza, V.C.; Souza, J.P.; Romão, G.O.; Araújo, A.O. &",25548,,2001,07,09,,,Brasil,Minas Gerais,Joaquim Felício,"Serra do Cabral, Estrada Joaquim Felício-Várzea da Palma, ca. 12Km de Joaquim Felício.",-44.198333,-17.69,-44.198333,-17.69,,,1050,1050,,,,,,,,,"Arbusto, capítulos jovens verdes. Afloramento rochoso com campo alagável adjacente.",,,
2020-03-12 10:28:55-03,UFOP,OUPR,33932,PreservedSpecimen,Plantae,,,,Asteraceae,Baccharis,platypoda,,Baccharis platypoda,DC.,"Messias, M.C.T.B.",2017,01,30,,"Dias, D.D.; Messias, M.C.T.B.",34,,2017,01,25,,,Brasil,Minas Gerais,Ouro Preto,"APA Cachoeira das Andorinhas, Serra da Brígida. No topsoil dentro da área minerada e abandonada.",-43.503267,-20.3629,-43.503267,-20.3629,,,1470,1470,,,,,,,,,Arbusto ca. 1 m; flores castanhas.,,,
2019-11-05 16:43:36-03,UFOP,OUPR,1948,PreservedSpecimen,Plantae,,,,Asteraceae,Baccharis,platypoda,,Baccharis platypoda,DC.,"Godoy, J.B.",,,,,s.col.,s.n.,,,,,,,Brasil,Minas Gerais,Ouro Preto,,-43.5080986022949,-20.2875003814697,0,0,44599,,0,0,,,,,,,,,Campo. Arbusto. Flores amarelas,,,auto
2019-11-05 16:43:42-03,UFOP,OUPR,4833,PreservedSpecimen,Plantae,,,,Asteraceae,Baccharis,platypoda,,Baccharis platypoda,DC.,"Lisboa, M.A.",,,,,s.col.,s.n.,,,,,,,Brasil,Minas Gerais,Ouro Preto,Alto da Caixa D'Agua,-43.5080986022949,-20.2875003814697,0,0,44599,,0,0,,,,,,,,,,,,auto
2019-11-05 16:43:42-03,UFOP,OUPR,4836,PreservedSpecimen,Plantae,,,,Asteraceae,Baccharis,platypoda,,Baccharis platypoda,DC.,"Lisboa, M.A.",1974,06,12,,"Lisboa, M.A.",s.n.,,1974,06,08,,,Brasil,Minas Gerais,Ouro Preto,Antônio Pereira,-43.5080986022949,-20.2875003814697,0,0,44599,,0,0,,,,,,,,,,,,auto
2019-11-05 16:43:36-03,UFOP,OUPR,20725,PreservedSpecimen,Plantae,,,,Asteraceae,Baccharis,platypoda,,Baccharis platypoda,DC.,,,,,,"Ataíde, E.S.",148,,2008,01,16,,,Brasil,Minas Gerais,Ouro Preto,"Antônio Pereira, Samarco - Alegria 7",-43.5080986022949,-20.2875003814697,0,0,44599,,0,0,,,,,,,,,Arbusto. Campo ferruginoso.,,,auto
2019-11-05 16:43:36-03,UFOP,OUPR,21391,PreservedSpecimen,Plantae,,,,Asteraceae,Baccharis,platypoda,,Baccharis platypoda,DC.,,,,,,"Messias, M.C.T.B.; Silva, J.L. & Tonaco, A.C.",1974,,2008,04,04,,,Brasil,Minas Gerais,Mariana,"Bento Rodrigues, Estrada para Santa Rita Durão",-43.4160995483398,-20.377799987793,0,0,33524,,0,0,,,,,,,,,"Arbusto 1,7m. Flores amarelas. Em campos rupestres quartzitico. Em platôs arenosos úmidos",,,auto
2019-11-05 16:43:42-03,UFOP,OUPR,8907,PreservedSpecimen,Plantae,,,,Asteraceae,Baccharis,platypoda,,Baccharis platypoda,DC.,"Messias, M.C.T.B.",2000,06,12,,"Santos, V.R.L.",09,,1999,10,02,,,Brasil,Minas Gerais,Ouro Preto,Cachoeira das Androinhas,-43.5080986022949,-20.2875003814697,0,0,44599,,0,0,,,,,,,,,,,,auto
2019-11-05 16:43:42-03,UFOP,OUPR,9849,PreservedSpecimen,Plantae,,,,Asteraceae,Baccharis,platypoda,,Baccharis platypoda,DC.,"Messias, M.C.T.B.",2000,10,30,,"Silveira, A.L.",157,,2000,05,19,,,Brasil,Minas Gerais,Ouro Preto,Cachoeira das Androinhas,-43.5080986022949,-20.2875003814697,0,0,44599,,0,0,,,,,,,,,Flores verde-amareladas. Com perfume adocicado,,,auto
2019-11-05 16:43:42-03,UFOP,OUPR,4828,PreservedSpecimen,Plantae,,,,Asteraceae,Baccharis,platypoda,,Baccharis platypoda,DC.,"Badini, J.",1970,,,,"Zurlo, M.A.",s.n.,,,,,,,Brasil,Minas Gerais,Ouro Preto,Camarinhas,-43.5080986022949,-20.2875003814697,0,0,44599,,0,0,,,,,,,,,Campo. Arbusto. Flores pálidas,,,auto
2019-11-05 16:43:42-03,UFOP,OUPR,9251,PreservedSpecimen,Plantae,,,,Asteraceae,Baccharis,platypoda,,Baccharis platypoda,DC.,"Schneider, A (LEFB); Heiden, G.",2012,,,,"Nogueira, R.E.",13,,1999,08,21,,,Brasil,Minas Gerais,Ouro Preto,Camarinhas,-43.5080986022949,-20.2875003814697,0,0,44599,,0,0,,,,,,,,,"Campo rupestre. Arbusto 1,50m",,,auto
2019-11-05 16:43:42-03,UFOP,OUPR,4831,PreservedSpecimen,Plantae,,,,Asteraceae,Baccharis,platypoda,,Baccharis platypoda,DC.,"Badini, J.",1979,05,24,,"Badini, J.",s.n.,,,,,,,Brasil,Minas Gerais,Ouro Preto,Camarinhas,-43.5080986022949,-20.2875003814697,0,0,44599,,0,0,,,,,,,,,Capoeira. Arbusto. Flores pálidas,,,auto
2019-11-05 16:43:42-03,UFOP,OUPR,4064,PreservedSpecimen,Plantae,,,,Asteraceae,Baccharis,platypoda,,Baccharis platypoda,DC.,"Schneider, A (LEFB); Heiden, G.",2012,,,,s.col.,s.n.,,,,,,,Brasil,Minas Gerais,Ouro Preto,Chapada,-43.5080986022949,-20.2875003814697,0,0,44599,,0,0,,,,,,,,,,,,auto
2019-11-05 16:43:42-03,UFOP,OUPR,4824,PreservedSpecimen,Plantae,,,,Asteraceae,Baccharis,platypoda,,Baccharis platypoda,DC.,"Lisboa, M.A.",1972,05,28,,s.col.,s.n.,,,,,,,Brasil,Minas Gerais,Ouro Preto,Chapada,-43.5080986022949,-20.2875003814697,0,0,44599,,0,0,,,,,,,,,,,,auto
2019-11-05 16:43:42-03,UFOP,OUPR,4827,PreservedSpecimen,Plantae,,,,Asteraceae,Baccharis,platypoda,,Baccharis platypoda,DC.,"Badini, J.",1972,05,28,,"Badini, J.",s.n.,,1972,05,28,,,Brasil,Minas Gerais,Ouro Preto,Chapada,-43.5080986022949,-20.2875003814697,0,0,44599,,0,0,,,,,,,,,Campo. Arbusto. Flores pálidas,,,auto
2019-11-05 16:43:42-03,UFOP,OUPR,4838,PreservedSpecimen,Plantae,,,,Asteraceae,Baccharis,platypoda,,Baccharis platypoda,DC.,"Badini, J.",1977,06,07,,"Badini, J.",s.n.,,1977,06,05,,,Brasil,Minas Gerais,Ouro Preto,Falcão,-43.5080986022949,-20.2875003814697,0,0,44599,,0,0,,,,,,,,,Beira de corrego. Arbusto. Flores amarelas,,,auto
2019-11-05 16:43:42-03,UFOP,OUPR,4830,PreservedSpecimen,Plantae,,,,Asteraceae,Baccharis,platypoda,,Baccharis platypoda,DC.,"Badini, J.",1970,,,,"Zurlo, M.A.",s.n.,,,,,,,Brasil,Minas Gerais,Ouro Preto,Itacolomi,-43.5080986022949,-20.2875003814697,0,0,44599,,0,0,,,,,,,,,Campo. Arbusto. Flores pálidas,,,auto
2019-11-05 16:43:42-03,UFOP,OUPR,4832,PreservedSpecimen,Plantae,,,,Asteraceae,Baccharis,platypoda,,Baccharis platypoda,DC.,"Lisboa, M.A.",1974,05,22,,s.col.,s.n.,,1895,06,,,,Brasil,Minas Gerais,Ouro Preto,Morro da Forca,-43.5080986022949,-20.2875003814697,0,0,44599,,0,0,,,,,,,,,,,,auto
2019-11-05 16:43:42-03,UFOP,OUPR,4835,PreservedSpecimen,Plantae,,,,Asteraceae,Baccharis,platypoda,,Baccharis platypoda,DC.,"Lisboa, M.A.",1974,06,14,,"Lisboa, M.A.",s.n.,,1974,06,13,,,Brasil,Minas Gerais,Ouro Preto,Morro do Cruzeiro,-43.5080986022949,-20.2875003814697,0,0,44599,,0,0,,,,,,,,,,,,auto
2019-11-05 16:43:42-03,UFOP,OUPR,4821,PreservedSpecimen,Plantae,,,,Asteraceae,Baccharis,platypoda,,Baccharis platypoda,DC.,"Lisboa, M.A.",1972,06,27,,"Lisboa, M.A.",s.n.,,1972,06,25,,,Brasil,Minas Gerais,Ouro Preto,Morro do Cruzeiro,-43.5080986022949,-20.2875003814697,0,0,44599,,0,0,,,,,,,,,,,,auto
