MODIFIED,INSTITUTIONCODE,COLLECTIONCODE,CATALOGNUMBER,BASISOFRECORD,KINGDOM,PHYLUM,CLASS,ORDER,FAMILY,GENUS,SPECIFICEPITHET,INFRASPECIFICEPITHET,SCIENTIFICNAME,SCIENTIFICNAMEAUTHORSHIP,IDENTIFIEDBY,YEARIDENTIFIED,MONTHIDENTIFIED,DAYIDENTIFIED,TYPESTATUS,RECORDEDBY,RECORDNUMBER,FIELDNUMBER,YEAR,MONTH,DAY,EVENTTIME,CONTINENTOCEAN,COUNTRY,STATEPROVINCE,COUNTY,LOCALITY,DECIMALLONGITUDE,DECIMALLATITUDE,VERBATIMLONGITUDE,VERBATIMLATITUDE,COORDINATEPRECISION,BOUNDINGBOX,MINIMUMELEVATIONINMETERS,MAXIMUMELEVATIONINMETERS,MINIMUMDEPTHINMETERS,MAXIMUMDEPTHINMETERS,SEX,PREPARATIONTYPE,INDIVIDUALCOUNT,PREVIOUSCATALOGNUMBER,RELATIONSHIPTYPE,RELATEDCATALOGITEM,OCCURRENCEREMARKS,BARCODE,IMAGECODE,GEOFLAG
2021-05-07 17:21:04-03,UFMG,BHCB,133696,PreservedSpecimen,Plantae,Dicotyledon,,,Asteraceae,Baccharis,platypoda,,Baccharis platypoda,DC.,,2013,07,08,,"Meireles, LD; Egea, MM; Nunes, JA",2493,,2006,07,28,,Southern America,Brasil,Minas Gerais,Passa Quatro,"Serra Fina, Capim Amarelo.",-44.893222,-22.442056,-44.893222,-22.442056,,,1974,2037,,,,,,,,,"Arbusto, capítulos creme.; Campo de Nifelina.",BHCB008832,,
2021-05-07 17:21:04-03,UFMG,BHCB,133697,PreservedSpecimen,Plantae,Dicotyledon,,,Asteraceae,Baccharis,platypoda,,Baccharis platypoda,DC.,,,,,,"Meireles, LD; Nunes, JA",1952,,2005,08,10,,Southern America,Brasil,Minas Gerais,Passa Quatro,"Serra Fina, Capim Amarelo, Médio.",-44.893222,-22.442056,-44.893222,-22.442056,,,1974,2037,,,,,,,,,Plantas do Brasil.; Arbusto ereto. Capítulos creme-amarelado.; Campo de Nifelina.,,,
2021-06-08 16:21:38-03,UFMG,BHCB,135839,PreservedSpecimen,Plantae,Dicotyledon,,,Asteraceae,Baccharis,platypoda,,Baccharis platypoda,DC.,,2007,,,,"Forzza, RC; Magenta, MAG; Aona, LYS; Berman, E; Saavedra, MM; Zappi, DC",3525,,2004,07,26,,Southern America,Brasil,Minas Gerais,Lima Duarte,"Parque Estadual do Ibitipoca, Gruta dos Três Arcos.",-43.883056,-21.678889,-43.883056,-21.678889,,,1670,1670,,,,,,,,,"Arbusto 1,3 - 1,6 m alt. Flores creme.; Borda da mata de grotão.",,,
2021-05-07 17:21:04-03,UFMG,BHCB,136299,PreservedSpecimen,Plantae,Dicotyledon,,,Asteraceae,Baccharis,platypoda,,Baccharis platypoda,DC.,,,,,,"Bünger, MO; Fernandes, AC; Silva, MH; Ribeiro, ASS; Oliveira Filho, AT de",342,,2010,03,05,,Southern America,Brasil,Minas Gerais,Espera Feliz,"Parque Nacional do Caparaó, Trilha da Macieira para a cachoeira do Aurélio.",-41.829694,-20.480778,-41.829694,-20.480778,,,1857,1857,,,,,,,,,"Arbusto, aprox. 1m. Flores masculinas e femininas.",,,
2021-05-07 17:21:04-03,UFMG,BHCB,136353,PreservedSpecimen,Plantae,Dicotyledon,,,Asteraceae,Baccharis,platypoda,,Baccharis platypoda,DC.,,,,,,"Bünger, MO; Fernandes, AC; Silva, MH; Ribeiro, ASS",422,,2010,03,09,,Southern America,Brasil,Minas Gerais,Alto Caparaó,"Parque Nacional do Caparaó, Trilha Pico da Bandeira - Terreirão.",-41.795833,-20.434778,-41.795833,-20.434778,,,2890,2890,,,,,,,,,"Arbusto, 50 cm alt. Capítulos pistilados e estaminados.; Campo sobre afloramento.",,,
2021-06-08 16:21:38-03,UFMG,BHCB,136926,PreservedSpecimen,Plantae,Dicotyledon,,,Asteraceae,Baccharis,platypoda,,Baccharis platypoda,DC.,,2010,06,,,"Martins da Costa, IR; Borsali, EF; Miranda, MD; Toledo, MM",234,,2010,03,04,,Southern America,Brasil,Minas Gerais,Espera Feliz,"Parque Nacional do Caparaó, Estrada para a Macieira.",-41.819167,-20.500278,-41.819167,-20.500278,,,1470,1470,,,,,,,,,Arvoreta ca. 4m. Botões florais esverdeados.,,,
2021-05-07 17:21:04-03,UFMG,BHCB,140942,PreservedSpecimen,Plantae,Dicotyledon,,,Asteraceae,Baccharis,platypoda,,Baccharis platypoda,DC.,,,,,,"Neves, DRM; Martins, A; Martins, LC; Hughes, FM",678,,2010,03,03,,Southern America,Brasil,Minas Gerais,Alto Caparaó,"Parque Nacional do Caparaó, Trilha entre a Tronqueira e o Rancho dos Cabritos.",-41.836944,-20.41,-41.836944,-20.41,,,1755,1755,,,,,,,,,,,,
2021-05-07 17:21:04-03,UFMG,BHCB,140971,PreservedSpecimen,Plantae,Dicotyledon,,,Asteraceae,Baccharis,platypoda,,Baccharis platypoda,DC.,,,,,,"Neves, DRM; Martins, A; Martins, LC; Hughes, FM",707,,2010,03,03,,Southern America,Brasil,Minas Gerais,Alto Caparaó,"Parque Nacional do Caparaó, Trilha entre a Tronqueira e o Rancho dos Cabritos.",-41.829722,-20.413611,-41.829722,-20.413611,,,2121,2121,,,,,,,,,,,,
2021-05-07 17:21:04-03,UFMG,BHCB,141968,PreservedSpecimen,Plantae,Dicotyledon,,,Asteraceae,Baccharis,platypoda,,Baccharis platypoda,DC.,,,,,,"Oliveira, CT; Giacomin, LL",41,,2008,08,26,,Southern America,Brasil,Minas Gerais,Catas Altas,"RPPN Santuário do Caraça, Pico Conceição.",-43.526667,-20.094444,-43.526667,-20.094444,,,1780,1780,,,,,,,,,"Arbusto 1,5m, capítulos verdes.",,,
2021-05-07 17:21:04-03,UFMG,BHCB,142295,PreservedSpecimen,Plantae,Dicotyledon,,,Asteraceae,Baccharis,platypoda,,Baccharis platypoda,DC.,,,,,,"Oliveira, CT; Giacomin, LL; Viveros, RS",393,,2009,04,24,,Southern America,Brasil,Minas Gerais,Catas Altas,"RPPN Santuário do Caraça, Pico do Sol.",-43.451667,-20.109444,-43.451667,-20.109444,,,1828,1828,,,,,,,,,"Arbusto de 1,5m, capítulos cremes com resina recobrindo os mais jovens.",,,
2021-06-08 16:21:38-03,UFMG,BHCB,160003,PreservedSpecimen,Plantae,Dicotyledon,,,Asteraceae,Baccharis,platypoda,,Baccharis platypoda,DC.,,2012,05,,,"Vidal, CV; Paula-Souza, J",1058,,2012,04,20,,Southern America,Brasil,Minas Gerais,Brumadinho,Serra da Moeda,-43.970386,-20.119969,-43.970386,-20.119969,,,0,0,,,,,,,,,Arbustivo.; Campo limpo.,,,
2021-05-07 17:21:06-03,UFMG,BHCB,172336,PreservedSpecimen,Plantae,Dicotyledon,,,Asteraceae,Baccharis,platypoda,,Baccharis platypoda,DC.,,2015,03,,,"Perillo, LN",444,,2009,11,14,,Southern America,Brasil,Minas Gerais,Catas Altas,"RPPN Santuário do Caraça, Trilha para o Pico do Sol",-43.4611,-20.1069,-43.4611,-20.1069,,,1750,1750,,,,,,,,,Coordenadas aproximadas.; Arborescente.; Perto de afloramento rochoso.,BHCB022881,,
2021-05-07 17:21:06-03,UFMG,BHCB,172410,PreservedSpecimen,Plantae,Dicotyledon,,,Asteraceae,Baccharis,platypoda,,Baccharis platypoda,DC.,,2010,09,,,"Valpassos, E",7,,1991,05,26,,Southern America,Brasil,Espírito Santo,Domingos Martins,Reserva Florestal da Pedra Azul.,-40.991389,-20.392222,-40.991389,-20.392222,,,1699,1699,,,,,,,,,Flor verde.,BHCB017548,,
2020-12-11 11:32:25-03,UFMG,BHCB,172416,PreservedSpecimen,Plantae,Dicotyledon,,,Asteraceae,Baccharis,platypoda,,Baccharis platypoda,DC.,,2010,09,,,"Kollmann, L; Leme, E; Couto, D",11642,,2009,06,05,,Southern America,Brasil,Espírito Santo,Alegre,Pedra da Caveira da Anta,-41.389167,-39.340833,-41.389167,-39.340833,,,1484,1484,,,,,,,,,"Arbusto rupícola ao sol, flores brancas.",BHCB017545,,
2021-05-07 17:21:06-03,UFMG,BHCB,172436,PreservedSpecimen,Plantae,Dicotyledon,,,Asteraceae,Baccharis,platypoda,,Baccharis platypoda,DC.,,2007,05,03,,"Esgario, C; Fontana, AP",33,,2006,07,16,,Southern America,Brasil,Espírito Santo,São Roque do Canaã,"Alto Misterioso, pedra 6.",-40.769722,-19.802917,-40.769722,-19.802917,,,1080,1080,,,,,,,,,"Arbusto 1,5m, heliófila, flores cremes com cálice verde.",BHCB017559,,
2020-12-11 11:32:26-03,UFMG,BHCB,178351,PreservedSpecimen,Plantae,Dicotyledon,,,Asteraceae,Baccharis,platypoda,,Baccharis platypoda,DC.,,2019,03,19,,"Augsten, M; Mota, NFO; Souza, PG; Martins, LC",474,,2010,07,15,,Southern America,Brasil,Minas Gerais,Serro,"Monumento Natural Estadual Várzea do Lajeado, Lajeado de Milho Verde",-43.4899,-18.469842,-43.4899,-18.469842,,,1078,1078,,,,,,,,,,BHCB031193,,
2020-12-11 11:32:26-03,UFMG,BHCB,178352,PreservedSpecimen,Plantae,Dicotyledon,,,Asteraceae,Baccharis,platypoda,,Baccharis platypoda,DC.,,,,,,"Augsten, M; Mota, NFO; Souza, PG; Martins, LC",477,,2010,07,15,,Southern America,Brasil,Minas Gerais,Serro,"Monumento Natural Estadual Várzea do Lajeado, Lajeado de Milho Verde",-43.4899,-18.469842,-43.4899,-18.469842,,,1078,1078,,,,,,,,,,BHCB031348,,
2021-05-07 17:21:06-03,UFMG,BHCB,178619,PreservedSpecimen,Plantae,Dicotyledon,,,Asteraceae,Baccharis,platypoda,,Baccharis platypoda,DC.,,2015,11,,,"Paiva, JAM; Tomich, S; Nascimento, L",618,,2015,08,19,,Southern America,Brasil,Minas Gerais,Itabirito,RPPN Cata Branca,-43.848611,-20.228611,-43.848611,-20.228611,,,0,0,,,,,,,,,"Arbusto, ca. 0,8m alt. Inflorescência imatura verde.; Campo Rupestre Quartzítico.",,,
2021-05-07 17:21:06-03,UFMG,BHCB,179192,PreservedSpecimen,Plantae,Dicotyledon,,,Asteraceae,Baccharis,platypoda,,Baccharis platypoda,DC.,,2015,11,,,"Pivari, MOD; Paiva, JAM; Tomich, S; Nascimento, L",2736,,2015,10,13,,Southern America,Brasil,Minas Gerais,Itabirito,RPPN Capivari II,-43.6507,-20.1522,-43.6507,-20.1522,,,0,0,,,,,,,,,"Prensado em álcool; Arbusto, ca. 1,7m alt. Folhas cobertas por mucilagem; capítulos cremes.; Campo Rupestre Quartzítico",,,
2021-05-07 17:21:06-03,UFMG,BHCB,181350,PreservedSpecimen,Plantae,Dicotyledon,,,Asteraceae,Baccharis,platypoda,,Baccharis platypoda,DC.,,2015,04,13,,"Souza, DT de",s.n.,,2014,04,29,,Southern America,Brasil,Minas Gerais,Caeté,Serra do Gandarela,-43.683561,-20.023381,-43.683561,-20.023381,,,0,0,,,,,,,,,Arbustivo.; Campo cerrado.,BHCB038007,,
2021-05-07 17:21:06-03,UFMG,BHCB,184413,PreservedSpecimen,Plantae,Dicotyledon,,,Asteraceae,Baccharis,platypoda,,Baccharis platypoda,DC.,,2017,01,26,,"Mota, RC da; Vasconcelos, MF de",3770,,2016,06,15,,Southern America,Brasil,Minas Gerais,Riacho dos Machados,Vale do Esmeril,-42.721944,-16.1125,-42.721944,-16.1125,,,745,745,,,,,,,,,Projeto desenvolvido pelo Instituto Prístino!; Arbusto. Flores branco-esverdeadas.; Mata de Galeria.,BHCB040087,,
2021-05-07 17:21:06-03,UFMG,BHCB,189778,PreservedSpecimen,Plantae,Dicotyledon,,,Asteraceae,Baccharis,platypoda,,Baccharis platypoda,DC.,,2017,07,05,,"Quaresma, AS; Oliveira, CT",521,,2017,05,24,,Southern America,Brasil,Minas Gerais,Itambé do Mato Dentro,,-43.316389,-19.374722,-43.316389,-19.374722,,,0,0,,,,,,,,,Erva até 50 cm alt. Flores lilases.; Campo rupestre quartzítico.,BHCB189778,,
2021-05-07 17:21:06-03,UFMG,BHCB,190882,PreservedSpecimen,Plantae,Dicotyledon,,,Asteraceae,Baccharis,platypoda,,Baccharis platypoda,DC.,,,,,,"Vidal, CV",s.n.,,2018,04,23,,Southern America,Brasil,Minas Gerais,Mariana,Complexo Germano,-43.520833,-20.158611,-43.520833,-20.158611,,,1429,1429,,,,,,,,,Campo Rupestre sobre Canga.,BHCB190882,,
2021-06-08 16:21:38-03,UFMG,BHCB,194710,PreservedSpecimen,Plantae,Dicotyledon,,,Asteraceae,Baccharis,platypoda,,Baccharis platypoda,DC.,,2019,04,,,"Tameirão Neto, E; Viana, PL; Carvalho, WAC",5806,,2012,07,04,,Southern America,Brasil,Minas Gerais,Ouro Preto,RPPN Capanema,-43.587028,-20.214986,-43.587028,-20.214986,,,1640,1640,,,,,,,,,"Arbustivo, 1,5m. Flor creme.; Campo Rupestre Quartzítico.",BHCB194710,,
2021-05-07 17:21:06-03,UFMG,BHCB,195445,PreservedSpecimen,Plantae,Dicotyledon,,,Asteraceae,Baccharis,platypoda,,Baccharis platypoda,DC.,,,,,,"Quaresma, AS",862,,2017,06,20,,Southern America,Brasil,Minas Gerais,Itabira,Serra dos Alves,-43.460833,-19.461389,-43.460833,-19.461389,,,985,1015,,,,,,,,,Campo rupestre quatzítico.,BHCB195445,,
2021-05-07 17:21:06-03,UFMG,BHCB,195446,PreservedSpecimen,Plantae,Dicotyledon,,,Asteraceae,Baccharis,platypoda,,Baccharis platypoda,DC.,,,,,,"Quaresma, AS",861,,2017,06,22,,Southern America,Brasil,Minas Gerais,Itabira,Serra dos Alves,-43.478056,-19.469167,-43.478056,-19.469167,,,1220,1280,,,,,,,,,Campo rupestre quatzítico.,BHCB195446,,
2021-05-07 17:21:06-03,UFMG,BHCB,197580,PreservedSpecimen,Plantae,Dicotyledon,,,Asteraceae,Baccharis,platypoda,,Baccharis platypoda,DC.,,,,,,"Ferreira, VL; Araujo, FF; Marques, GM; Moreira, VA",233,,2019,03,28,,Southern America,Brasil,Minas Gerais,Itabira,"Serra dos Alves, Ipoema. Trilha Morro do Redondo. Trilha da Igreja.",-43.467222,-19.492222,-43.467222,-19.492222,,,640,640,,,,,,,,,Campo Rupestre.,BHCB197580,,
2021-05-07 17:21:06-03,UFMG,BHCB,197894,PreservedSpecimen,Plantae,Dicotyledon,,,Asteraceae,Baccharis,platypoda,,Baccharis platypoda,DC.,,,,,,"Rezende, SG; Justo, AG",6901,,2018,09,04,,Southern America,Brasil,Minas Gerais,Rio Acima,Serra do Gandarela,-43.674444,-20.030278,-43.674444,-20.030278,,,1493,1493,,,,,,,,,Arbusto.; Floresta Estacional Semidecidual em Estágio Avançado de Regeneração.,BHCB197894,,
2021-06-08 16:21:38-03,UFMG,BHCB,201927,PreservedSpecimen,Plantae,Dicotyledon,,,Asteraceae,Baccharis,platypoda,,Baccharis platypoda,DC.,,2019,09,,,"Rezende, SG",7384,,2019,05,22,,Southern America,Brasil,Minas Gerais,Conceição do Mato Dentro,Parque Estadual da Serra do Intendente,-43.571389,-19.103889,-43.571389,-19.103889,,,0,0,,,,,,,,,"Floração, Creme, Arbusto, Rupícola; Terrícola; Campo Rupestre Quartzítico",BHCB201927,,
2021-06-08 16:21:38-03,UFMG,BHCB,202683,PreservedSpecimen,Plantae,Dicotyledon,,,Asteraceae,Baccharis,platypoda,,Baccharis platypoda,DC.,,,,,,"Rezende, SG; Justo, AG",7924,,2019,05,07,,Southern America,Brasil,Minas Gerais,Caeté,"Morro Vermelho., Serra do Gandarela",-43.684722,-20.043056,-43.684722,-20.043056,,,0,0,,,,,,,,,Arbusto; Canga ferruginosa,BHCB202683,,
2021-06-08 16:21:38-03,UFMG,BHCB,203304,PreservedSpecimen,Plantae,Dicotyledon,,,Asteraceae,Baccharis,platypoda,,Baccharis platypoda,DC.,,2019,12,,,"Meyer, PB",3271,,2019,06,27,,Southern America,Brasil,Minas Gerais,Jaboticatubas,"Parque Nacional da Serra do Cipó, Altamira",-43.546944,-19.49,-43.546944,-19.49,,,,,,,,,,,,,Arbusto. Flores creme.; Campo Rupestre Quartzítico,BHCB203304,,
2021-06-08 16:21:38-03,UFMG,BHCB,203342,PreservedSpecimen,Plantae,Dicotyledon,,,Asteraceae,Baccharis,platypoda,,Baccharis platypoda,DC.,,,,,,"Brina, AE",s.n.,,2019,08,21,,Southern America,Brasil,Minas Gerais,Diamantina,Parque Estadual do Biribiri,-43.603611,-18.190556,-43.603611,-18.190556,,,,,,,,,,,,,,BHCB203342,,
2021-06-08 16:21:38-03,UFMG,BHCB,203343,PreservedSpecimen,Plantae,Dicotyledon,,,Asteraceae,Baccharis,platypoda,,Baccharis platypoda,DC.,,2019,12,,,"Junqueira, PA",227,,2019,08,21,,Southern America,Brasil,Minas Gerais,Diamantina,Parque Estadual do Biribiri,-43.599722,-18.185,-43.599722,-18.185,,,,,,,,,,,,,Arbusto.; CAmpo Rupestre Quartzítico,BHCB203343,,
2021-06-18 17:37:27-03,UFMG,BHCB,38845,PreservedSpecimen,Plantae,Dicotyledon,,,Asteraceae,Baccharis,platypoda,,Baccharis platypoda,DC.,,2017,03,,,"Stehmann, JR; Salino, A; Vasconcelos, MF de",2302,,1997,08,30,,Southern America,Brasil,Minas Gerais,Santa Bárbara,Serra do Caraça,-43.479167,-20.096111,-43.479167,-20.096111,,,0,0,,,,,,,,,,BHCB025075,,
2021-06-18 17:37:27-03,UFMG,BHCB,32154,PreservedSpecimen,Plantae,Dicotyledon,,,Asteraceae,Baccharis,platypoda,,Baccharis platypoda,DC.,,1991,05,,,"Valpassos, E",11,,1991,05,26,,Southern America,Brasil,Espírito Santo,Domingos Martins,Reserva Florestal da Pedra Azul.,-40.006944,-20.392222,-40.006944,-20.392222,,,1500,1500,,,,,,,,,Coordenadas 20°23'32'' a 20°29'24''S e 40°00'25'' a 40°59'29''W.; Planta de 1m.,,,
2021-06-18 17:37:27-03,UFMG,BHCB,47802,PreservedSpecimen,Plantae,Dicotyledon,,,Asteraceae,Baccharis,platypoda,,Baccharis platypoda,DC.,,2000,04,,,"Lombardi, JA",3041,,1999,06,12,,Southern America,Brasil,Minas Gerais,São Gonçalo do Rio Preto,"Parque Estadual do Rio Preto, Entre o Riacho das Éguas e a referência de coordenada.",-43.35,-18.133333,-43.35,-18.133333,,,0,0,,,,,,,,,"Plantas do Brasil.; Arbusto, ca. 1,5m. Folhas coriáceas. Inflorescências amareladas, jovens cobertas por resina. Flores creme. Perfume doce.; Cerrado.",,,
2021-06-18 17:37:27-03,UFMG,BHCB,48057,PreservedSpecimen,Plantae,Dicotyledon,,,Asteraceae,Baccharis,platypoda,,Baccharis platypoda,DC.,,2000,08,,,"Lombardi, JA",3080,,1999,07,10,,Southern America,Brasil,Minas Gerais,Fervedouro,Parque Estadual da Serra do Brigadeiro,-42.485833,-20.716111,-42.485833,-20.716111,,,1400,1400,,,,,,,,,"Plantas do Brasil. Coordenadas 20°42'58 - 20°43'19S, 42°29'09 - 42°29'02W.; Arbusto, ca. 0,5m. Folhas coriáceas, brácteas verde-rosadas, flores brancas.; Mata Atlântica em diversos graus de perturbação, margem de estrada.",,,
2021-06-08 16:21:38-03,UFMG,BHCB,60998,PreservedSpecimen,Plantae,Dicotyledon,,,Asteraceae,Baccharis,platypoda,,Baccharis platypoda,DC.,,1989,05,,,"Harley, RM; Giulietti, AM; Stannard, BL; Hind, DJN; Kameyama, C; Prado, J; Rudall, P; Simão",25093,,1988,10,16,,Southern America,Brasil,Minas Gerais,Grão Mogol,Ca. 5-15 km ao norte da cidade.,-42.783333,-16.533333,-42.783333,-16.533333,,,900,900,,,,,,,,,"Projeto Campos Rupestres do Brasil.; Arbusto até 1,5m alt., ereto, pouco ramificado. Folhas e capítulos cheirosos.; Campo rupestre. Solo arenoso e afloramento quartzítico.",,,
2021-05-07 17:21:06-03,UFMG,BHCB,6218,PreservedSpecimen,Plantae,Dicotyledon,,,Asteraceae,Baccharis,platypoda,,Baccharis platypoda,DC.,,,,,,"Paula, J; Grandi, TSM",1822,,1985,06,06,,Southern America,Brasil,Minas Gerais,Caeté,Serra da Piedade,-43.666667,-19.816667,-43.666667,-19.816667,,,1720,1720,,,,,,,,,Arbustivo.; Campo rupestre.,,,
2021-05-07 17:21:06-03,UFMG,BHCB,73702,PreservedSpecimen,Plantae,Dicotyledon,,,Asteraceae,Baccharis,platypoda,,Baccharis platypoda,DC.,,,,,,"Viana, PL",156,,2001,08,20,,Southern America,Brasil,Minas Gerais,Brumadinho,Retiro das Pedras,-43.983611,-20.093056,-43.983611,-20.093056,,,1400,1400,,,,,,,,,"Plantas do Brasil.; Arbusto 1,5m.",,,
2021-06-08 16:21:38-03,UFMG,BHCB,88314,PreservedSpecimen,Plantae,Dicotyledon,,,Asteraceae,Baccharis,platypoda,,Baccharis platypoda,DC.,,2004,05,,,"Viana, PL; Mota, NFO; Melo, PHA de; Morais, PO",1498,,2004,04,02,,Southern America,Brasil,Minas Gerais,São Gonçalo do Rio Preto,"Parque Estadual do Rio Preto, Pico Dois Irmãos (Pico II).",-43.308083,-18.205778,-43.308083,-18.205778,,,1802,1802,,,,,,,,,Plantas do Brasil.; Arbusto 2-3m. Flores creme.; Entre fendas de rochas.,,,
2021-06-18 17:37:27-03,UFMG,BHCB,34222,PreservedSpecimen,Plantae,Dicotyledon,,,Asteraceae,Baccharis,platypoda,,Baccharis platypoda,DC.,,1996,,,,"Hatschbach, G; Hatschbach, M; Silva, JM",65259,,1996,07,07,,Southern America,Brasil,Espírito Santo,Alfredo Chaves,Estrada São Bento de Urânia a Castelinho.,-40.749698638916,-20.6350002288818,0,0,32447,,900,1000,,,,,,,,,"Arbusto 1,5m. Capítulo creme.; Encosta de morro com solo arenoso e vegetação baixa.",,,auto
2020-12-11 11:32:25-03,UFMG,BHCB,165179,PreservedSpecimen,Plantae,Dicotyledon,,,Asteraceae,Baccharis,platypoda,,Baccharis platypoda,DC.,,,,,,"Freitas, FS; Falcão, BF",44,,2013,05,30,,Southern America,Brasil,Espírito Santo,Castelo,"Parque Estadual do Forno Grande, Trilha para o Mirante",-41.184700012207,-20.6035995483398,0,0,23588,,0,0,,,,,,,,,Anteras amarelas. População grande,,,auto
2021-05-07 17:21:06-03,UFMG,BHCB,172851,PreservedSpecimen,Plantae,Dicotyledon,,,Asteraceae,Baccharis,platypoda,,Baccharis platypoda,DC.,,2010,09,,,"Kollmann, L; Fontana, AP; Esgario, C",9146,,2006,05,31,,Southern America,Brasil,Espírito Santo,Castelo,Parque Estadual Forno Grande,-41.184700012207,-20.6035995483398,0,0,23588,,0,0,,,,,,,,,Arbusto 1m. Rupestre no sol. Flores verdes e estames amarelos.; Rupestre,BHCB017570,,auto
2021-05-07 17:21:06-03,UFMG,BHCB,172411,PreservedSpecimen,Plantae,Dicotyledon,,,Asteraceae,Baccharis,platypoda,,Baccharis platypoda,DC.,,2010,09,,,"Kollmann, L; Kollmann, RL",6617,,2004,04,09,,Southern America,Brasil,Espírito Santo,Castelo,Parque Estadual Forno Grande,-41.184700012207,-20.6035995483398,0,0,23588,,1100,1100,,,,,,,,,"Arbusto 1m no sol, flores verdes.; Solo úmido.",BHCB017557,,auto
2021-05-07 17:21:06-03,UFMG,BHCB,172861,PreservedSpecimen,Plantae,Dicotyledon,,,Asteraceae,Baccharis,platypoda,,Baccharis platypoda,DC.,,2010,09,,,"Kollmann, L; Kollmann, RL; Fontana, AP; Esgario, C",7557,,2005,03,25,,Southern America,Brasil,Espírito Santo,Castelo,Parque Estadual Forno Grande,-41.184700012207,-20.6035995483398,0,0,23588,,0,0,,,,,,,,,"Arbusto 1m, no sol, rupestre. Flores brancas.",BHCB017560,,auto
2021-05-07 17:21:06-03,UFMG,BHCB,172854,PreservedSpecimen,Plantae,Dicotyledon,,,Asteraceae,Baccharis,platypoda,,Baccharis platypoda,DC.,,2010,09,,,"Kollmann, L; Labiak, P; Matos, FB",9980,,2007,07,19,,Southern America,Brasil,Espírito Santo,Castelo,"Parque Estadual Forno Grande, Parque Estadual de Forno Grande",-41.184700012207,-20.6035995483398,0,0,23588,,1660,1660,,,,,,,,,"Arbusto 1m no sol, capítulos verdes.",BHCB017567,,auto
2021-06-18 17:37:27-03,UFMG,BHCB,40375,PreservedSpecimen,Plantae,Dicotyledon,,,Asteraceae,Baccharis,platypoda,,Baccharis platypoda,DC.,,2002,11,,,"Vasconcelos, MF de",s.n.,,1998,02,11,,Southern America,Brasil,Espírito Santo,Domingos Martins,"Parque Estadual da Pedra Azul, Pedra das Flores.",-40.6591987609863,-20.3633003234863,0,0,48150,,1909,1909,,,,,,,,,Plantas do Brasil. Flores visitadas por muitas espécies de Diptera. Fotografada.; Arbustivo.; Campo de altitude.,,,auto
2020-12-11 11:32:25-03,UFMG,BHCB,172412,PreservedSpecimen,Plantae,Dicotyledon,,,Asteraceae,Baccharis,platypoda,,Baccharis platypoda,DC.,,2010,09,,,"Kollmann, L; Fontana, AP; Labiak, P; Kaehler, M; Matos, FB",9923,,2007,07,17,,Southern America,Brasil,Espírito Santo,Itaguaçu,Caparaó,-40.855598449707,-19.8019008636475,0,0,26990,,700,700,,,,,,,,,"Arbusto 1m, no sol.",BHCB017556,,auto
2021-05-07 17:21:06-03,UFMG,BHCB,172857,PreservedSpecimen,Plantae,Dicotyledon,,,Asteraceae,Baccharis,platypoda,,Baccharis platypoda,DC.,,,,,,"Couto, DR; Couto, TR",542,,2008,06,22,,Southern America,Brasil,Espírito Santo,Mimoso do Sul,"Pedra dos Pontões, Jardim dos Pontões.",-41.3664016723633,-21.0641994476318,0,0,29430,,800,800,,,,,,,,,"Rupícola arbustiva, 2,2m. Inflorescência verde.",BHCB017564,,auto
2021-05-07 17:21:06-03,UFMG,BHCB,172858,PreservedSpecimen,Plantae,Dicotyledon,,,Asteraceae,Baccharis,platypoda,,Baccharis platypoda,DC.,,2008,01,05,,"Couto, DR; Couto, TR",274,,2005,04,21,,Southern America,Brasil,Espírito Santo,Mimoso do Sul,"Pedra dos Pontões, Pontão médio.",-41.3664016723633,-21.0641994476318,0,0,29430,,1300,1300,,,,,,,,,"Saxícola arbustiva, 50 cm alt. Sépalas verdes com pétalas esbranquiçadas.",BHCB017563,,auto
2021-05-07 17:21:06-03,UFMG,BHCB,172414,PreservedSpecimen,Plantae,Dicotyledon,,,Asteraceae,Baccharis,platypoda,,Baccharis platypoda,DC.,,2010,09,,,"Demuner, V; Bausen, E; Pizziolo, W; Fraga, CN de; Kollmann, L; Ramagna, RV",1189,,2000,06,20,,Southern America,Brasil,Espírito Santo,Santa Teresa,"Pedra Alegre, Torre de telefone",-40.6002998352051,-19.9356002807617,0,0,23813,,0,0,,,,,,,,,"Arbusto de 2m, inflorescência amarelada.; Capoeirão sobre a rocha.",BHCB017546,,auto
2021-05-07 17:21:06-03,UFMG,BHCB,172853,PreservedSpecimen,Plantae,Dicotyledon,,,Asteraceae,Baccharis,platypoda,,Baccharis platypoda,DC.,,1990,,,,"Fernandes, HQB; Boone, W",1922,,1986,04,16,,Southern America,Brasil,Espírito Santo,Santa Teresa,Pedra da Onça,-40.6002998352051,-19.9356002807617,0,0,23813,,0,0,,,,,,,,,"Arbusto 3m alt., 3 cm de diâmetro, estéril.; Solo raso, vegetação rupestre, alto de pedra heliófila.",BHCB017568,,auto
2021-05-07 17:21:06-03,UFMG,BHCB,172856,PreservedSpecimen,Plantae,Dicotyledon,,,Asteraceae,Baccharis,platypoda,,Baccharis platypoda,DC.,,,,,,"Couto, DR; Guerra Jr, FC",949,,2008,09,13,,Southern America,Brasil,Espírito Santo,São José do Calçado,São Benedito - Pontão do Calçado. Cume Pontão do Calçado. Acesso via de escalada Bom Senhor.,-41.6543998718262,-21.0252990722656,0,0,20061,,1300,1300,,,,,,,,,Arbusto rupícola. Inflorescência verde.,BHCB017565,,auto
2020-12-11 11:32:25-03,UFMG,BHCB,172852,PreservedSpecimen,Plantae,Dicotyledon,,,Asteraceae,Baccharis,platypoda,,Baccharis platypoda,DC.,,2005,,,,"Kollmann, L; Fontana, AP; Goldenberg, R",8130,,2005,07,19,,Southern America,Brasil,Espírito Santo,São Roque do Canaã,Alto Misterioso,-40.6568984985352,-19.738899230957,0,0,14641,,0,0,,,,,,,,,"Arbusto 1m, no sol. Flores amarelas.",BHCB017569,,auto
2021-05-07 17:21:06-03,UFMG,BHCB,172850,PreservedSpecimen,Plantae,Dicotyledon,,,Asteraceae,Baccharis,platypoda,,Baccharis platypoda,DC.,,2005,,,,"Kollmann, L; Fontana, AP; Goldenberg, R",8131,,2005,07,19,,Southern America,Brasil,Espírito Santo,São Roque do Canaã,Alto Misterioso,-40.6568984985352,-19.738899230957,0,0,14641,,0,0,,,,,,,,,"Arbusto 1m, no sol, flores amarelas.",BHCB017571,,auto
2021-06-18 17:37:27-03,UFMG,BHCB,47838,PreservedSpecimen,Plantae,Dicotyledon,,,Asteraceae,Baccharis,platypoda,,Baccharis platypoda,DC.,,2005,03,,,"Vasconcelos, MF de",s.n.,,1999,06,09,,Southern America,Brasil,Minas Gerais,Aiuruoca,Pico do Papagaio,-44.603099822998,-21.9755992889404,0,0,27460,,1650,1650,,,,,,,,,Plantas do Brasil. Indivíduo masculino.; Arbustivo.; Campo.,,,auto
2020-12-11 11:32:25-03,UFMG,BHCB,170334,PreservedSpecimen,Plantae,Dicotyledon,,,Asteraceae,Baccharis,platypoda,,Baccharis platypoda,DC.,,2015,06,24,,"Kamino, LHY; Maielo Silva, L",1391,,2008,04,25,,Southern America,Brasil,Minas Gerais,Alagoa,Garrafão.,-44.6418991088867,-22.1706008911133,0,0,13155,,0,0,,,,,,,,,Beira de estrada,BHCB025433,,auto
2021-05-07 17:21:06-03,UFMG,BHCB,168678,PreservedSpecimen,Plantae,Dicotyledon,,,Asteraceae,Baccharis,platypoda,,Baccharis platypoda,DC.,,,,,,"Roth, L",1381,,1956,07,18,,Southern America,Brasil,Minas Gerais,Belo Horizonte,Serra do Curral,-43.937801361084,-19.9207992553711,0,0,17082,,0,0,,,,,,,,,"Arbusto, 1m alt. Flores brancas.; Cerrado-arborescente.",BHCB012667,,auto
2021-05-07 17:21:06-03,UFMG,BHCB,4726,PreservedSpecimen,Plantae,Dicotyledon,,,Asteraceae,Baccharis,platypoda,,Baccharis platypoda,DC.,,,,,,"Carvalho, RCF de",s.n.,,1983,04,24,,Southern America,Brasil,Minas Gerais,Brumadinho,Retiro das Pedras,-44.1996994018555,-20.1432991027832,0,0,26639,,0,0,,,,,,,,,Herbáceo. Papus de cerdas sinuosas. Apresenta uma espécie de resina na inflorescência nova.; Campo rupestre.,,,auto
2021-05-07 17:21:04-03,UFMG,BHCB,11348,PreservedSpecimen,Plantae,Dicotyledon,,,Asteraceae,Baccharis,platypoda,,Baccharis platypoda,DC.,,,,,,"Leoni, LS",86,,1987,09,12,,Southern America,Brasil,Minas Gerais,Carangola,Fazenda Serra da Grama.,-42.0293998718262,-20.7331008911133,0,0,21913,,1700,1700,,,,,,,,,Arbusto 2m alt.; Início de campo rupestre.,,,auto
