MODIFIED,INSTITUTIONCODE,COLLECTIONCODE,CATALOGNUMBER,BASISOFRECORD,KINGDOM,PHYLUM,CLASS,ORDER,FAMILY,GENUS,SPECIFICEPITHET,INFRASPECIFICEPITHET,SCIENTIFICNAME,SCIENTIFICNAMEAUTHORSHIP,IDENTIFIEDBY,YEARIDENTIFIED,MONTHIDENTIFIED,DAYIDENTIFIED,TYPESTATUS,RECORDEDBY,RECORDNUMBER,FIELDNUMBER,YEAR,MONTH,DAY,EVENTTIME,CONTINENTOCEAN,COUNTRY,STATEPROVINCE,COUNTY,LOCALITY,DECIMALLONGITUDE,DECIMALLATITUDE,VERBATIMLONGITUDE,VERBATIMLATITUDE,COORDINATEPRECISION,BOUNDINGBOX,MINIMUMELEVATIONINMETERS,MAXIMUMELEVATIONINMETERS,MINIMUMDEPTHINMETERS,MAXIMUMDEPTHINMETERS,SEX,PREPARATIONTYPE,INDIVIDUALCOUNT,PREVIOUSCATALOGNUMBER,RELATIONSHIPTYPE,RELATEDCATALOGITEM,OCCURRENCEREMARKS,BARCODE,IMAGECODE,GEOFLAG
2019-06-07 18:05:09-03,UFLA,ESAL,10056,S,Plantae,,,,Velloziaceae,Barbacenia,tomentosa,,Barbacenia tomentosa,Mart.,"Oliveira, EJC",2019,06,06,,"Oliveira Filho, AT",s.n.,,,,,,,Brasil,Minas Gerais,Itutinga,Fazenda Ouro Grosso,-44.6577987670898,-21.2980995178223,0,0,24458,,,,,,,,,,,,"erva; 0,20; vermelha;; cerrado",,,auto
2019-06-07 18:05:09-03,UFLA,ESAL,2489,S,Plantae,,,,Velloziaceae,Barbacenia,tomentosa,,Barbacenia tomentosa,Mart.,"Oliveira, EJC",2019,06,06,,"Mansanares, ME; Berg e",439,,,,,,,Brasil,Minas Gerais,Luminárias,,-44.9033012390137,-21.511100769043,0,0,19291,,,,,,,,,,,,; ; vermelha;,,,auto
2019-06-07 18:05:10-03,UFLA,ESAL,9442,S,Plantae,,,,Velloziaceae,Barbacenia,tomentosa,,Barbacenia tomentosa,Mart.,"Oliveira, EJC",2019,06,06,,L. S. Kinoshita Gouvêa et alii,s.n.,,,,,,,Brasil,Minas Gerais,São Tomé das Letras,,-44.9852981567383,-21.7222003936768,0,0,16076,,13,13,,,,,,,,,"erva; 0,15; vermelha, anteras amarelas por dentro e roxas fora;; campo rupestre",,,auto
2019-06-07 18:05:09-03,UFLA,ESAL,11599,S,Plantae,,,,Velloziaceae,Barbacenia,tomentosa,,Barbacenia tomentosa,Mart.,"Oliveira, EJC",2019,06,06,,"Gavilanes, M L; Frieiro Costa",4.852,,,,,,,Brasil,Minas Gerais,São Tomé das Letras,,-44.9852981567383,-21.7222003936768,0,0,16076,,,,,,,,,,,,"erva; 0,50; avermelhada;; campo rupestre",,,auto
2019-06-07 18:05:10-03,UFLA,ESAL,7665,S,Plantae,,,,Velloziaceae,Barbacenia,tomentosa,,Barbacenia tomentosa,Mart.,"Oliveira, EJC",2019,06,06,,S. C. Pereira; M. H. Lagoa,s.n.,,,,,,,Brasil,Minas Gerais,São Tomé das Letras,,-44.9852981567383,-21.7222003936768,0,0,16076,,,,,,,,,,,,; ; ;; campo rupestre,,,auto
2019-06-07 18:05:10-03,UFLA,ESAL,5963,S,Plantae,,,,Velloziaceae,Barbacenia,tomentosa,,Barbacenia tomentosa,Mart.,"Oliveira, EJC",2019,06,06,,Miguel Pinter Jr.,s.n.,,,,,,,Brasil,Minas Gerais,São Tomé das Letras,Perto da Pirâmide,-44.9852981567383,-21.7222003936768,0,0,16076,,12,12,,,,,,,,,"erva; 0,8; ;; palustre",,,auto
2021-04-21 22:00:02-03,US,US,2827795,PreservedSpecimen,Plantae,,Monocotyledonae,Liliales,Velloziaceae,Barbacenia,tomentosa,,Barbacenia tomentosa,Mart.,,,,,,G. Hatschbach,38953,,1976,10,5,,South America - Neotropics,Brazil,Goiás,Ipameri,Rio Corumba,-48.1596984863281,-17.7219009399414,,,102542,,,,,,,,1,,,,,,,auto
2021-03-15 18:30:17-03,USP,SPF,209113,PreservedSpecimen,Plantae,,,,Velloziaceae,Barbacenia,tomentosa,,Barbacenia tomentosa,Mart.,"Mello-Silva, R",2014,,,,"Mello-Silva, R",3731,,2014,02,07,,,Brasil,São Paulo,Analândia,"Morro do Cuscuzeiro, Reserva Pedra Viva, a cerca de 2 km NW da cidade. Grande pescoço de quartzito, rodeado de mata seca degradada.",-47.6955,-22.117833,-47.6955,-22.117833,,,950,950,,,,,,,,,"Grande população no paredão, em touceiras. Folhas espirotrísticas, arqueadas, viscosas, ligeiramente odoríferas. Flores passadas verde claro, formando frutos.",SPF00209113,,
2019-11-13 11:32:34-03,USP,SPF,215239,PreservedSpecimen,Plantae,,,,Velloziaceae,Barbacenia,tomentosa,,Barbacenia tomentosa,Mart.,"Prado, J; Hirai, RY",,,,,"Prado, J",2166,,2011,05,08,,,Brasil,São Paulo,Analândia,,-47.683333,-22.1,-47.683333,-22.1,,,700,700,,,,,,,,,,SPF00215239,,
2019-11-13 11:32:34-03,USP,SPF,221470,PreservedSpecimen,Plantae,,,,Velloziaceae,Barbacenia,tomentosa,,Barbacenia tomentosa,Mart.,"Mello-Silva, R",2012,07,03,,"De Paula, LFA",146,,2011,01,08,,,Brasil,Minas Gerais,Teófilo Otoni,Estrada de terra de Teófilo Otoni a Brejão.,-41.260833,-17.856111,-41.260833,-17.856111,,,670,670,,,,,,,,,,SPF00221470,,
2019-11-13 11:32:34-03,USP,SPF,228930,PreservedSpecimen,Plantae,,,,Velloziaceae,Barbacenia,tomentosa,,Barbacenia tomentosa,Mart.,"Mota, RC",2013,05,,,"Vidal, CV",1086,,2013,01,09,,,Brasil,Minas Gerais,Conceição do Mato Dentro,,-43.401389,-19.000833,-43.401389,-19.000833,,,,,,,,,,,,,,SPF00228930,,
2019-11-13 11:32:34-03,USP,SPF,228933,PreservedSpecimen,Plantae,,,,Velloziaceae,Barbacenia,tomentosa,,Barbacenia tomentosa,Mart.,"Mello-Silva, R",2017,05,,,"Costa, FN",1198,,2010,02,09,,,Brasil,Minas Gerais,São Gonçalo do Rio Preto,Parque Estadual do Rio Preto,-43.383344,-18.127789,-43.383344,-18.127789,,,1065,1065,,,,,,,,,,SPF00228933,,
2019-11-13 11:32:34-03,USP,SPF,228751,PreservedSpecimen,Plantae,,,,Velloziaceae,Barbacenia,tomentosa,,Barbacenia tomentosa,Mart.,"Mota, RC",2013,02,,,"Tameirão Neto, E",5190,,2012,11,14,,,Brasil,Minas Gerais,Conceição do Mato Dentro,,-43.4249992370605,-19.0372009277344,0,0,60318,,,,,,,,,,,,,SPF00228751,,auto
2019-11-13 11:32:34-03,USP,SPF,228752,PreservedSpecimen,Plantae,,,,Velloziaceae,Barbacenia,tomentosa,,Barbacenia tomentosa,Mart.,"Mota, RC",2013,02,,,"Tameirão Neto, E",5191,,2012,11,14,,,Brasil,Minas Gerais,Conceição do Mato Dentro,,-43.4249992370605,-19.0372009277344,0,0,60318,,,,,,,,,,,,,SPF00228752,,auto
2019-11-13 11:32:34-03,USP,SPF,227415,PreservedSpecimen,Plantae,,,,Velloziaceae,Barbacenia,tomentosa,,Barbacenia tomentosa,Mart.,"Mello-Silva, R",2015,12,,,"Ferreira Jr, CA",414,,2012,07,10,,,Brasil,Minas Gerais,Santana do Riacho,Brumas do Espinhaço e Ermo do Gerais.,-43.7144012451172,-19.1688995361328,0,0,26557,,,,,,,,,,,,,SPF00227415,,auto
2019-11-13 11:32:34-03,USP,SPF,227401,PreservedSpecimen,Plantae,,,,Velloziaceae,Barbacenia,tomentosa,,Barbacenia tomentosa,Mart.,"Mello-Silva, R",2015,12,,,"Ferreira Jr, CA",400,,2012,04,19,,,Brasil,Minas Gerais,Santana do Riacho,RPPN Brumas do Espinhaço e Ermo dos Gerais,-43.7144012451172,-19.1688995361328,0,0,26557,,,,,,,,,,,,,SPF00227401,,auto
2019-11-13 11:32:34-03,USP,SPF,227399,PreservedSpecimen,Plantae,,,,Velloziaceae,Barbacenia,tomentosa,,Barbacenia tomentosa,Mart.,"Mello-Silva, R",2015,12,,,"Ferreira Jr, CA",926,,2013,01,30,,,Brasil,Minas Gerais,Santana do Riacho,"RPPN Brumas do Espinhaço e Ermo dos Gerais, Ermo.",-43.7144012451172,-19.1688995361328,0,0,26557,,,,,,,,,,,,,SPF00227399,,auto
2021-05-18 10:51:57-03,UEFS,HUEFS,90577,PreservedSpecimen,Plantae,Angiospermae,Lilianae,Pandanales,Velloziaceae,Barbacenia,tomentosa,,Barbacenia tomentosa,Mart.,R.Mello-Silva,2007,08,,,"van den Berg, C.",1298,,2004,02,15,,,Brasil,Minas Gerais,Ipuiuna,"São Tomé, dentro da cidade.",-48.156111,-22.133333,48W9'22'',22S8'0'',,,1450,1450,,,,,,,,,Afloramentos acima das casas.,HUEFS0090577,,
2019-11-13 16:05:08-03,UNISANTA,HUSC,10791,PreservedSpecimen,Plantae,Magnoliophyta,,,Velloziaceae,Barbacenia,tomentosa,,Barbacenia tomentosa,Mart.,"Sampaio, P.S.P.",2015,09,,,"Sampaio, P.S.P.; Sampaio, A.F.P.",1213,,2015,09,06,,,Brasil,Minas Gerais,São Thomé das Letras,Parque Municipal Antônio Rosa.,-44.982678,-21.724942,-44.982678,-21.724942,,,1400,1400,,,,,,,,,Erva rupícola com flores vermelhas.; Campo Rupestre.,,,
2020-11-04 11:20:21-03,ESALQ,ESA,100718,PreservedSpecimen,Plantae,Magnoliophyta,,,Velloziaceae,Barbacenia,tomentosa,,Barbacenia tomentosa,Mart.,"Alcantara, S.",2013,,,,"Forzza, R.C.",2121.0,,2002,03,28,,,Brasil,Minas Gerais,Baependi,,-44.8899993896484,-21.9589004516602,,,29865,,,,,,,,,,,,,ESA100718,ESA100718,auto
2020-11-04 11:20:21-03,ESALQ,ESA,105577,PreservedSpecimen,Plantae,Magnoliophyta,,,Velloziaceae,Barbacenia,tomentosa,,Barbacenia tomentosa,,"Mello-Silva, R.",,,,,"Ferreira, F.M.",31.0,,2001,11,22,,,Brasil,Minas Gerais,São Tomé das Letras,,-44.9852981567383,-21.7222003936768,,,16076,,,,,,,,,,,,,ESA105577,ESA105577,auto
2021-06-28 11:22:04-03,MN,R,233900,PreservedSpecimen,Plantae,,,,Velloziaceae,Barbacenia,tomentosa,,Barbacenia tomentosa,Mart.,"Alves, R.J.V.",2017,,,,"Costa, M.T.R.",1093,,2017,08,05,,,Brasil,Minas Gerais,São João del'Rei,Serra do Lenheiro,-44.506389,-21.2475,44º30'23W,21º14'51S,,,1093,1093,,,,,,,,,HUFSJ 9241,R010047888,R010047888,
2021-06-28 11:22:04-03,MN,R,235556,PreservedSpecimen,Plantae,,,,Velloziaceae,Barbacenia,tomentosa,,Barbacenia tomentosa,Mart.,"Mello-Silva, R.",1998,08,26,,"Silveira, A.A.",,,1893,05,,,,Brasil,Minas Gerais,São Thomé das Letras,Morro do Gavião,-44.9852981567383,-21.7222003936768,,,16076,,,,,,,,,,,,Comissão Geográfica e Geologica de Minas,"R010057394,R010057395,R010057392",R010057392 R010057394 R010057395,auto
2021-06-28 11:22:04-03,MN,R,35290,PreservedSpecimen,Plantae,,,,Velloziaceae,Barbacenia,tomentosa,,Barbacenia tomentosa,Mart.,"Mello Barreto, H.L.",,,,,"Mello Barreto, H.L.",4793,,1936,07,10,,,Brasil,Minas Gerais,Tiradentes,Serra de Tiradentes,-44.1781005859375,-21.1103000640869,,,10355,,,,,,,,,,,,Jardim Botânico de Belo Horizonte 17912,R010057545,R010057545,auto
2019-11-21 14:47:00-03,UFJF,CESJ,24441,PreservedSpecimen,Plantae,Angiosperma,,,Velloziaceae,Barbacenia,tomentosa,,Barbacenia tomentosa,Mart.,R. Mello-Silva,1992,12,,,L. Krieger; M.C. Brügger,CESJ24441,,1989,03,27,,América do Sul,Brasil,Minas Gerais,Lima Duarte,"Olaria, Km 171",-43.793098449707,-21.8425006866455,0,0,30417,,,,,,,,,,,,"Sobre matações de arenito, na mata, planta sub-arbustiva, meio pendente, folhas moles, flores avermelhadas, bainha das folhas aderentes ao caule, enroladas para trás.",CESJ024441,,auto
2019-11-21 14:47:00-03,UFJF,CESJ,25154,PreservedSpecimen,Plantae,Angiosperma,,,Velloziaceae,Barbacenia,tomentosa,,Barbacenia tomentosa,Mart.,R. Mello-Silva,1992,12,,,M.C. Brügger; et alii,s.n.,,1990,05,01,,América do Sul,Brasil,Minas Gerais,Lima Duarte,Serra Negra - Fazenda dos Avelinos,-43.793098449707,-21.8425006866455,0,0,30417,,,,,,,,,,,,"Planta semi pendente arqueada, nos paredões de quartzitos das encostas mais secas e ensolaradas acima de 1200m longe do alcance dos bois. Flores avermelhadas (chegando para a cor de vinho).",CESJ025154,,auto
2019-11-21 14:47:00-03,UFJF,CESJ,48716,PreservedSpecimen,Plantae,Angiosperma,,,Velloziaceae,Barbacenia,tomentosa,,Barbacenia tomentosa,Mart.,R. Mello-Silva,2007,06,,,F.R.G. Salimena; P.H. Nobre,2376,,2007,02,10,,América do Sul,Brasil,Minas Gerais,Santa Bárbara do Monte Verde,"Serra Negra, Fazenda Cachoeira Alta. 21º58'21,4W, 43º50'06,5W. Ca. 927 m.s.m.",-43.7022018432617,-21.9591999053955,0,0,16174,,,,,,,,,,,,"Planta rupícola, em afloramento quartzítico, em campo rupestre. Flores esverdeadas, tépalas encarnadas internamente. Grande população.",CESJ048716,,auto
2019-11-21 14:47:00-03,UFJF,CESJ,20484,PreservedSpecimen,Plantae,Angiosperma,,,Velloziaceae,Barbacenia,tomentosa,,Barbacenia tomentosa,Mart.,R. Mello-Silva,1993,01,21,,L. Krieger; R. Mello-Silva; J.L.R. Oliveira,CESJ20484,,1985,02,18,,América do Sul,Brasil,Minas Gerais,São João Del Rei,Serra de Tiradentes,-44.2616996765137,-21.1355991363525,0,0,39093,,,,,,,,,,,,"Saxícola, sobre quartzito. Flores vermelho-salmão. Não é rara.",CESJ020484,,auto
2019-11-21 14:47:00-03,UFJF,CESJ,27125,PreservedSpecimen,Plantae,Angiosperma,,,Velloziaceae,Barbacenia,tomentosa,,Barbacenia tomentosa,Mart.,F.M. Ferreira,2002,10,,,A.Ferreira,06,,1993,05,09,,América do Sul,Brasil,Minas Gerais,São Tomé das Letras,,-44.9852981567383,-21.7222003936768,0,0,16076,,,,,,,,,,,,"Local ensolarado, em fenda de rocha. Tépalas vermelhas, anteras roxas, flores pouco viscosas.",CESJ027125,,auto
2019-11-21 14:47:00-03,UFJF,CESJ,36868,PreservedSpecimen,Plantae,Angiosperma,,,Velloziaceae,Barbacenia,tomentosa,,Barbacenia tomentosa,Mart.,R. Mello-Silva,2002,08,,,F.M. Ferreira,31,,2001,11,22,,América do Sul,Brasil,Minas Gerais,São Tomé das Letras,Fazenda dos Correa - Paredão,-44.9852981567383,-21.7222003936768,0,0,16076,,,,,,,,,,,,"Erva ca. 30cm, em campo muito pedregoso. Planta viscosa. Flores vermelhas, filetes alaranjados.",CESJ036868,,auto
2019-11-21 14:47:00-03,UFJF,CESJ,50328,PreservedSpecimen,Plantae,Angiosperma,,,Velloziaceae,Barbacenia,tomentosa,,Barbacenia tomentosa,Mart.,L. Menini Neto,2009,04,16,,F.R.G. Salimena; I.A. Costa; P.H. Nobre,2661,,2008,03,01,,América do Sul,Brasil,Minas Gerais,Lima Duarte,"Serra Negra, Fazenda Serra Negra, Cachoeira da Borboleta Azul.",-43.824194,-21.940111,-43.824194,-21.940111,,,1155,1155,,,,,,,,,"Flores vermelho-carmim,estames roxos. Em paredão.",CESJ050328,,
2019-11-21 14:47:00-03,UFJF,CESJ,37133,PreservedSpecimen,Plantae,Angiosperma,,,Velloziaceae,Barbacenia,tomentosa,,Barbacenia tomentosa,Mart.,,,,,,R.C. Forzza; F.M. Ferreira; M.C.M. Garcia,2121,,2002,03,28,,América do Sul,Brasil,Minas Gerais,Baependi,"Toca dos Urubus, Afloramento de quartzito. Elev. 1200m.",-44.8899993896484,-21.9589004516602,0,0,29865,,,,,,,,,,,,"Erva rupícola ou em solo arenoso-pedregoso, formando grande população. Folhas viscosas. Flores com hipanto verde, tubo da corola vermelho com estrias amarelas, falce amarela; estilete vermelho e estames amarelos.",CESJ037133,,auto
2019-11-21 14:47:00-03,UFJF,CESJ,24443,PreservedSpecimen,Plantae,Angiosperma,,,Velloziaceae,Barbacenia,tomentosa,,Barbacenia tomentosa,Mart.,R. Mello-Silva,1992,12,,,L. Krieger; M.C. Brügger,CESJ24443,,1989,03,27,,América do Sul,Brasil,Minas Gerais,Lima Duarte,Olaria,-43.793098449707,-21.8425006866455,0,0,30417,,,,,,,,,,,,"Em morro, sobre arenito, em touceiras densas, muito frequente, flores avermelhadas.",CESJ024443,,auto
2019-11-21 14:47:00-03,UFJF,CESJ,24440,PreservedSpecimen,Plantae,Angiosperma,,,Velloziaceae,Barbacenia,tomentosa,,Barbacenia tomentosa,Mart.,R. Mello-Silva,1992,12,,,L. Krieger; M.C. Brügger,CESJ24440,,1989,03,27,,América do Sul,Brasil,Minas Gerais,Lima Duarte,Olaria,-43.793098449707,-21.8425006866455,0,0,30417,,,,,,,,,,,,"Sobre matações de arenito, caule meio pendente. Flor de cor esverdeada, com avermelhado esmaecido.",CESJ024440,,auto
2019-11-21 14:47:00-03,UFJF,CESJ,24442,PreservedSpecimen,Plantae,Angiosperma,,,Velloziaceae,Barbacenia,tomentosa,,Barbacenia tomentosa,Mart.,R. Mello-Silva,1992,12,,,L. Krieger; M.C. Brügger,CESJ24442,,1989,03,27,,América do Sul,Brasil,Minas Gerais,Lima Duarte,Olaria,-43.793098449707,-21.8425006866455,0,0,30417,,,,,,,,,,,,Sodre rochedos de arenito. Flores amareladas.,CESJ024442,,auto
2019-11-21 14:47:00-03,UFJF,CESJ,21542,PreservedSpecimen,Plantae,Angiosperma,,,Velloziaceae,Barbacenia,tomentosa,,Barbacenia tomentosa,Mart.,R. Mello-Silva,1992,12,,,F.R.G. Salimena; M.C. Brügger; F.M. Meirelles; R.D.V.Braga,s.n.,,1987,07,17,,América do Sul,Brasil,Minas Gerais,Lima Duarte,Serra da Capoeira Grande,-43.793098449707,-21.8425006866455,0,0,30417,,,,,,,,,,,,"Sobre rochas, em paredão de pedra a 1500m de altitude. Flores vermelhas.",CESJ021542,,auto
2019-11-21 14:47:00-03,UFJF,CESJ,24306,PreservedSpecimen,Plantae,Angiosperma,,,Velloziaceae,Barbacenia,tomentosa,,Barbacenia tomentosa,Mart.,R. Mello-Silva,1992,12,,,L. Krieger; M.C. Brügger,CESJ24306,,1989,03,27,,América do Sul,Brasil,Minas Gerais,Olaria,km 171.,-43.937198638916,-21.8607997894287,0,0,15222,,,,,,,,,,,,Pendente dos paredões de arenito. Local sombreado por mata.,CESJ024306,,auto
2019-11-21 14:47:00-03,UFJF,CESJ,49093,PreservedSpecimen,Plantae,Angiosperma,,,Velloziaceae,Barbacenia,tomentosa,,Barbacenia tomentosa,Mart.,R. Mello-Silva,2007,06,,,F.R.G. Salimena; P.H. Nobre,2410,,2007,02,15,,América do Sul,Brasil,Minas Gerais,Rio Preto,"Serra Negra, Boqueirão, divisa com Santa Bárbara do Monte Verde.",-43.8278007507324,-22.0891990661621,0,0,20815,,,,,,,,,,,,"Planta formando grandes populações em afloramento quartzítico, à beira do rio.",CESJ049093,,auto
2019-11-21 14:47:00-03,UFJF,CESJ,47240,PreservedSpecimen,Plantae,Angiosperma,,,Velloziaceae,Barbacenia,tomentosa,,Barbacenia tomentosa,Mart.,R. Mello-Silva,2015,,,,P.L. Viana; F.M. Ferreira; G.Hermann; C.Costa,2028,,2006,04,,,América do Sul,Brasil,Minas Gerais,Rio Preto,"Serra Negra, RPPN São Lourenço do Funil.",-43.8278007507324,-22.0891990661621,0,0,20815,,980,980,,,,,,,,,"Em barranco, à beira de riacho. Ramos pendentes. Flores verdes.",CESJ047240,,auto
2019-11-21 14:47:00-03,UFJF,CESJ,21412,PreservedSpecimen,Plantae,Angiosperma,,,Velloziaceae,Barbacenia,tomentosa,,Barbacenia tomentosa,Mart.,R. Mello-Silva,1991,12,,,L. Krieger,CESJ21412,,1987,04,19,,América do Sul,Brasil,Minas Gerais,Santa Rita de Ibitipoca,,-43.9146995544434,-21.5627994537354,0,0,17739,,,,,,,,,,,,"Sobre arenito-quartzito. Dominante na área, formando grandes touceiras. Flores vermelhas na face interna da corola e mais esbranquiçadas na face externa das tépalas.",CESJ021412,,auto
2019-11-21 14:47:00-03,UFJF,CESJ,20485,PreservedSpecimen,Plantae,Angiosperma,,,Velloziaceae,Barbacenia,tomentosa,,Barbacenia tomentosa,Mart.,M.Silveira,1993,01,21,,L. Krieger; R. Mello-Silva; J.L.R. Oliveira,CESJ20485,,1985,02,18,,América do Sul,Brasil,Minas Gerais,São João Del Rei,Serra de São José,-44.2616996765137,-21.1355991363525,0,0,39093,,,,,,,,,,,,"Em rocha formando grandes moitas. Flores vermelho-salmon, pólen oliváceo. Anteras ultrapassando a corona. Comum.",CESJ020485,,auto
2019-11-21 14:47:00-03,UFJF,CESJ,19992,PreservedSpecimen,Plantae,Angiosperma,,,Velloziaceae,Barbacenia,tomentosa,,Barbacenia tomentosa,Mart.,R. Mello-Silva,1992,12,,,L. Krieger,CESJ19992,,1984,02,02,,América do Sul,Brasil,Minas Gerais,São João Del Rei,Serra do Cristal,-44.2616996765137,-21.1355991363525,0,0,39093,,,,,,,,,,,,"Erva rupícola, forma moita densa sobre pedras de arenito. Flores vermelhas.",CESJ019992,,auto
2019-11-21 14:47:00-03,UFJF,CESJ,36857,PreservedSpecimen,Plantae,Angiosperma,,,Velloziaceae,Barbacenia,tomentosa,,Barbacenia tomentosa,Mart.,F.M. Ferreira,2002,06,12,,F.M. Ferreira,15,,2002,02,10,,América do Sul,Brasil,Minas Gerais,São Tomé das Letras,"Área particular, proprietário Geraldo Alves Ferreira.",-44.9852981567383,-21.7222003936768,0,0,16076,,,,,,,,,,,,"Erva com 30cm de altura, localizada sobre afloramento rochoso, forma aglomerados. A planta inteira possui mucilagem, folhas verdes flores avermelhadas com anteras também avermelhadas com ápice violáceo.",CESJ036857,,auto
2020-12-11 11:45:26-03,UFMG,BHCB,116495,PreservedSpecimen,Plantae,Monocotyledon,,,Velloziaceae,Barbacenia,tomentosa,,Barbacenia tomentosa,Mart.,,,,,,"Carmo, FF",1907,,2008,01,15,,Southern America,Brasil,Minas Gerais,Igarapé,Pico Itatiaiuçu/C2,-44.569367,-20.2,-44.569367,-20.2,,,1361,1361,,,,,,,,,coletado em fendas e depressões na rocha. Afloramento de canga,,,
2020-12-11 11:45:26-03,UFMG,BHCB,101398,PreservedSpecimen,Plantae,Monocotyledon,,,Velloziaceae,Barbacenia,tomentosa,,Barbacenia tomentosa,Mart.,,2014,09,09,,"Soares, LA; Marino, FM; Oliveira, PG; Soares, LA",23,,2006,04,26,,Southern America,Brasil,Minas Gerais,Santana do Riacho,"Serra do Cipó, Córrego 2 pontinhas.",-43.568333,-19.291389,-43.568333,-19.291389,,,1389,1389,,,,,,,,,Herbácea.,BHCB018679,,
2020-12-11 11:45:26-03,UFMG,BHCB,116496,PreservedSpecimen,Plantae,Monocotyledon,,,Velloziaceae,Barbacenia,tomentosa,,Barbacenia tomentosa,Mart.,,,,,,"Carmo, FF; Ribeiro, LC; Silva, ES",1990,,2008,01,17,,Southern America,Brasil,Minas Gerais,Nova Lima,PE Rola Moça/C2,-44.003086,-20.079783,-44.003086,-20.079783,,,1430,1430,,,,,,,,,coletado em fendas e depressões na rocha. Afloramento de canga,,,
2020-12-11 11:45:26-03,UFMG,BHCB,163316,PreservedSpecimen,Plantae,Monocotyledon,,,Velloziaceae,Barbacenia,tomentosa,,Barbacenia tomentosa,Mart.,,2017,,,,"Tameirão Neto, E",5191,,2012,11,14,,Southern America,Brasil,Minas Gerais,Conceição do Mato Dentro,,-43.356944,-19.676389,-43.356944,-19.676389,,,0,0,,,,,,,,,Campo rupestre sobre formação ferrífera; Herbáceo,BHCB041040,,
2020-12-11 11:45:26-03,UFMG,BHCB,163315,PreservedSpecimen,Plantae,Monocotyledon,,,Velloziaceae,Barbacenia,tomentosa,,Barbacenia tomentosa,Mart.,,2017,,,,"Tameirão Neto, E",5190,,2012,11,14,,Southern America,Brasil,Minas Gerais,Conceição do Mato Dentro,,-43.356944,-19.676389,-43.356944,-19.676389,,,0,0,,,,,,,,,Campo rupestre sobre formação ferrífera; Herbáceo,BHCB041041,,
2020-12-11 11:45:26-03,UFMG,BHCB,182118,PreservedSpecimen,Plantae,Monocotyledon,,,Velloziaceae,Barbacenia,tomentosa,,Barbacenia tomentosa,Mart.,,2016,02,15,,"Gontijo, FD; Tameirão Neto, E",1129,,2016,01,07,,Southern America,Brasil,Minas Gerais,São Joaquim de Bicas,"Serra Azul, Serra das Farofas",-44,-21.093953,-44,-21.093953,,,1334,1334,,,,,,,,,Herbáceo; Campo Rupestre Ferruginoso,BHCB037778,,
2020-12-11 11:45:26-03,UFMG,BHCB,157479,PreservedSpecimen,Plantae,Monocotyledon,,,Velloziaceae,Barbacenia,tomentosa,,Barbacenia tomentosa,Mart.,,2012,06,01,,"Paula, LFA de; Mota, NFO; Viana, PL; Jorge, TB; Burkowski, PM",146,,2011,01,08,,Southern America,Brasil,Minas Gerais,Teófilo Otoni,Estrada de terra de Teófilo Otoni a Brejão,-41.260944,-17.855972,-41.260944,-17.855972,,,560,560,,,,,,,,,,BHCB005925,,
2020-12-11 11:45:26-03,UFMG,BHCB,159490,PreservedSpecimen,Plantae,Monocotyledon,,,Velloziaceae,Barbacenia,tomentosa,,Barbacenia tomentosa,Mart.,,2012,06,01,,"Paula, LFA de; Mota, NFO; Viana, PL; Jorge, TB; Burkowski, PM",142,,2011,01,08,,Southern America,Brasil,Minas Gerais,Teófilo Otoni,"Afloramento rochoso lado esquerdo da MG 418, cerca de 30 km norte de Teófilo Otoni",-41.260944,-17.855972,-41.260944,-17.855972,,,560,560,,,,,,,,,,BHCB005942,,
2020-12-11 11:45:26-03,UFMG,BHCB,159493,PreservedSpecimen,Plantae,Monocotyledon,,,Velloziaceae,Barbacenia,tomentosa,,Barbacenia tomentosa,Mart.,,2012,04,01,,"Paula, LFA de; Augsten, M",288,,2011,04,16,,Southern America,Brasil,Minas Gerais,Teófilo Otoni,"Afloramento rochoso lado esquerdo da MG 418, cerca de 30 km norte de Teófilo Otoni",-41.260944,-17.855972,-41.260944,-17.855972,,,560,560,,,,,,,,,,BHCB005944,,
2020-12-11 11:45:26-03,UFMG,BHCB,163317,PreservedSpecimen,Plantae,Monocotyledon,,,Velloziaceae,Barbacenia,tomentosa,,Barbacenia tomentosa,Mart.,,2017,,,,"Vidal, CV; Paula, RL de",1086,,2013,01,09,,Southern America,Brasil,Minas Gerais,Conceição do Mato Dentro,,-43.401389,-19.000833,-43.401389,-19.000833,,,0,0,,,,,,,,,Campo rupestre sobre formação ferrífera; Herbáceo,BHCB041042,,
2020-12-11 11:45:26-03,UFMG,BHCB,184918,PreservedSpecimen,Plantae,Monocotyledon,,,Velloziaceae,Barbacenia,tomentosa,,Barbacenia tomentosa,Mart.,,,,,,"Rezende, SG; Justo, AG",5578,,2015,04,17,,Southern America,Brasil,Minas Gerais,Nova Lima,"Região do Condomínio Vale do Sol, Próximo a estação Ecológica de Fechos",-43.958056,-20.076944,-43.958056,-20.076944,,,1285,1320,,,,,,,,,Herbáceo; Cerrado rupestre,BHCB184918,,
2020-12-11 11:45:26-03,UFMG,BHCB,186073,PreservedSpecimen,Plantae,Monocotyledon,,,Velloziaceae,Barbacenia,tomentosa,,Barbacenia tomentosa,Mart.,,,,,,"Gontijo, FD",453,,2014,10,31,,Southern America,Brasil,Minas Gerais,Itambé do Mato Dentro,,-43.288792,-19.369256,-43.288792,-19.369256,,,0,0,,,,,,,,,"Herbáceo; Floração; Flores laranjas/vermelhas. Altura 0,15m. Sobre quartzito.; Campo rupestre sobre formação quartzítica",BHCB186073,,
2020-12-11 11:45:26-03,UFMG,BHCB,190951,PreservedSpecimen,Plantae,Monocotyledon,,,Velloziaceae,Barbacenia,tomentosa,,Barbacenia tomentosa,Mart.,,,,,,"Vidal, CV",s.n.,,2018,04,25,,Southern America,Brasil,Minas Gerais,Mariana,Complexo Germano,-43.54,-20.160833,-43.54,-20.160833,,,1432,1432,,,,,,,,,Campo Rupestre sobre Canga,BHCB190951,,
2020-12-11 11:45:26-03,UFMG,BHCB,192456,PreservedSpecimen,Plantae,Monocotyledon,,,Velloziaceae,Barbacenia,tomentosa,,Barbacenia tomentosa,Mart.,,2018,04,10,,"Bondi-Macedo, LF; Paula, LFA de; Porembski, S; Gillerot, L; Azevedo, LO",10,,2018,03,22,,Southern America,Brasil,Minas Gerais,Teófilo Otoni,Pedra da Fazenda Primavera,-41.2775,-17.906111,-41.2775,-17.906111,,,387,387,,,,,,,,,"Até 0,5m de altura, flores virando frutos de cor verde clara. Folhas secas e velhas presentes (muitas). Formando moitas de vegetação; Ilha de vegetação em afloramento rochoso",BHCB192456,,
2020-12-11 11:45:26-03,UFMG,BHCB,196189,PreservedSpecimen,Plantae,Monocotyledon,,,Velloziaceae,Barbacenia,tomentosa,,Barbacenia tomentosa,Mart.,,2018,10,18,,"Lopes, ADC; Abel, FLAS",184,,2018,02,23,,Southern America,Brasil,Minas Gerais,Belo Horizonte,"Parque da Serra do Curral, Trilha ecológica na crista da Serra",-43.906667,-19.956944,-43.906667,-19.956944,,,1414,1414,,,,,,,,,"Erva, ca. 20 cm de altura. Rupícola. Flores laranja-avermelhadas.; Canga",BHCB196189,BHCB196189 BHCB196189_v1 BHCB196189_v2 BHCB196189_v3 BHCB196189_v4 BHCB196189_v5,
2020-12-11 11:45:26-03,UFMG,BHCB,200264,PreservedSpecimen,Plantae,Monocotyledon,,,Velloziaceae,Barbacenia,tomentosa,,Barbacenia tomentosa,Mart.,,,,,,"Rezende, SG",7331,,2019,04,09,,Southern America,Brasil,Minas Gerais,Barão de Cocais,Cocais,-43.378333,-19.848056,-43.378333,-19.848056,,,910,910,,,,,,,,,Erva; Campo Rupestre sobre Quartzito Herbáceo,BHCB200264,,
2021-06-08 16:23:12-03,UFMG,BHCB,202028,PreservedSpecimen,Plantae,Monocotyledon,,,Velloziaceae,Barbacenia,tomentosa,,Barbacenia tomentosa,Mart.,,2019,09,,,"Rezende, SG",7393,,2019,05,22,,Southern America,Brasil,Minas Gerais,Conceição do Mato Dentro,Parque Estadual da Serra do Intendente,-43.570556,-19.103611,-43.570556,-19.103611,,,0,0,,,,,,,,,"Floração, Rupícola; Campo Rupestre Quartzítico",BHCB202028,,
2021-06-08 16:23:12-03,UFMG,BHCB,202119,PreservedSpecimen,Plantae,Monocotyledon,,,Velloziaceae,Barbacenia,tomentosa,,Barbacenia tomentosa,Mart.,,,,,,"Rezende, SG",7533,,2019,06,06,,Southern America,Brasil,Minas Gerais,Jaboticatubas,"Parque Estadual da Serra do Cipó, Distrito de São José da Serra.",-43.609722,-19.419722,-43.609722,-19.419722,,,0,0,,,,,,,,,Campo Rupestre Quartzítico,BHCB202119,,
