MODIFIED,INSTITUTIONCODE,COLLECTIONCODE,CATALOGNUMBER,BASISOFRECORD,KINGDOM,PHYLUM,CLASS,ORDER,FAMILY,GENUS,SPECIFICEPITHET,INFRASPECIFICEPITHET,SCIENTIFICNAME,SCIENTIFICNAMEAUTHORSHIP,IDENTIFIEDBY,YEARIDENTIFIED,MONTHIDENTIFIED,DAYIDENTIFIED,TYPESTATUS,RECORDEDBY,RECORDNUMBER,FIELDNUMBER,YEAR,MONTH,DAY,EVENTTIME,CONTINENTOCEAN,COUNTRY,STATEPROVINCE,COUNTY,LOCALITY,DECIMALLONGITUDE,DECIMALLATITUDE,VERBATIMLONGITUDE,VERBATIMLATITUDE,COORDINATEPRECISION,BOUNDINGBOX,MINIMUMELEVATIONINMETERS,MAXIMUMELEVATIONINMETERS,MINIMUMDEPTHINMETERS,MAXIMUMDEPTHINMETERS,SEX,PREPARATIONTYPE,INDIVIDUALCOUNT,PREVIOUSCATALOGNUMBER,RELATIONSHIPTYPE,RELATEDCATALOGITEM,OCCURRENCEREMARKS,BARCODE,IMAGECODE,GEOFLAG
2021-03-24 17:09:19-03,UFES,SAMES,1687,PreservedSpecimen,Plantae,,,,Malpighiaceae,Byrsonima,nitidifolia,,Byrsonima nitidifolia,A.Juss.,"Forzza, R.C.",2016,06,01,,"Pinto Junior, H.V.; Covre, C.",251,,2016,03,21,,,Brasil,Espírito Santo,Nova Venécia,Pedra do Elefante. Vertente leste da Pedra do Elefante.,-40.4006004333496,-18.710599899292,,,42400,,,,,,,,,,,,"Árvore de 1,5 metros; folhas verdes; inflorescência marrom; flores com pétalas brancas e sépalas marrom; abundante; trilha principal.",SAMES01687,,auto
2021-03-24 17:09:19-03,UFES,SAMES,8209,PreservedSpecimen,Plantae,,,,Malpighiaceae,Byrsonima,nitidifolia,,Byrsonima nitidifolia,A.Juss.,,,,,,"Pinto Junior,H.V.; W.S.Justino.;T.Sperandio.",387,,2018,03,21,,,Brasil,Espírito Santo,Nova Venécia,APA PEDRA DO ELEFANTE.,-40.4006004333496,-18.710599899292,-404611111.0,-187700000.0,42400,,,,,,,,,,,,"Folhas verdes, sombra abundante, coletado na trilha para pedra do elefante.",SAMES08209,,auto
2020-04-22 16:21:24-03,UFPB,JPB,41977,PreservedSpecimen,Plantae,Angiosperma,,Dicotyledon,Malpighiaceae,Byrsonima,nitidifolia,,Byrsonima nitidifolia,A. Juss.,"Lima, RB",2009,,,,"Medeiros, MM; Paulo; Rangel, AL",16,,2003,,,,Southern America,Brasil,Paraíba,Maturéia,"Pico do Jabre, Parcela 1",-37.382778,-7.251667,-37.382778,-7.251667,,,1085,1197,,,,,,,,,"; HABITAT: Mata Atlântica. Floresta Estacional Semidecidual Montana.; DESC: Substrato argiloso. Árvore, cerca 13 m de altura.",,,
2021-06-30 13:18:29-03,MBM,MBM,392764,S,Plantae,,,,Malpighiaceae,Byrsonima,nitidifolia,,Byrsonima nitidifolia,A. Juss.,"Almeida, R.F.",2012,11,,,"Fontana, A.P.; Kollmann, L.; Labiak, P.; Schwartsburd, P.B.; Kollmann, L.; Labiak, P.; Schwartsburd, P.B.",5769,,2009,01,14,,Southern America,Brazil,Espírito Santo,Nova Venécia,"Área de Proteção Ambiental da Pedra do Elefante, Serra de Baixo, morro ao lado direito na estrada para a pedra do Elefante",-40.4475,-18.77,-40.4475,-18.77,,,300,600,,,,,,,,,"Arbusto, ca. 2m. Inflorescência ferrugínea. Botões com glândulas brancas.; Inselbergue, afloramento rochoso.",MBM392764,MBM392764,
2021-06-13 16:41:00-03,NY,NYBG,475421,PreservedSpecimen,Plantae,Magnoliophyta,,Malpighiales,Malpighiaceae,Byrsonima,nitidifolia,,Byrsonima nitidifolia,A.Juss.,W. R. Anderson,,,,,S. A. Mori,10041,,1978,04,27,,South America,Brazil,Bahia,Maracás,"13 a 22 km ao S de Maracás, pela antiga rod. para Jequié. Folha SD-24 (14-40a)",-40.4306,-13.4411,,,,,900,900,,,,sheet,,,,,<a href='http://sweetgum.nybg.org/science/vh/specimen_details.php?irn=477527' target='other'> <mi>dwc_moreinfo</mi></a>,NY00475421,NY00475421_01,
2021-06-13 16:41:00-03,NY,NYBG,475420,PreservedSpecimen,Plantae,Magnoliophyta,,Malpighiales,Malpighiaceae,Byrsonima,nitidifolia,,Byrsonima nitidifolia,A.Juss.,S. F. Smith,,,,,R. A. Wasum,8102,,1992,01,25,,South America,Brazil,Sergipe,Areia Branca,Serra de Itabaiana,-37.3153,-10.7581,,,,,650,650,,,,sheet,,,,,<a href='http://sweetgum.nybg.org/science/vh/specimen_details.php?irn=477528' target='other'> <mi>dwc_moreinfo</mi></a>,NY00475420,NY00475420_01,
2021-03-21 19:36:35-03,UFC,EAC,7464,PreservedSpecimen,Plantae,Dicotyledon,,,Malpighiaceae,Byrsonima,nitidifolia,,Byrsonima nitidifolia,A. Juss.,"Anderson, W.R.",1986,03,07,,"Martins, P.; Nunes, E.",s.n.,,1979,11,17,,Southern America,Brasil,Maranhão,São Raimundo das Mangabeiras,entre S. Rdo das Mangabeiras e ta. Teresa,-45.4810981750488,-7.02194023132324,0,0,63658,,,,,,,,,,,,"Arbusto, flor branca.; Cerrado",EAC0007464,EAC0007464,auto
2021-03-21 19:36:35-03,UFC,EAC,9116,PreservedSpecimen,Plantae,Dicotyledon,,,Malpighiaceae,Byrsonima,nitidifolia,,Byrsonima nitidifolia,A. Juss.,"Fernandes, A.; Nunes, E.",1986,03,26,,"Fernandes, A.; Del'Arco, M.R.; Castro, A.J.",EAC9116,,1980,12,11,,Southern America,Brasil,Piauí,Ribeiro Gonçalves,Estação Ecológica de Uruiçuí-Una.,-45.2421989440918,-7.55833005905151,0,0,121004,,,,,,,,,,,,"Subarbusto, flor brancascenta.; Cerrado",EAC0009116,EAC0009116,auto
2021-03-15 18:28:20-03,USP,SPF,122100,PreservedSpecimen,Plantae,,,,Malpighiaceae,Byrsonima,nitidifolia,,Byrsonima nitidifolia,A.Juss.,"Mamede, MCH",1998,,,,"Franciosi, ERN",17,,1996,12,16,,,Brasil,São Paulo,Cunha,"Parque Estadual da Serra do Mar, Flores Ombrófila Densa Montana. Pastagem com arbustos e árvores isoladas.",-44.993333,-23.245833,-44.993333,-23.245833,,,,,,,,,,,,,Arbusto 3.0 m alt.,SPF00122100,SPF00122100,
2021-05-18 11:14:18-03,UEFS,HUEFS,114957,PreservedSpecimen,Plantae,Angiospermae,Rosanae,Malpighiales,Malpighiaceae,Byrsonima,nitidifolia,,Byrsonima nitidifolia,A.Juss.,D.Cardoso,2008,05,,,"Cardoso, D.",1477,,2006,12,12,,,Brasil,Bahia,Anguera,Morro da Fazenda Retiro.,-39.183333,-12.15,39W11',12S9',,,500,500,,,,,,,,,Fragmento de floresta estacional com afloramentos de quartzito.,HUEFS0114957,HUEFS0114957,
2021-05-18 11:14:18-03,UEFS,HUEFS,24132,PreservedSpecimen,Plantae,Angiospermae,Rosanae,Malpighiales,Malpighiaceae,Byrsonima,nitidifolia,,Byrsonima nitidifolia,A.Juss.,F.França & M.O.S.Rodrigues,1999,09,,,"Guedes, M.L.S.",PCD2880,,1996,04,06,,,Brasil,Bahia,Jacobina,,-40.5,-11.15,40W30',11S9',,,700,700,,,,,,,,,,HUEFS0024132,HUEFS0024132,
2021-05-18 11:14:18-03,UEFS,HUEFS,24874,PreservedSpecimen,Plantae,Angiospermae,Rosanae,Malpighiales,Malpighiaceae,Byrsonima,nitidifolia,,Byrsonima nitidifolia,A.Juss.,A.Amorim,1999,01,,,"Melo, E.",1440,,1996,02,24,,,Brasil,Bahia,Itatim,Morro das Tocas.,-39.766667,-12.7,39W46',12S42',,,280,410,,,,,,,,,,HUEFS0024874,HUEFS0024874,
2021-05-18 11:14:18-03,UEFS,HUEFS,26629,PreservedSpecimen,Plantae,Angiospermae,Rosanae,Malpighiales,Malpighiaceae,Byrsonima,nitidifolia,,Byrsonima nitidifolia,A.Juss.,A.Amorim,1999,01,,,"França, F.",2173,,1997,03,16,,,Brasil,Bahia,Milagres,Morro Pé de Serra.,-39.825833,-12.869167,39W49'33'',12S52'9'',,,378,378,,,,,,,,,Mata da base.,HUEFS0026629,HUEFS0026629,
2021-05-18 11:14:18-03,UEFS,HUEFS,59675,PreservedSpecimen,Plantae,Angiospermae,Rosanae,Malpighiales,Malpighiaceae,Byrsonima,nitidifolia,,Byrsonima nitidifolia,A.Juss.,P.D.Carvalho,2003,09,,,"Souza, E.R.de",217,,2002,04,23,,,Brasil,Bahia,Maracás,"Vincincinal para fazendas, saída pelo Cruzeiro, entrada 1,5 km da cidade, 1,4 km N da entrada.",-40.413889,-13.41,40W24'50'',13S24'36'',,,1046,1046,,,,,,,,,Campo rupestre.,HUEFS0059675,HUEFS0059675,
2021-05-18 11:14:18-03,UEFS,HUEFS,62856,PreservedSpecimen,Plantae,Angiospermae,Rosanae,Malpighiales,Malpighiaceae,Byrsonima,nitidifolia,,Byrsonima nitidifolia,A.Juss.,A.Francener,2015,05,,,"Jardim, J.G.",2908,,2000,02,25,,,Brasil,Bahia,Brejões,Rod. Amargosa/Brejões ca. 28km. Margem da rodovia.,-39.780278,-13.063056,39W46'49'',13S3'47'',,,700,700,,,,,,,,,Caatinga Arbórea.,HUEFS0062856,HUEFS0062856,
2021-05-18 11:14:18-03,UEFS,HUEFS,112179,PreservedSpecimen,Plantae,Angiospermae,Rosanae,Malpighiales,Malpighiaceae,Byrsonima,nitidifolia,,Byrsonima nitidifolia,A.Juss.,A.Francener,2013,12,,,"Giulietti, A.M.",1166,,1998,06,24,,,Brasil,Pernambuco,Pesqueira,Serra do Orurubá,-36.6963996887207,-8.35778045654297,,,36615,,,,,,,,,,,,Floresta de altitude.,HUEFS0112179,HUEFS0112179,auto
2016-08-23 10:59:45-03,NHMLondon,NHM-LONDON-BOT,BM000603372,S,Plantae,,,,Malpighiaceae,Byrsonima,nitidifolia,,Byrsonima nitidifolia,Adr.Juss.,W.R. Anderson,1981,,,Isotype,Jacques Samuel Blanchet; b.1807; d.1875; Blanchet,3314,,,,,,,Brasil,,,,-53.08982,-10.773109,-53.08982,-10.773109,,,,,,,,,,NHMUK:ecatalogue:4982940,,,<a href=http://www.nhm.ac.uk/services/media-store/asset/b63b4c466f18f920765000559f04d72be83204eb/contents/preview target=other class=eLink> <mi>dwc_moreinfo</mi></a>,,,
2016-08-23 10:59:45-03,NHMLondon,NHM-LONDON-BOT,BM000603373,S,Plantae,,,,Malpighiaceae,Byrsonima,nitidifolia,,Byrsonima nitidifolia,Adr.Juss.,W.R. Anderson,1981,,,Isotype,Jacques Samuel Blanchet; b.1807; d.1875; Blanchet,3314,,,,,,,Brasil,,,,-53.08982,-10.773109,-53.08982,-10.773109,,,,,,,,,,NHMUK:ecatalogue:4982941,,,<a href=http://www.nhm.ac.uk/services/media-store/asset/e27843caaf6cb44bcf4f840b50b9449408e12b40/contents/preview target=other class=eLink> <mi>dwc_moreinfo</mi></a>,,,
2020-11-04 11:12:35-03,ESALQ,ESA,94878,PreservedSpecimen,Plantae,Magnoliophyta,,,Malpighiaceae,Byrsonima,nitidifolia,,Byrsonima nitidifolia,A.Juss.,"Almeida, R.F. & Frananer, A.",2012,,,,"Demuner, V. ; Bausen, E.",1047.0,,2000,05,11,,,Brasil,Espírito Santo,Santa Teresa,,-40.6002998352051,-19.9356002807617,,,23813,,,,,,,,,,,,,ESA094878,ESA094878,auto
2020-06-25 14:12:58-03,UFCG,CSTR,2933,PreservedSpecimen,Plantae,,,,Malpighiaceae,Byrsonima,nitidifolia,,Byrsonima nitidifolia,,"Cunha, M.C.L.",2006,,,,"Learth, M.C.; Paulo",95,,2006,,,,,Brasil,Paraiba,Maturéia,Brejo de altitude. Parque estadual Pico do sabre.,-37.3513984680176,-7.26694011688232,0,0,10167,,,,,,,,,,,,Adr. Tun.&nf;cor da flor : amarela.,,,auto
2019-08-15 09:03:50-03,UESC,UESC,2938,S,Plantae,Angiospermae,Dicotyledoneae,Florideophycidae,Malpighiaceae,Byrsonima,nitidifolia,,Byrsonima nitidifolia,Adr. Juss. ex Char,,,,,,"França, F.",2173,,1997,03,16,,,Brasil,Bahia,Milagres,,-39.825833,-12.869167,39W49'33'',12S52'9'',,,378,378,,,,,,,,,"Mata da Base.; Árvore ca. 10m, com ramos arqueados.",UESC0002938,,
2020-07-23 12:11:00-03,CEPLAC,CEPEC,138045,PreservedSpecimen,Plantae,,,,Malpighiaceae,Byrsonima,nitidifolia,,Byrsonima nitidifolia,,A. Francener,,,,,V. Demuner,3976,,2007,05,18,,,Brasil,Espírito Santo,ÁGUIA BRANCA,"Santa Luzia, prop. Ciro Ferreira.",-40.661944,-18.974444,40W39'43,18S58'28,,,,,,,,,,,,04/12/2013,,,,
2020-07-23 12:11:00-03,CEPLAC,CEPEC,121091,PreservedSpecimen,Plantae,,,,Malpighiaceae,Byrsonima,nitidifolia,,Byrsonima nitidifolia,,A. Francener,,,,,V. Demuner,1778,,2006,02,14,,,Brasil,Espírito Santo,santa leopoldina,"Serra do Ramalhete,fazenda Caioaba, prop. Cláudio Virloni, trilha da divisa, à direita.",-40.470556,-20.508611,40W28'14,20S30'31,,,,,,,,,,,,05/12/2013,,,,
2020-07-23 12:11:00-03,CEPLAC,CEPEC,121112,PreservedSpecimen,Plantae,,,,Malpighiaceae,Byrsonima,nitidifolia,,Byrsonima nitidifolia,,A. Francener,,,,,V. Demuner,2242,,2006,04,26,,,Brasil,Espírito Santo,ÁGUIA BRANCA,São Pedro. Pedra do CEIER.,-40.648056,-19.022778,40W38'53,19S1'22,,,,,,,,,,,,05/12/2013,,,,
2020-07-23 12:11:00-03,CEPLAC,CEPEC,133462,PreservedSpecimen,Plantae,,,,Malpighiaceae,Byrsonima,nitidifolia,,Byrsonima nitidifolia,,A. Francener,,,,,V. Demuner,3529,,1988,12,03,,,Brasil,Espírito Santo,ÁGUIA BRANCA,"Santa Luzia, propr. Ciro Ferreira.",-40.662222,-18.984167,40W39'44,18S59'3,,,,,,,,,,,,06/12/2013,,,,
2020-07-23 12:11:00-03,CEPLAC,CEPEC,138057,PreservedSpecimen,Plantae,,,,Malpighiaceae,Byrsonima,nitidifolia,,Byrsonima nitidifolia,,A. Francener,,,,,L. F. S. Magnago,1103,,2006,07,26,,,Brasil,Espírito Santo,ÁGUIA BRANCA,"Pedra da Bandeira, Santa Luzia, Prop. Ciro Ferreira.",-40.665556,-18.977778,40W39'56,18S58'40,,,,,,,,,,,,04/12/2013,,,,
2020-07-23 12:11:00-03,CEPLAC,CEPEC,139665,PreservedSpecimen,Plantae,,,,Malpighiaceae,Byrsonima,nitidifolia,,Byrsonima nitidifolia,,A. Francener,,,,,L. F. S. Magnapo,754,,2006,02,22,,,Brasil,Espírito Santo,colatina,"Alto Moacir. Pedra do Cruzeiro, Prop. Landislau.",0,-19.310833,40W31'75,19S18'39,,,,,,,,,,,,04/12/2013,,,,
2020-07-23 12:11:00-03,CEPLAC,CEPEC,96954,PreservedSpecimen,Plantae,,,,Malpighiaceae,Byrsonima,nitidifolia,,Byrsonima nitidifolia,,F. França,,,,,M. L. Guedes,,,2005,04,08,,,Brasil,Bahia,JACOBINA,Caminho para Pingadeira.,-40.504722,-11.164722,40W30'17,11S9'53,,,,,,,,,,,,30/09/1999,,,,
2020-07-23 12:11:00-03,CEPLAC,CEPEC,14162,PreservedSpecimen,Plantae,,,,Malpighiaceae,Byrsonima,nitidifolia,,Byrsonima nitidifolia,,W. R. Anderson,,,,,S. A. Mori,10041,,1978,04,27,,,Brasil,Bahia,MARACÁS,"13 a 22Km ao S Maracas, pela antiga Rod. p/ Jequié.",-40.4308013916016,-13.4411001205444,,,50558,,,,,,,,,,,30/12/1979,,,,auto
2020-07-23 12:11:00-03,CEPLAC,CEPEC,102627,PreservedSpecimen,Plantae,,,,Malpighiaceae,Byrsonima,nitidifolia,,Byrsonima nitidifolia,,A. Francener,,,,,V. Demuner,1047,,2000,05,11,,,Brasil,Espírito Santo,SANTA TERESA,Estação Biológica de Santa Lúcia. Trilha abaixo da cachoeira.,-40.6002998352051,-19.9356002807617,,,23813,,,,,,,,,,,05/12/2013,,,,auto
2020-07-23 12:11:00-03,CEPLAC,CEPEC,113948,PreservedSpecimen,Plantae,,,,Malpighiaceae,Byrsonima,nitidifolia,,Byrsonima nitidifolia,,A. Francener,,,,,"Vervloet, R. R.",2155,,2003,04,08,,,Brasil,Espírito Santo,SANTA TERESA,"Nova Lombardia, Reserva Biológica Augusto Ruschi, estrada Giopabo-Açu, parte final.",-40.6002998352051,-19.9356002807617,,,23813,,,,,,,,,,,,,,,auto
2020-07-23 12:11:00-03,CEPLAC,CEPEC,139674,PreservedSpecimen,Plantae,,,,Malpighiaceae,Byrsonima,nitidifolia,,Byrsonima nitidifolia,,A. Francener,,,,,R. R. Vervloet,325,,2002,05,29,,,Brasil,Espírito Santo,SANTA TERESA,"Nova Lombardia. Reserva Biológica Augusto Ruschi, trilha da cachoeira, sede, saindo na sede nova.",-40.6002998352051,-19.9356002807617,,,23813,,,,,,,,,,,04/12/2013,,,,auto
2020-07-23 12:11:00-03,CEPLAC,CEPEC,97404,PreservedSpecimen,Plantae,,,,Malpighiaceae,Byrsonima,nitidifolia,,Byrsonima nitidifolia,,A. G. da Silva,,,,,A. G. da Silva,352,,2000,11,20,,,Brasil,Pernambuco,brejo da madre de deus,Mata do Malhada.,-36.3711013793945,-8.14583015441895,36W24'735,8S11'141,34231,,,,,,,,,,,12/06/2001,,,,auto
2019-11-21 10:08:28-03,IBt,SP,445322,S,Plantae,,,,Malpighiaceae,Byrsonima,nitidifolia,,Byrsonima nitidifolia,A.Juss.,"Francener, A; Almeida, RF",2012,09,,,"Magnago, LFS; Demuner, V; Belizário, M; Bausen, E",754,,2006,02,22,,,Brasil,Espírito Santo,Colatina,"Alto Moacir, Pedra do Cruzeiro, propr.: Landislau",-40.3175,-19.1839,-40.3175,-19.1839,,,150,850,,,,,,,,,,,,
2019-11-21 10:08:28-03,IBt,SP,266527,S,Plantae,,,,Malpighiaceae,Byrsonima,nitidifolia,,Byrsonima nitidifolia,A.Juss.,"Mamede, MCH",2002,,,,"Thomas, WW; Carvalho, AM; Santos, TS; Amorim, AM; Sant'Ana, SC; Jardim, JG",9268,,1992,05,14,,,Brasil,Bahia,Wenceslau Guimarães,"Ca. 3 Km W of Nova Esperança, W edge of Reserva Estadual Wenceslau Guimarães",-39.716667,-13.6,-39.716667,-13.6,,,500,600,,,,,,,,,,SP015597,SP015597,
2019-11-21 10:08:28-03,IBt,SP,445321,S,Plantae,,,,Malpighiaceae,Byrsonima,nitidifolia,,Byrsonima nitidifolia,A.Juss.,"Francener, A; Almeida, RF",2012,09,,,"Demuner, V; Magnago, LFS; Cruz, T; Bausen, E",2951,,2006,10,18,,,Brasil,Espírito Santo,Águia Branca,"Santa Luzia, prop.: Ciro Ferreira",-40.665556,-18.977778,-40.665556,-18.977778,,,170,600,,,,,,,,,,,,
2019-11-21 10:08:28-03,IBt,SP,445340,S,Plantae,,,,Malpighiaceae,Byrsonima,nitidifolia,,Byrsonima nitidifolia,A.Juss.,"Almeida, RF",2013,03,,,"Demuner, V; Magnagno, LFS; Belisário, M; Bausen, E",1778,,2006,02,14,,,Brasil,Espírito Santo,Santa Leopoldina,"Serra do Ramalhete, Fazenda Caioaba, Prop.: Cláudio Virloni, trilha da divisa, lado direito",-40.470556,-20.058333,-40.470556,-20.058333,,,250,500,,,,,,,,,,,,
2019-11-21 10:08:28-03,IBt,SP,445339,S,Plantae,,,,Malpighiaceae,Byrsonima,nitidifolia,,Byrsonima nitidifolia,A.Juss.,"Almeida, RF",2012,09,,,"Kollmann, L; Fontana, AP; Brito, RC",7691,,2005,04,29,,,Brasil,Espírito Santo,Santa Teresa,"25 de Julho, Bela Vista",-40.6002998352051,-19.9356002807617,0,0,23813,,,,,,,,,,,,,,,auto
2019-11-21 10:08:28-03,IBt,SP,445323,S,Plantae,,,,Malpighiaceae,Byrsonima,nitidifolia,,Byrsonima nitidifolia,A.Juss.,"Francener, A; Almeida, RF",2012,09,,,"Demuner, V; Bausen, E",1047,,2000,05,11,,,Brasil,Espírito Santo,Santa Teresa,"Estação Biológica de Santa Lúcia, Trilha abaixo da cachoeira",-40.6002998352051,-19.9356002807617,0,0,23813,,,,,,,,,,,,,,,auto
2019-11-21 10:08:28-03,IBt,SP,330298,S,Plantae,,,,Malpighiaceae,Byrsonima,nitidifolia,,Byrsonima nitidifolia,A.Juss.,"Lara, SS",1995,05,12,,"Correia, M; Moura, F",153,,1995,04,04,,,Brasil,Pernambuco,Pesqueira,Fazenda São Francisco,-36.6963996887207,-8.35778045654297,0,0,36615,,1086,1086,,,,,,,,,,SP014825,SP014825,auto
2019-11-21 10:08:28-03,IBt,SP,330296,S,Plantae,,,,Malpighiaceae,Byrsonima,nitidifolia,,Byrsonima nitidifolia,A.Juss.,"Mamede, MCH",,,,,"Correia, M; Moura, F",230,,1995,05,30,,,Brasil,Pernambuco,Pesqueira,Fazenda São Francisco,-36.6963996887207,-8.35778045654297,0,0,36615,,1086,1086,,,,,,,,,,SP015596,,auto
2020-08-11 00:16:16-03,UFBA,ALCB,036319,PreservedSpecimen,Plantae,Dicotyledon,,,Malpighiaceae,Byrsonima,nitidifolia,,Byrsonima nitidifolia,A.Juss.,"Guedes, ML",2017,06,,,"Guedes, ML; Harley, RM; Stannard, B; Woodgyer, EM",PCD2880,,1996,04,06,,Southern America,Brasil,Bahia,Jacobina,"Piemonte da Diamantina, Caminho para Pingadeira",-40.504722,-11.164722,-40.504722,-11.164722,,,700,700,,,,,,,,,"7,0 m. Folhas cortáceas, face adaxial verde-brilhante, abaxial verde-clara. Frutos imaturos verdes. Raro; antropizada. Solo areno-pedregoso.",ALCB040573,,
2019-02-15 11:44:52-02,IPA,IPA,60074,S,Plantae,Plantae,,,Malpighiaceae,Byrsonima,nitidifolia,,Byrsonima nitidifolia,A. Juss.,"Nascimento, L.M.",2000,01,13,,"Silva, A.M. da; Silva, A.G. da; Oliveira, C.A.M.; Nascimento, L.M.; Silva, A.G. da; Oliveira, C.A.M.; Nascimento, L.M.",51,,1999,12,28,,Southern America,Brasil,Pernambuco,Brejo da Madre de Deus,"Mata do Malhada, estrada da mata.",-36.401667,-8.187222,-36.401667,-8.187222,,,565,960,,,,,,,,,"Trepadeira. Inflorescência, cálice rosa, possuindo glândulas basal, corola rosa-clara. Frequente.; Mata Estacional.",IPA0060074,,
2019-02-15 11:44:52-02,IPA,IPA,62741,S,Plantae,Plantae,,,Malpighiaceae,Byrsonima,nitidifolia,,Byrsonima nitidifolia,A. Juss.,,,,,,"Melo, E. de; França, F.; Correia, C.; Santos, R. dos; França, F.; Correia, C.; Santos, R. dos",1440,,1996,02,24,,Southern America,Brasil,Bahia,Itatim,"Morro das Tocas, inselberg. Interior da mata da base.",-39.766667,-12.7,-39.766667,-12.7,,,280,410,,,,,,,,,"Árvore com ramos pendentes. Flores jovens com pétalas brancas, anteras amarelas, estigmas e glândulas brancas, pedùnculos com pilosidade ferrugínea. Flores maduras com pétalas rósea e glândulas branco-rosadas. Frutos imaturos verdes.",IPA0062741,,
2020-07-10 09:47:08-03,MBML,MBML-HERBARIO,12540,,Plantae,,,,Malpighiaceae,Byrsonima,nitidifolia,,Byrsonima nitidifolia,A. Juss.,R.F. Almeida/2013,,,,,V. Demuner; et al,1047,,2000,05,11,,,Brasil,Espírito Santo,Santa Teresa,Estação Biológica de Santa Lúcia,-40.530278,-19.971389,40W31'49,19S58'17,,,,,,,,,,,,,"Arvoreta 5m, fruto imaturo cor verde. Parte alta.",MBML012540,MBML012540,
2020-07-10 09:47:08-03,MBML,MBML-HERBARIO,26700,,Plantae,,,,Malpighiaceae,Byrsonima,nitidifolia,,Byrsonima nitidifolia,A. Juss.,R.F. Almeida/IX-2012,,,,,"V. Demuner; L.F.S Magnago, T. Cruz, Elias Bausen, Giovani e Bruno",2242,,2006,04,26,,,Brasil,Espírito Santo,Águia Branca,"São Pedro, pedra do CEIER",-40.648,-19.022833,"40W38'52,8","19S1'22,2",,,200,200,,,,,,,,,"Arvoreta 5m, frutos verdes. Topo da rocha, leve camada de solo.",MBML026700,MBML026700,
2020-07-10 09:47:08-03,MBML,MBML-HERBARIO,28798,,Plantae,,,,Malpighiaceae,Byrsonima,nitidifolia,,Byrsonima nitidifolia,A. Juss.,R.F. Almeida/IX-2012,,,,,"L. F. S. Magnago; V. Demuner, T. Cruz e Elias Bausen",1103,,2006,07,26,,,Brasil,Espírito Santo,Águia Branca,"Pedra da Bandeira, Santa Luzia, prop.: Ciro Ferreira.",-40.665556,-18.977778,40W39'56,18S58'40,,,170,170,,,,,,,,,"Arbusto 2,5m de alt. Frutos verdes. Vegetação rupestre.",MBML028798,MBML028798,
2020-07-10 09:47:08-03,MBML,MBML-HERBARIO,34439,,Plantae,,,,Malpighiaceae,Byrsonima,nitidifolia,,Byrsonima nitidifolia,A. Juss.,R.F. Almeida/IX-2012,,,,,A. M. Amorim; et al,7411,,2008,05,09,,,Brasil,Espírito Santo,Nova Venécia,Área de Proteção Ambiental da Pedra do Elefante,-40.469722,-18.804444,40W28'11,18S48'16,,,,,,,,,,,,,,MBML034439,MBML034439,
2020-07-10 09:47:08-03,MBML,MBML-HERBARIO,38342,,Plantae,,,,Malpighiaceae,Byrsonima,nitidifolia,,Byrsonima nitidifolia,A. Juss.,R.F. Almeida/IX-2012,,,,,A. P. Fontana; et al,5769,,2009,01,14,,,Brasil,Espírito Santo,Nova Venécia,Área de Proteção Ambiental da Pedra do Elefante,-40.4475,-18.77,40W26'51,18S46'12,,,,,,,,,,,,,,MBML038342,MBML038342,
2021-03-04 11:05:39-03,UFRB,HURB,12915,PreservedSpecimen,Plantae,,,,Malpighiaceae,Byrsonima,nitidifolia,,Byrsonima nitidifolia,A.Juss.,M.L.Guedes,2016,04,,,"Guedes, M.L.; Harley, R.M.; Stannard, B. & Woodgyer, E.",2880,,1996,04,06,,,Brasil,Bahia,Jacobina,Piemonte da Diamantina; Caminho para Pingadeira,-40.504722,-11.164722,40º30'17W,11º09'53S,,,700,700,,,,,,,,,ALCB 36319.,HURB000012915,,
2021-06-08 10:50:22-03,UFRPE,HST,17842,PreservedSpecimen,Plantae,,,,Malpighiaceae,Byrsonima,nitidifolia,,Byrsonima nitidifolia,A.Juss.,M.L.Guedes,2016,04,,,"M.L.Guedes; R.Harley, B.Stannard, E.Woodgyer",PCD 2880,,1996,04,06,,,Brasil,Bahia,Jacobina,caminho para Pingadeira,-40.504722,-11.164722,40W30'17'',11S9'53'',,,700,700,,,,,,,,,"Árvore até 7 m alt.; folhas coriáceas, faces adaxial verde-brilhante e abaxial verde-clara; frutos imaturos verdes. Raro.",HST017842,,
2019-09-04 19:00:46-03,F,FMNH-SEEDPLANTS,,PreservedSpecimen,Plantae,Spermatophyta,Dicotyledoneae,,Malpighiaceae,Byrsonima,nitidifolia,,Byrsonima nitidifolia,,,,,,Type [status unknown],J. S. Blanchet,3314,,,,,,South America,Brazil,,,,-52.8731,-10.8339,,,,,,,,,,,,,,,,,,
2019-09-04 18:38:36-03,F,FMNH-SEEDPLANTS,V0062636F,PreservedSpecimen,Plantae,Spermatophyta,Dicotyledoneae,,Malpighiaceae,Byrsonima,nitidifolia,,Byrsonima nitidifolia,,,,,,Isotype,J. S. Blanchet,3314,,,,,,South America,Brazil,,,,-52.8731,-10.8339,,,,,,,,,,,,,,,,V0062636F,V0062636F_01,
2015-03-13 18:26:54-03,F,FMNH-SEEDPLANTS,V0221407F,PreservedSpecimen,Plantae,Spermatophyta,Dicotyledoneae,,Malpighiaceae,Byrsonima,nitidifolia,,Byrsonima nitidifolia,,,,,,,,,,,,,,South America,Brazil,,,,-52.8731,-10.8339,,,,,,,,,,,,,,,,V0221407F,V0221407F_01,
2015-03-13 18:26:54-03,F,FMNH-SEEDPLANTS,V0221408F,PreservedSpecimen,Plantae,Spermatophyta,Dicotyledoneae,,Malpighiaceae,Byrsonima,nitidifolia,,Byrsonima nitidifolia,,,,,,,,,,,,,,South America,Brazil,,,,-52.8731,-10.8339,,,,,,,,,,,,,,,,V0221408F,V0221408F_01,
2014-09-23 10:58:32-03,G,G,G00352729,S,Plantae,,,,Malpighiaceae,Byrsonima,nitidifolia,,Byrsonima nitidifolia,A. Juss.,"Anderson, W. R.",1993,01,01,ISOTYPUS of Byrsonima nitidifolia A. Juss.,"Blanchet, J. S.",3314,,1841,,00,,AMERIQUE DU SUD,Brazil,Bahia,,,-41.9972222,-12.1830556,-41.9972222,-12.1830556,,,,,,,,,,,,,Coordinate uncertainty: Precision at the level of departement/region Image URL: No picture available on the institution's web site,G00352729,,
2014-09-23 10:58:32-03,G,G,G00352730,S,Plantae,,,,Malpighiaceae,Byrsonima,nitidifolia,,Byrsonima nitidifolia,A. Juss.,?,,,,ISOTYPUS of Byrsonima nitidifolia A. Juss.,"Blanchet, J. S.",3314,,1841,,00,,AMERIQUE DU SUD,Brazil,Bahia,,,-41.9972222,-12.1830556,-41.9972222,-12.1830556,,,,,,,,,,,,,Coordinate uncertainty: Precision at the level of departement/region Image URL: No picture available on the institution's web site,G00352730,,
