MODIFIED,INSTITUTIONCODE,COLLECTIONCODE,CATALOGNUMBER,BASISOFRECORD,KINGDOM,PHYLUM,CLASS,ORDER,FAMILY,GENUS,SPECIFICEPITHET,INFRASPECIFICEPITHET,SCIENTIFICNAME,SCIENTIFICNAMEAUTHORSHIP,IDENTIFIEDBY,YEARIDENTIFIED,MONTHIDENTIFIED,DAYIDENTIFIED,TYPESTATUS,RECORDEDBY,RECORDNUMBER,FIELDNUMBER,YEAR,MONTH,DAY,EVENTTIME,CONTINENTOCEAN,COUNTRY,STATEPROVINCE,COUNTY,LOCALITY,DECIMALLONGITUDE,DECIMALLATITUDE,VERBATIMLONGITUDE,VERBATIMLATITUDE,COORDINATEPRECISION,BOUNDINGBOX,MINIMUMELEVATIONINMETERS,MAXIMUMELEVATIONINMETERS,MINIMUMDEPTHINMETERS,MAXIMUMDEPTHINMETERS,SEX,PREPARATIONTYPE,INDIVIDUALCOUNT,PREVIOUSCATALOGNUMBER,RELATIONSHIPTYPE,RELATEDCATALOGITEM,OCCURRENCEREMARKS,BARCODE,IMAGECODE,GEOFLAG
2008-05-27 22:02:00-03,MO,MOBOT,1866130,PreservedSpecimen,Plantae,,,,Fabaceae,Collaea,speciosa,,Collaea speciosa,(Loisel.) DC.,,,,,,G.H. Tate,Tate 1022,,1926,4,,,South America,Bolivia,La Paz,Larecaja,"Loc. La Joya, rio Tipuani.",-68.08333,-15.55,,,,,1800.00000000,,,,,,,,,,,,,
2019-07-23 08:56:00-03,MO,MOBOT,1868528,PreservedSpecimen,Plantae,,,,Fabaceae,Collaea,speciosa,,Collaea speciosa,(Loisel.) DC.,A. Fuentes (USZ),,,,,Tatiana B. Miranda|Carla Maldonado|F. Canqui,Miranda Gonzáles 575,02-27,2002,12,5,,South America,Bolivia,La Paz,Franz Tamayo,"Senda Apolo-San José de Uchupiamonas, a 10 minutos antes de llegar al arroyo Piñalito, a lado derecho del camino.",-68.2547222,-14.5113889,,,,,2222.00000000,,,,,,1,,,,,,,
2017-04-11 13:40:00-03,MO,MOBOT,1869385,PreservedSpecimen,Plantae,,,,Fabaceae,Collaea,speciosa,,Collaea speciosa,(Loisel.) DC.,A. Fuentes (USZ),,,,,Carla Maldonado|Tatiana B. Miranda|F. Canqui|Remberto Alvarez,Maldonado Goyzueta 3003,02-48,2002,10,3,,South America,Bolivia,La Paz,Franz Tamayo,"Área Natural de Manejo Integrado Madidi. Senda Apolo-San José de Uchupiamonas, a 500 m antes de llegar al arroyo Turnia, pasando la escuela 3 de Mayo.",-68.3372222,-14.5675,,,,,1693.00000000,,,,,,1,,,,,,,
2020-08-22 08:34:00-03,MO,MOBOT,1898233,PreservedSpecimen,Plantae,,,,Fabaceae,Collaea,speciosa,,Collaea speciosa,(Loisel.) DC.,A. Fuentes (USZ),,,,,L. Cayola|et al.,Cayola Pérez 279,03-11,2003,4,22,,South America,Bolivia,La Paz,Franz Tamayo,"Parque Nacional-ANMI Madidi, Senda Apolo-San Jose de Uchupiamonas, a media hora de 3 de Mayo, hacia Turnia. Parcela temporal de muestreo (0,07 ha)100.",-68.3344444,-14.5608333,,,,,1824.00000000,,,,,,1,,,,,,,
2016-04-29 08:58:00-03,MO,MOBOT,1921561,PreservedSpecimen,Plantae,,,,Fabaceae,Collaea,speciosa,,Collaea speciosa,(Loisel.) DC.,A. Fuentes (USZ),,,,,Alfredo F. Fuentes|Narel Paniagua Zambrana|L. Cayola|Susan Whitehead|Ramiro Cuevas,Fuentes Claros 5602,03-03,2003,11,5,,South America,Bolivia,La Paz,Franz Tamayo,"Área Natural de Manejo Integrado Madidi,entre Pata y Virgen del Rosario.",-68.6827778,-14.6152778,,,,,1220.00000000,,,,,,6,,,,,,,
2020-06-28 07:29:00-03,MO,MOBOT,1937289,PreservedSpecimen,Plantae,,,,Fabaceae,Collaea,speciosa,,Collaea speciosa,(Loisel.) DC.,A. Fuentes (USZ),,,,,Alejandro Araujo M.,Araujo Murakami 607,03-06,2003,11,5,,South America,Bolivia,La Paz,Franz Tamayo,"Área Natural de Manejo Integrado Madidi, Entre Pata y Virgen del Rosario.",-68.6827778,-14.6155556,,,,,1220.00000000,,,,,,6,,,,,,,
2009-07-15 23:36:00-03,MO,MOBOT,2182902,PreservedSpecimen,Plantae,,,,Fabaceae,Collaea,speciosa,,Collaea speciosa,(Loisel.) DC.,Ronald Liesner,,,,,Bernie Peyton|S.Tilney Peyton,Peyton 1167,100,1982,9,6,,South America,Peru,Cusco,Urubamba,"Quillabamba, Santa Teresa, on a hillside called Mandornilloc, .5 km W of La Playa.",-72.78333,-12.81666,,,,,2305.00000000,,,,,,,,,,,,,
2020-03-18 04:38:00-03,MO,MOBOT,2205369,PreservedSpecimen,Plantae,,,,Fabaceae,Collaea,speciosa,,Collaea speciosa,(Loisel.) DC.,G.P. Lewis (K),,,,,Isau Huamantupa|Yorka Gutiérrez|G. Huallparimachi,Huamantupa Chuquimaco 3867,,2003,11,23,,South America,Peru,Cusco,Urubamba,"Dist. Machu Picchu, trocha Hiran Bingan, Bosque Seco Secundario",-72.51666,-13.15,,,,,3000.00000000,3500.00000000,,,,,3,,,,,,,
2017-05-16 10:20:00-03,MO,MOBOT,2206888,PreservedSpecimen,Plantae,,,,Fabaceae,Collaea,speciosa,,Collaea speciosa,(Loisel.) DC.,R.Liesner (MO),,,,,Efraín Suclli,Suclli Montañés 1056,,2003,6,18,,South America,Peru,Cusco,,"Dist. Santa Ana, Tunquimayo, Bosque Montano",-72.9333333,-13.05,,,,,2800.00000000,,,,,,7,,,,,,,
2019-01-25 04:35:00-02,MO,MOBOT,2736823,PreservedSpecimen,Plantae,,,,Fabaceae,Collaea,speciosa,,Collaea speciosa,(Loisel.) DC.,G.P. Lewis (K),,,,,Luis Valenzuela G.|Efraín Suclli|V. Chama|J. Latorre,Valenzuela Gamarra 4058,,2004,10,13,,South America,Peru,Cusco,Quispicanchis,"Dist. Marcapata, Quincemil, Bosque Secundario.",-70.89694,-13.49277,,,,,2800.00000000,600.00000000,,,,,11,,,,,,,
2012-09-15 05:08:00-03,MO,MOBOT,2738821,PreservedSpecimen,Plantae,,,,Fabaceae,Collaea,speciosa,,Collaea speciosa,(Loisel.) DC.,G.P. Lewis (K),,,,,Jim Farfán|Yesenia Vizcardo|V. Chama,Farfán 496,,2003,10,19,,South America,Peru,Cusco,La Convención,"Dist. Vilcabamba, Yupanca, Cochapata, Bosque Mixto.",-72.95027,-13.0325,,,,,3300.00000000,,,,,,4,,,,,,,
2013-06-02 05:38:00-03,MO,MOBOT,2739715,PreservedSpecimen,Plantae,,,,Fabaceae,Collaea,speciosa,,Collaea speciosa,(Loisel.) DC.,G.P. Lewis (K),,,,,Washington L. Galiano|Efraín Suclli,Galiano 5685,,2004,4,,,South America,Peru,Cusco,La Convención,"Dist. Huayopata, Amaybamba, Huyro, Santa María. Bosque Intervenido, Cultivos.",-72.63527,-13.00527,,,,,1200.00000000,,,,,,4,,,,,,,
2011-02-12 21:46:00-02,MO,MOBOT,2747772,PreservedSpecimen,Plantae,,,,Fabaceae,Collaea,speciosa,,Collaea speciosa,(Loisel.) DC.,G.P. Lewis (K),,,,,Gloria Calatayud|Isau Huamantupa|Belizario Gonzales,Calatayud Hermosa 2846,,2004,9,22,,South America,Peru,Cusco,La Convención,"Dist. Santa Ana, Tunquimayo. Bosque Primario.",-72.83694,-12.91027,,,,,2675.00000000,,,,,,3,,,,,,,
2012-04-12 05:10:00-03,MO,MOBOT,2756518,PreservedSpecimen,Plantae,,,,Fabaceae,Collaea,speciosa,,Collaea speciosa,(Loisel.) DC.,A. Fuentes (LPB),,,,,Alfredo F. Fuentes|Evert Cuevas,Fuentes Claros 8613,05-62,2005,6,23,,South America,Bolivia,La Paz,Franz Tamayo,"ANMI Apolobamba, Keara Bajo, ca. 1 km bajando por camino a Mojos. Bosque de ceja de monte inferior pluvial con Escallonia myrtilloides var. patens y Myrsine spp. Inventario fitosociologico Madidi 41. Plantas alcoholizadas.",-69.07361,-14.6975,,,,,3205.00000000,,,,,,5,,,,,,,
2009-09-08 18:32:00-03,MO,MOBOT,2770266,PreservedSpecimen,Plantae,,,,Fabaceae,Collaea,speciosa,,Collaea speciosa,(Loisel.) DC.,A. Fuentes (LPB),,,,,F. Miranda|Rúben Huanca|Pamela Mollinedo,Miranda Aviles 717,05-02,2005,4,18,,South America,Bolivia,La Paz,Bautista Saavedra,"Area Natural de Manejo Integrado Apolobamba, Carpa, subiendo al N del puente. Bosque montano estacional con Nectandra, Miconia y Hieronyma.",-68.81972,-15.20777,,,,,,,,,,,4,,,,,,,
2020-07-17 17:03:00-03,MO,MOBOT,3081442,PreservedSpecimen,Plantae,,,,Fabaceae,Collaea,speciosa,,Collaea speciosa,(Loisel.) DC.,A. Araujo-M. (LPB),,,,,Alejandro Araujo M.|Christopher Davidson|Sharon R. Christoph|Paola Gismondi|M. Cornejo|E. Ticona,Araujo Murakami 2869,06-03,2006,9,16,,South America,Bolivia,La Paz,Bautista Saavedra,Área Natural de Manejo Integrado Apolobamba. Charazani-Camata.,-68.9502778,-15.1819445,,,,,2809.00000000,,,,,,4,,,,,,,
2019-01-25 04:35:00-02,MO,MOBOT,3112015,PreservedSpecimen,Plantae,,,,Fabaceae,Collaea,speciosa,,Collaea speciosa,(Loisel.) DC.,G.P. Lewis (K),,,,,Luis Valenzuela G.,Valenzuela Gamarra 4583,,2005,1,21,,South America,Peru,Cusco,Urubamba,"Dist. Machu Picchu, Pampacahua, Km 94, Bosque Secundario",-72.26666,-13.1,,,,,2376.00000000,,,,,,10,,,,,,,
2019-01-25 04:35:00-02,MO,MOBOT,3112819,PreservedSpecimen,Plantae,,,,Fabaceae,Collaea,speciosa,,Collaea speciosa,(Loisel.) DC.,G.P. Lewis (K),,,,,Luis Valenzuela G.,Valenzuela Gamarra 5361,,2005,4,15,,South America,Peru,Cusco,La Convención,"Dist. Santa Teresa, Yanatile, Bosque Secundario",-72.38333,-13.08333,,,,,1935.00000000,,,,,,4,,,,,,,
2010-01-01 20:51:00-02,MO,MOBOT,3175166,PreservedSpecimen,Plantae,,,,Fabaceae,Collaea,speciosa,,Collaea speciosa,(Loisel.) DC.,Ronald Liesner,,,,,Michael O. Dillon|James Aronson|Alan Herrera|Paul E. Berry,Dillon 1112,,1978,7,17,,South America,Peru,Puno,,Ollachea to San Gabon.,-70.47888,-13.66194,,,,,1000.00000000,2000.00000000,,,,,,,,,,,,
2011-09-14 12:00:00-03,MO,MOBOT,3175409,PreservedSpecimen,Plantae,,,,Fabaceae,Collaea,speciosa,,Collaea speciosa,(Loisel.) DC.,Ronald Liesner,,,,,José Steinbach,Steinbach G. 5722,,1921,8,25,,South America,Bolivia,Cochabamba,Chapare,Incachaca Prov. Sacaba. Cerro pedregoso.,-65.87194,-17.20277,,,,,2500.00000000,,,,,,1,,,,,,,
2008-08-07 03:32:00-03,MO,MOBOT,3175496,PreservedSpecimen,Plantae,,,,Fabaceae,Collaea,speciosa,,Collaea speciosa,(Loisel.) DC.,R.H. Fortunato,,,,,Nur Ritter,Ritter 1543,,1995,2,12,,South America,Bolivia,Cochabamba,Chapare,Comunidad Incachaca. The road between Incachaca and Yerva Buena Pampa. Bosque Húmedo Montano.,-65.8166667,-17.2333333,,,,,2200.00000000,,,,,,,,,,,,,
2009-07-15 15:13:00-03,MO,MOBOT,3176249,PreservedSpecimen,Plantae,,,,Fabaceae,Collaea,speciosa,,Collaea speciosa,(Loisel.) DC.,R.H. Fortunato,,,,,Sigrid Liede|Jim Conrad,Liede 3143,,1993,3,13,,South America,Bolivia,La Paz,,"Power Station Harca and Power Station Churuaquani, at bridge crossing stream (Zongo Valley). Roadside, along a little stream.",-68.11666,-16.25,,,,,1650.00000000,3000.00000000,,,,,,,,,,,,
2010-01-01 20:51:00-02,MO,MOBOT,3178575,PreservedSpecimen,Plantae,,,,Fabaceae,Collaea,speciosa,,Collaea speciosa,(Loisel.) DC.,Ronald Liesner,,,,,Michael O. Dillon|James Aronson|Alan Herrera|Paul E. Berry,Dillon 1112,,1978,7,17,,South America,Peru,Puno,,Ollachea to San Gabon.,-70.47888,-13.66194,,,,,1000.00000000,2000.00000000,,,,,,,,,,,,
2008-05-27 22:02:00-03,MO,MOBOT,3178588,PreservedSpecimen,Plantae,,,,Fabaceae,Collaea,speciosa,,Collaea speciosa,(Loisel.) DC.,R. Fortunato,,,,,Laurence J. Dorr,Dorr 6776,,1989,12,22,,South America,Bolivia,La Paz,Inquisivi,"NW of Sita, steep slopes facing Inquisivi. Disturbed forest slopes with Alnus.",-67.16666,-16.96666,,,,,2900.00000000,,,,,,,,,,,,,
2010-07-01 16:42:00-03,MO,MOBOT,3178633,PreservedSpecimen,Plantae,,,,Fabaceae,Collaea,speciosa,,Collaea speciosa,(Loisel.) DC.,D.A. Neill,,,,,Francesca T. Grifo|James C. Solomon,Grifo 655,,1988,1,8,,South America,Bolivia,La Paz,Murillo,Valle de Rio Zongo: 29.6 km N of the pass. A few hundred meters before Sainani generationg station.,-68.1166667,-16.1166667,,,,,2500.00000000,,,,,,1,,,,,,,
2008-05-27 22:02:00-03,MO,MOBOT,90484,PreservedSpecimen,Plantae,,,,Fabaceae,Collaea,speciosa,,Collaea speciosa,(Loisel.) DC.,B. Stein,,,,,Bruce A. Stein|Carol A. Todzia,Stein 2452,85-113,1985,3,30,,South America,Peru,Cusco,Urubamba,"Lucumayo Valley, road from Quillabamba to Ollantaytambo.",-72.45,-13.08333,,,,,,,,,,,5,,,,,,,
2011-03-02 11:04:00-03,MO,MOBOT,3178695,PreservedSpecimen,Plantae,,,,Fabaceae,Collaea,speciosa,,Collaea speciosa,(Loisel.) DC.,Ronald Liesner,,,,,Knud Rahn,Rahn 00266,,1958,5,30,,South America,Peru,Huánuco,,75 km from Huanuco along the road to Tingo Maria.,-75.61666,-9.53333,,,,,1900.00000000,,,,,,,,,,,,,
2008-05-27 22:02:00-03,MO,MOBOT,3178735,PreservedSpecimen,Plantae,,,,Fabaceae,Collaea,speciosa,,Collaea speciosa,(Loisel.) DC.,Ronald Liesner,,,,,Leslie R. Landrum,Landrum 4591,,1982,5,14,,South America,Peru,Junín,,"About 60 km E of Tarma on road to San Ramón, ca. 11 km below road to Huasahuasi. Disturbed shrubby vegetation on steep slopes.",-75.5,-11.25,,,,,2000.00000000,,,,,,,,,,,,,
2013-11-26 05:40:00-02,MO,MOBOT,3313185,PreservedSpecimen,Plantae,,,,Fabaceae,Collaea,speciosa,,Collaea speciosa,(Loisel.) DC.,J. Peñaranda (HSB),,,,,J. Alberto Peñaranda|Martha Serrano|Reinaldo Lozano|Jeaneth Villalobos|Ariel Lliully,Peñaranda 2,,2005,12,21,,South America,Bolivia,Chuquisaca,Hernando Siles,"Bajando de la Estación El Rosal-El Astillero. Pendiente media-superior Restos de bosque decíduo Premontano Tucumano-Boliviano. En borde de camino abundante Tecoma stans, Senna spectabilis, Tipuana tipu y Cedrela lilloi; en las depresiones fisiográficas, ocasionalmente Juglans australis.",-64.19333,-19.4225,,,,,2398.00000000,,,,,,,,,,,,,
2008-05-27 22:02:00-03,MO,MOBOT,89025,PreservedSpecimen,Plantae,,,,Fabaceae,Collaea,speciosa,,Collaea speciosa,(Loisel.) DC.,J.L. Zarucchi,,,,,James C. Solomon|Bruce A. Stein|Marie E. Uehling,Solomon 11894,84-40,1984,3,16,,South America,Bolivia,La Paz,Murillo,"27.4 km N (below) of the dam at Lago Zongo; Valle del Zongo. Moist cloud forest with some tree ferns. North facing slopes more disturbed, drier.",-68.11666,-16.11666,,,,,2500.00000000,,,,,,5,,,,,,,
2013-11-26 05:40:00-02,MO,MOBOT,3313197,PreservedSpecimen,Plantae,,,,Fabaceae,Collaea,speciosa,,Collaea speciosa,(Loisel.) DC.,,,,,,J. Alberto Peñaranda|Martha Serrano|Reinaldo Lozano|Jeaneth Villalobos|Ariel Lliully,Peñaranda 20,,2005,12,24,,South America,Bolivia,Chuquisaca,Hernando Siles,"Subiendo de la Hacienda Guzman para el Abra. Pastizal con abundante cobertura rocosa. Pendiente superior serramía, área de pastizal y bosque de galería. Área co roca aflorante, pastizales y matorrales cubriendo superfices pequeñas y poco extensas. Entre estos bosques de galería de Podocarpus parlatorei y Myrcianthes pseudomato. Dosel bajo cobertura mayor a 90%, con abundancia de briófitos en las ramas. Bosque montano Tucumano-Boliano.",-64.04194,-20.32916,,,,,1854.00000000,,,,,,,,,,,,,
2013-06-02 05:38:00-03,MO,MOBOT,3336932,PreservedSpecimen,Plantae,,,,Fabaceae,Collaea,speciosa,,Collaea speciosa,(Loisel.) DC.,G.P. Lewis (K),,,,,Efraín Suclli,Suclli Montañés 2794,,2005,11,21,,South America,Peru,Cusco,La Convención,"Dist. Santa Ana, Tunquimayo, Bosque montano",-72.8125,-12.90861,,,,,2099.00000000,,,,,,3,,,,,,,
2015-11-12 13:10:00-02,MO,MOBOT,3349815,PreservedSpecimen,Plantae,,,,Fabaceae,Collaea,speciosa,,Collaea speciosa,(Loisel.) DC.,R.Liesner (MO),,,,,Jochen Müller|Jochen Heinrichs,Müller 6195,,1997,9,17,,South America,Bolivia,La Paz,Nor Yungas,NW slope of Cerro Uchumani S Coroico.,-67.7333333,-16.2,,,,,2000.00000000,,,,,,1,,,,,,,
2008-05-27 22:02:00-03,MO,MOBOT,3359582,PreservedSpecimen,Plantae,,,,Fabaceae,Collaea,speciosa,,Collaea speciosa,(Loisel.) DC.,M. Serrano,,,,,Jeaneth Villalobos,Villalobos 405,,2005,11,28,,South America,Bolivia,Chuquisaca,Belisario Boeto,"Mun. Villa Serrano. Comunidad Nuevo Mundo. Trayecto a la Pajcha. Piso Superior Tucumano Boliviano. Cima de serranía con Podocarpus parlatorei, Prunus tucumanensis, Clethra scarbra y Cedrela lilloi, Suelos orgánicos profundos y roca aflorante.",-64.28694,-19.01722,,,,,2269.00000000,,,,,,,,,,,,,
2010-07-07 12:17:00-03,MO,MOBOT,3359586,PreservedSpecimen,Plantae,,,,Fabaceae,Collaea,speciosa,,Collaea speciosa,(Loisel.) DC.,M. Serrano,,,,,Jeaneth Villalobos,Villalobos 14,,2005,8,16,,South America,Bolivia,Chuquisaca,Belisario Boeto,Mun. Villa Serrano. Comunidad Nuevo Mundo. Alrededores de la Comunidad. Camino a Valle Grande. Piso Superior Tucumano Boliviano. Bosque húmedo de neblina con dominancia de Myrcianthes pseudomato y Cedrela lilloi.,-64.2936111,-18.9891666,,,,,2230.00000000,,,,,,1,,,,,,,
2015-11-12 13:09:00-02,MO,MOBOT,3483980,PreservedSpecimen,Plantae,,,,Fabaceae,Collaea,speciosa,,Collaea speciosa,(Loisel.) DC.,R.Liesner (MO),,,,,Isau Huamantupa,Huamantupa Chuquimaco 9498,,2007,6,7,,South America,Peru,Cusco,Calca,Distrito Yanatile. Bosque montano húmedo primario.,-72.0358333,-12.9794445,,,,,2400.00000000,2500.00000000,,,,,2,,,,,,,
2015-03-12 06:15:00-03,MO,MOBOT,3485498,PreservedSpecimen,Plantae,,,,Fabaceae,Collaea,speciosa,,Collaea speciosa,(Loisel.) DC.,,,,,,Abel Monteagudo|J.L. Mateo|Valerio Flores|César Rojas,Monteagudo Mendoza 15539,,2007,9,14,,South America,Peru,Pasco,Oxapampa,"Distrito Chontabamba. Zona de amortiguamiento del Parque Nacional Yanachaga-Chemillén, Sector la Suiza Vieja. Bosque húmedo montano secundario.",-75.505,-10.64722,,,,,2060.00000000,,,,,,3,,,,,,,
2008-05-27 22:02:00-03,MO,MOBOT,82241,PreservedSpecimen,Plantae,,,,Fabaceae,Collaea,speciosa,,Collaea speciosa,(Loisel.) DC.,J.L. Zarucchi (MO),,,,,David N. Smith,Smith 5723,84-134,1984,1,11,,South America,Peru,Junín,Tarma,"Tarma-La Merced road, 28 km from Tarma. Dry, steep slopes with low brushfield; roadsides.",-75.53333,-11.25,,,,,2100.00000000,,,,,,6,,,,,,,
2008-05-27 22:02:00-03,MO,MOBOT,82311,PreservedSpecimen,Plantae,,,,Fabaceae,Collaea,speciosa,,Collaea speciosa,(Loisel.) DC.,R. Fortunato (BAB),,,,,David N. Smith,Smith 2470,82-172,1982,10,1,,South America,Peru,Junín,Tarma,"Tarma-San Ramón road, 38 km from Tarma. Roadsides.",-75.7,-11.36666,,,,,2130.00000000,,,,,,6,,,,,,,
2008-05-27 22:02:00-03,MO,MOBOT,82318,PreservedSpecimen,Plantae,,,,Fabaceae,Collaea,speciosa,,Collaea speciosa,(Loisel.) DC.,J.L. Zarucchi (MO),,,,,David N. Smith|Judith M. Canne-Hilliker,Smith 5746,84-142,1984,1,21,,South America,Peru,Pasco,Oxapampa,"Pozuzo road, 4-8 km N of Huacabamba. Drier forest dominated by Escallonia pendula; W-facing slopes, steep.",-75.55,-10.21666,,,,,1720.00000000,,,,,,5,,,,,,,
2008-05-27 22:02:00-03,MO,MOBOT,82643,PreservedSpecimen,Plantae,,,,Fabaceae,Collaea,speciosa,,Collaea speciosa,(Loisel.) DC.,R. Fortunato (BAB),,,,,David N. Smith,Smith 6957,84-211,1984,4,9,,South America,Peru,Pasco,Oxapampa,"Gran Pajonal, vecinity of Chequitavo. Second growth.",-74.38333,-10.75,,,,,1200.00000000,,,,,,8,,,,,,,
2008-05-27 22:02:00-03,MO,MOBOT,83201,PreservedSpecimen,Plantae,,,,Fabaceae,Collaea,speciosa,,Collaea speciosa,(Loisel.) DC.,R. Fortunato (BAB),,,,,David N. Smith,Smith 2741,82-198,1982,11,20,,South America,Peru,Pasco,Oxapampa,"Chantabamba, 3.5-8 km W of Oxapampa. Second growth, hedge rows, pastures.",-75.5,-10.58333,,,,,1830.00000000,1875.00000000,,,,,6,,,,,,,
2008-05-27 22:02:00-03,MO,MOBOT,83980,PreservedSpecimen,Plantae,,,,Fabaceae,Collaea,speciosa,,Collaea speciosa,(Loisel.) DC.,Ronald L. Liesner (MO),,,,,David N. Smith|Marianne Buddensiek,Smith 13924,87,1989,12,17,,South America,Bolivia,La Paz,Nor Yungas,"Carretera vieja a Los Yungas entre Incahuasi y Unduavi. Yungas vegetaø ción, bosque enano y matorral.",-67.91666,-16.33333,,,,,3400.00000000,,,,,,11,,,,,,,
2008-05-27 22:02:00-03,MO,MOBOT,86443,PreservedSpecimen,Plantae,,,,Fabaceae,Collaea,speciosa,,Collaea speciosa,(Loisel.) DC.,Ronald Liesner,,,,,James C. Solomon,Solomon 13122,85-11,1985,1,20,,South America,Bolivia,La Paz,Murillo,"Zongo Valley, 36 km below the dam at Lago Zongo. Vicinity of Chururaqui hydroelectric plant. Moist forest.",-68.06666,-16.1,,,,,1900.00000000,2100.00000000,,,,,9,,,,,,,
2008-05-27 22:02:00-03,MO,MOBOT,86623,PreservedSpecimen,Plantae,,,,Fabaceae,Collaea,speciosa,,Collaea speciosa,(Loisel.) DC.,Ronald Liesner,,,,,James C. Solomon,Solomon 9028,83-2,1982,11,29,,South America,Bolivia,La Paz,Murillo,32.7 km N of (below) dam at Lago Zongo. A few hundred meters above Planta Hidroelectrica Chururaqui.,-68.06666,-16.1,,,,,2000.00000000,,,,,,7,,,,,,,
2008-05-27 22:02:00-03,MO,MOBOT,93613,PreservedSpecimen,Plantae,,,,Fabaceae,Collaea,speciosa,,Collaea speciosa,(Loisel.) DC.,R. Fortunato,,,,,Gene A. Sullivan|et al.,Sullivan 1064,81-9,1981,5,21,,South America,Peru,Junín,Tarma,Road from Tarma to San Ramón.,-75.75,-11.66666,,,,,1000.00000000,3000.00000000,,,,,7,,,,,,,
2014-12-25 05:26:00-02,MO,MOBOT,96219,PreservedSpecimen,Plantae,,,,Fabaceae,Collaea,speciosa,,Collaea speciosa,(Loisel.) DC.,R. Fortunato,,,,,Robin B. Foster|Tatyana S. Wachter,Foster 7527,83-10,1983,12,15,,South America,Peru,Cusco,Paucartambo,"Valle del Pilcopata. Road from Patria to Pillahuata. Forest edge, on steep slopes.",-71.41666,-13.16666,,,,,2500.00000000,,,,,,6,,,,,,,
2008-05-27 22:02:00-03,MO,MOBOT,97706,PreservedSpecimen,Plantae,,,,Fabaceae,Collaea,speciosa,,Collaea speciosa,(Loisel.) DC.,R. Fortunato (BAB),,,,,Percy Núñez V.|C. Paycarmayta,Núñez Vargas 13159,68,1991,3,8,,South America,Peru,Cusco,Quispicanchis,"Marcapata; 176 km from Cusco on road to Maldonado, Marcapata remmant forest to Cocha.",-70.9,-13.41666,,,,,3150.00000000,,,,,,2,,,,,,,
2008-05-27 22:02:00-03,MO,MOBOT,98211,PreservedSpecimen,Plantae,,,,Fabaceae,Collaea,speciosa,,Collaea speciosa,(Loisel.) DC.,R. Fortunato (BAB),,,,,Percy Núñez V.|N. Alanya,Núñez Vargas 13224,69,1991,3,20,,South America,Peru,Cusco,Paucartambo,"Kosñipata; Ceja de selva of Accanacu, Manú National Park and Pillahuata Forests.",-71.16666,-13.08333,,,,,1900.00000000,,,,,,4,,,,,,,
2015-10-20 14:13:00-02,MO,MOBOT,99131,PreservedSpecimen,Plantae,,,,Fabaceae,Collaea,speciosa,,Collaea speciosa,(Loisel.) DC.,R. Liesner,,,,,Percy Núñez V.|F. Loaysa|W. Loaysa,Núñez Vargas 9041,88-12,1988,4,21,,South America,Peru,Cusco,Quispicanchis,Entre Abra Walla Walla y Marcapata a 210 km de Cusco.,-70.9,-13.4166667,,,,,2800.00000000,4600.00000000,,,,,4,,,,,,,
2008-05-27 22:02:00-03,MO,MOBOT,99527,PreservedSpecimen,Plantae,,,,Fabaceae,Collaea,speciosa,,Collaea speciosa,(Loisel.) DC.,R. Liesner,,,,,Percy Núñez V.,Núñez Vargas 8624,87-41,1987,11,18,,South America,Peru,Cusco,Urubamba,"Aprox. 112 km de Cusco en el camino de herradura de las ruinas de Machupicchu, hacia puente ruinas. Bosque nublado de ceja de selva. Bosque de Trema, Erythrina, Cecropia, Inga.",-72.51666,-13.15,,,,,1050.00000000,1300.00000000,,,,,1,,,,,,,
2012-06-06 05:06:00-03,MO,MOBOT,3178628,PreservedSpecimen,Plantae,,,,Fabaceae,Collaea,speciosa,,Collaea speciosa,(Loisel.) DC.,,,,,,Lourdes Rico A.,Rico Arce 1654,,2003,4,27,,South America,Bolivia,Cochabamba,Carrasco,"Inkachaka. Secondary wet forest with trees up to 20 m, many Aliso (Alnus), granite stones and clay soils.",-64.22277,-21.42527,,,,,1538.00000000,,,,,,,,,,,,,
2008-05-27 22:02:00-03,MO,MOBOT,97376,PreservedSpecimen,Plantae,,,,Fabaceae,Collaea,speciosa,,Collaea speciosa,(Loisel.) DC.,J.L. Zarucchi,,,,,Percy Núñez V.|C. Muñoz,Núñez Vargas 5104,86-1,1986,6,19,,South America,Peru,Puno,Sandia,"Between Yanamayo-Putina, begining Tambopata River, down from San Juan Oro to Lowlands.",-70,-13,,,,,1100.00000000,,,,,,4,,,,,,,
2019-01-25 04:35:00-02,MO,MOBOT,3113302,PreservedSpecimen,Plantae,,,,Fabaceae,Collaea,speciosa,,Collaea speciosa,(Loisel.) DC.,G.P. Lewis (K),,,,,Luis Valenzuela G.,Valenzuela Gamarra 5872,,2005,6,20,,South America,Peru,Cusco,Calca,"Dist. Lares, Suyo, Bosque Secundario",-71.58333,-12.5,,,,,2600.00000000,,,,,,4,,,,,,,
2021-04-26 11:31:00-03,UFPE,UFP,60667,PreservedSpecimen,Plantae,,,Fabales,Fabaceae-Papi.,Collaea,speciosa,,Collaea speciosa,(Loisel.) DC.,"Córdula, E",2008,04,28,,"Mendes, K; Gomes, P; Alves, M; Heald, S; Amorim, BS",89,,2007,10,12,,,Brasil,Sergipe,Itabaiana,Trilha para a cachoeira. Fisionomia: arbustiva-arbórea. Substrato: arenoso.,-37.355833,-10.773056,-37.355833,-10.773056,,,196,196,,,,,,,,,"Arbusto, ca. de 1,5m. Frutos imaturos.; Arbusto, ca. de 1,5m. Frutos imaturos.",UFP060667,,
2020-07-23 12:07:16-03,CEPLAC,CEPEC,67080,PreservedSpecimen,Plantae,,,,Fabaceae,Collaea,speciosa,,Collaea speciosa,,L. P. de Queiroz,,,,,E. Valpassos,9,,1991,05,26,,,Brasil,Espírito Santo,domingos martins,Res. Florestal da Pedra Azul.,-40.006944,-20.392222,40W0'25,20S23'32,,,,,,,,,,,,28/02/1996,,,,
2020-07-23 12:07:16-03,CEPLAC,CEPEC,125570,PreservedSpecimen,Plantae,,,,Fabaceae,Collaea,speciosa,,Collaea speciosa,,H. C. de Lima,,,,,A. P. Fontana,4796,,,,,,,Brasil,Espírito Santo,castelo,,-41.184700012207,-20.6035995483398,,,23588,,,,,,,,,,,,<ll>dwc_commonname:</ll>,,,auto
2020-07-23 12:07:16-03,CEPLAC,CEPEC,125068,PreservedSpecimen,Plantae,,,,Fabaceae,Collaea,speciosa,,Collaea speciosa,,L. P. de Queiroz,,,,,R. Goldenberg,1079,,,,,,,Brasil,Espírito Santo,castelo,,-41.184700012207,-20.6035995483398,,,23588,,,,,,,,,,,,<ll>dwc_commonname:</ll>,,,auto
2020-07-23 12:07:16-03,CEPLAC,CEPEC,83741,PreservedSpecimen,Plantae,,,,Fabaceae,Collaea,speciosa,,Collaea speciosa,,G. Hatschbach,,,,,G. Hatschbach,69164,,1984,01,22,,,Brasil,Espírito Santo,castelo,Forno Grande.,-41.184700012207,-20.6035995483398,,,23588,,,,,,,,,,,30/12/1999,,,,auto
2020-07-23 12:07:16-03,CEPLAC,CEPEC,67133,PreservedSpecimen,Plantae,,,,Fabaceae,Collaea,speciosa,,Collaea speciosa,,L. P. de Queiroz,,,,,H. Q. B. Fernandes,1921,,1986,04,16,,,Brasil,Espírito Santo,SANTA TERESA,Alto da Pedra da Onca.,-40.6002998352051,-19.9356002807617,,,23813,,,,,,,,,,,28/02/1996,,,,auto
2020-07-23 12:07:16-03,CEPLAC,CEPEC,101227,PreservedSpecimen,Plantae,,,,Fabaceae,Collaea,speciosa,,Collaea speciosa,,H. C. Lima,,,,,A. M. Amorim,3404,,1991,07,01,,,Brasil,Espírito Santo,SANTA TERESA,Pedra da Onça.,-40.6002998352051,-19.9356002807617,,,23813,,,,,,,,,,,30/06/2009,,,,auto
2020-07-23 12:07:16-03,CEPLAC,CEPEC,136078,PreservedSpecimen,Plantae,,,,Fabaceae,Collaea,speciosa,,Collaea speciosa,,R. D. Ribeiro,,,,,J. M. A. Braga,4627,,,,,,,Brasil,Minas Gerais,CAPARAÓ,,-41.9043998718262,-20.523099899292,,,15056,,,,,,,,,,,,<ll>dwc_commonname:</ll>,,,auto
2020-07-23 12:07:16-03,CEPLAC,CEPEC,44736,PreservedSpecimen,Plantae,,,,Fabaceae,Collaea,speciosa,,Collaea speciosa,,I. Cordeiro,,,,,I. Cordeiro,0,,1986,01,26,,,Brasil,Minas Gerais,santana do riacho,Ao longo da Rod. B. Horizonte/C. do Mato Dentro. Estr. da Usina.,-43.7144012451172,-19.1688995361328,,,26557,,,,,,,,,,,30/12/1986,,,,auto
2020-07-23 12:07:16-03,CEPLAC,CEPEC,91852,PreservedSpecimen,Plantae,,,,Fabaceae,Collaea,speciosa,,Collaea speciosa,,G. Hatschbach,,,,,G. Hatschbach,72381,,2001,09,19,,,Brasil,Paraná,PALMAS,"Rod. PR-449, próximo do Km 20.",-51.9906005859375,-26.4841995239258,,,46666,,,,,,,,,,,30/12/2001,,,,auto
2020-07-23 12:07:16-03,CEPLAC,CEPEC,48581,PreservedSpecimen,Plantae,,,,Fabaceae,Collaea,speciosa,,Collaea speciosa,,G. Hatschbach,,,,,V. Nicolack,60,,1989,10,20,,,Brasil,Paraná,PALMEIRA,Marg. Rio dos Papagaios. Zona de campo.,-50.0064010620117,-25.4293994903564,,,35166,,,,,,,,,,,30/12/1989,,,,auto
2020-07-23 12:07:16-03,CEPLAC,CEPEC,61930,PreservedSpecimen,Plantae,,,,Fabaceae,Collaea,speciosa,,Collaea speciosa,,R. Kummrow,,,,,J. Cordeiro,1128,,1993,07,08,,,Brasil,Paraná,rio branco do sul,Itaperucu.,-49.3142013549805,-25.1900005340576,,,37352,,,,,,,,,,,30/12/1993,,,,auto
