MODIFIED,INSTITUTIONCODE,COLLECTIONCODE,CATALOGNUMBER,BASISOFRECORD,KINGDOM,PHYLUM,CLASS,ORDER,FAMILY,GENUS,SPECIFICEPITHET,INFRASPECIFICEPITHET,SCIENTIFICNAME,SCIENTIFICNAMEAUTHORSHIP,IDENTIFIEDBY,YEARIDENTIFIED,MONTHIDENTIFIED,DAYIDENTIFIED,TYPESTATUS,RECORDEDBY,RECORDNUMBER,FIELDNUMBER,YEAR,MONTH,DAY,EVENTTIME,CONTINENTOCEAN,COUNTRY,STATEPROVINCE,COUNTY,LOCALITY,DECIMALLONGITUDE,DECIMALLATITUDE,VERBATIMLONGITUDE,VERBATIMLATITUDE,COORDINATEPRECISION,BOUNDINGBOX,MINIMUMELEVATIONINMETERS,MAXIMUMELEVATIONINMETERS,MINIMUMDEPTHINMETERS,MAXIMUMDEPTHINMETERS,SEX,PREPARATIONTYPE,INDIVIDUALCOUNT,PREVIOUSCATALOGNUMBER,RELATIONSHIPTYPE,RELATEDCATALOGITEM,OCCURRENCEREMARKS,BARCODE,IMAGECODE,GEOFLAG
2021-03-24 17:09:42-03,UFES,SAMES,1704,PreservedSpecimen,Plantae,,,,Orchidaceae,Cyrtopodium,glutiniferum,,Cyrtopodium glutiniferum,Raddi,,,,,,"Pinto Junior, H.V.; Luber, J.",227,,2016,03,16,,,Brasil,Espírito Santo,Águia Branca,Santa Luzia. Antiga propriedade do Sr. Ciro Ferreira; afloramento próximo a cachoeira do Arco-íris.,-40.7402992248535,-18.9831008911133,,,19701,,,,,,,,,,,,Herbácea habitando ilha de vegetação em afloramento rochoso; folhas verdes; caule amarelo-amarronzado; sombra.,SAMES01704,,auto
2021-03-24 17:09:42-03,UFES,SAMES,1677,PreservedSpecimen,Plantae,,,,Orchidaceae,Cyrtopodium,glutiniferum,,Cyrtopodium glutiniferum,Raddi,,,,,,"Pinto Junior, H.V.; Covre, C.",233,,2016,03,21,,,Brasil,Espírito Santo,Nova Venécia,Pedra do Elefante. Vertente leste da Pedra do Elefante.,-40.4006004333496,-18.710599899292,,,42400,,,,,,,,,,,,Herbácea habitando ilha de vegetação em afloramento rochoso; folhas verdes; caule marrom-amarelado; sem flores; com fruto.,SAMES01677,,auto
2021-03-24 17:09:42-03,UFES,SAMES,1179,PreservedSpecimen,Plantae,,,,Orchidaceae,Cyrtopodium,glutiniferum,,Cyrtopodium glutiniferum,Raddi,,,,,,"Pinto Junior, H.V.",183,,2015,09,03,,,Brasil,Espírito Santo,Mimoso do Sul,Conceição do Muqui. Pedra de pontões.,-41.3664016723633,-21.0641994476318,,,29430,,,,,,,,,,,,Herbácea habitando ilha de vegetação em afloramento rochoso; bulbo amarelado; flores amarelas; sol.,SAMES01179,,auto
2021-03-24 17:09:42-03,UFES,SAMES,8221,PreservedSpecimen,Plantae,,,,Orchidaceae,Cyrtopodium,glutiniferum,,Cyrtopodium glutiniferum,Raddi,,,,,,"Pinto Junior,H.V.; W.S.Justiuno.;T.Sperandio.;Menezes,L.F.T.",399,,2018,03,22,,,Brasil,Espírito Santo,Vila Pavão,PEDRA DO VIADINHO.,-40.611400604248,-18.6149997711182,-405558333.0,-186230556.0,19647,,,,,,,,,,,,"Frutos negros, sol, habitando a ilha de vegetação inselberg.",SAMES08221,,auto
2020-10-01 14:25:53-03,JBB,HEPH,20820,S,Plantae,Monocotyledon,,Asparagales,Orchidaceae,Cyrtopodium,glutiniferum,,Cyrtopodium glutiniferum,Raddi,"Salles, AEH",2002,08,10,,"Salles, AEH; et al.",2154,,2002,08,10,,Southern America,Brasil,Pará,São Félix do Xingu,Serra de Campo,-51.9949989318848,-6.64472007751465,0,0,354043,,,,,,,,,,,,,,,auto
2021-05-13 11:00:05-03,Cenargen,CEN,94559,PreservedSpecimen,Plantae,,,,Orchidaceae,Cyrtopodium,glutiniferum,,Cyrtopodium glutiniferum,Raddi,J. A. N. Batista,2006,10,,,João Aguiar Nogueira Batista,1649,,2006,10,00,,,Brasil,MG,BELO HORIZONTE,Em cultivo nos jardins da reitoria da Universidade Federal de Minas Gerais - UFMG,-43.937801361084,-19.9207992553711,,,17082,,,,,,,Exsicatas,1,,,,"Procedência desconhecida. Pseudobulbos fusiformes, expostos. Inflorescência com até 6 ramificações laterais. Flores completamente amarelas. Doação Herbário UFMG. BHCB n° 113719.",CEN00094559,CEN00094559,auto
2021-05-13 11:00:05-03,Cenargen,CEN,94742,PreservedSpecimen,Plantae,,,,Orchidaceae,Cyrtopodium,glutiniferum,,Cyrtopodium glutiniferum,Raddi,J. A. N. Batista,2008,08,,,João Aguiar Nogueira Batista,2698,,2008,08,06,,,Brasil,RJ,RIO DE JANEIRO,"Botafogo, Morro dos Cabritos.",-43.2075004577637,-22.9027996063232,,,57442,,86,86,,,,Exsicatas,1,,,,"Sobre afloramento de granito, crescendo associada a manchas de vegetação sobre a rocha, com matéria orgânica na base, sob arbustos e árvores baixas. Em plena floração, calo avermelhado. Doação do Herbário do Departamento de Botânica ICB - UFMG - Plantas do Brasil - BHCB 132412.",CEN00094742,CEN00094742,auto
2020-06-29 11:31:47-03,UFRJ,RFA,43324,PreservedSpecimen,Plantae,,,,Orchidaceae,Cyrtopodium,glutiniferum,,Cyrtopodium glutiniferum,Raddi,"Silva, R.",,,,,"Silva, R.",,,2018,08,09,,,Brasil,Rio de Janeiro,Rio de Janeiro,"Copacabana, Parque Estadual da Chacrinha",-43.179722,-22.958611,43º10'47''W,22º57'31''S,,,,,,,,,,,,,"Pouca incidência no parque. Coletada em flor em meio arbustos, em plena luminosidade.",RFA45353,,
2021-06-25 18:21:02-03,UFV,VIC,052605,PreservedSpecimen,Plantae,,,,Orchidaceae,Cyrtopodium,glutiniferum,,Cyrtopodium glutiniferum,Lindl,,,,,,H.V. Pinto Junior,450,,2019,02,18,,,Brasil,Espírito Santo,Mimoso do Sul,"Pedra dos Pontões, Inselberg granitico, Jardim dos Pontões.",-41.3664016723633,-21.0641994476318,0,0,29430,,,,,,,,,,,,"Planta com cerca de 1 m, ilha de vegetação,folhas verdes, fruto capsular,freguente, sol.",VIC052605,VIC052605,auto
2021-06-25 18:21:02-03,UFV,VIC,005141,PreservedSpecimen,Plantae,,,,Orchidaceae,Cyrtopodium,glutiniferum,,Cyrtopodium glutiniferum,Lindl,,,,,,Shimoya; Alunos do curso de agronomia.,44H,,1962,10,10,,,Brasil,Minas Gerais,Viçosa,,-42.8819007873535,-20.7539005279541,0,0,13937,,,,,,,,,,,,"Flores amarelas apresentando sépalas e pétalas na parte dorsal, pintadas de sombras marrom -bronzeado muito claro. As Brácteas são Também amarelas ,folhagem verde, psudobulbos muito grandes, caindo as folhas em periodo de repouso veget",VIC005141,VIC005141,auto
2020-04-27 16:10:56-03,UFES,VIES,21464,S,Plantae,,,,Orchidaceae,Cyrtopodium,glutiniferum,,Cyrtopodium glutiniferum,Raddi,"Couto, D.R.",2012,02,28,,"Zorzanelli, J.P.F.",333,,2012,02,20,,,Brasil,Espírito Santo,Iúna,Ponte Alta.,-41.5358009338379,-20.3458003997803,,,32198,,,,,,,,,,,,,VIES021464,VIES021464 VIES021464_1,auto
2019-09-27 18:05:45-03,UFES,VIES,21470,S,Plantae,,,,Orchidaceae,Cyrtopodium,glutiniferum,,Cyrtopodium glutiniferum,Raddi,"Couto, D.R.",2011,12,13,,"Zorzanelli, J.P.F.",226,,2011,12,11,,,Brasil,Espírito Santo,Iúna,Serra do Valentim.,-41.5358009338379,-20.3458003997803,,,32198,,,,,,,,,,,,,VIES021470,VIES021470,auto
2020-04-27 16:10:56-03,UFES,VIES,30482,S,Plantae,,,,Orchidaceae,Cyrtopodium,glutiniferum,,Cyrtopodium glutiniferum,Raddi,"Zorzanelli, J.P.F.",2014,09,11,,"Zorzanelli, J.P.F.; Couto, D.R.; Dias, H.M. & Perini, M.",1093,,2014,09,11,,,Brasil,Espírito Santo,Mimoso do Sul,Pedra dos Pontões.,-41.3664016723633,-21.0641994476318,,,29430,,767,767,,,,,,,,,,VIES030482,VIES030482 VIES030482_1,auto
2020-04-27 16:10:56-03,UFES,VIES,19023,S,Plantae,,,,Orchidaceae,Cyrtopodium,glutiniferum,,Cyrtopodium glutiniferum,Raddi,"Kollmann, L.J.C.",2009,09,16,,"Lorencini, T.S.; Siqueira, V.B. & Braun, A.",110,,2008,11,08,,,Brasil,Espírito Santo,Santa Maria de Jetibá,Garrafão.,-40.7461013793945,-20.040599822998,,,31867,,,,,,,,,,,,,VIES019023,VIES019023,auto
2020-04-27 16:10:56-03,UFES,VIES,19013,S,Plantae,,,,Orchidaceae,Cyrtopodium,glutiniferum,,Cyrtopodium glutiniferum,Raddi,"Kollmann, L.J.C.",2009,09,17,,"Lorencini, T.S.; Siqueira, V.B.",350,,2009,08,08,,,Brasil,Espírito Santo,Santa Maria de Jetibá,Garrafão.,-40.7461013793945,-20.040599822998,,,31867,,,,,,,,,,,,,VIES019013,VIES019013,auto
2020-04-27 16:10:56-03,UFES,VIES,10620,S,Plantae,,,,Orchidaceae,Cyrtopodium,glutiniferum,,Cyrtopodium glutiniferum,Raddi,"Freitas, J.C.",2010,06,21,,"Botelho, R.M.; Assis, A.M. & Menezes, B.D.",64,,2010,05,21,,,Brasil,Espírito Santo,Serra,Mestre Álvaro.,-40.3078002929688,-20.1285991668701,,,16451,,50,50,,,,,,,,,,VIES010620,VIES010620,auto
2021-06-28 11:19:59-03,MN,R,239597,PreservedSpecimen,Plantae,,,,Orchidaceae,Cyrtopodium,glutiniferum,,Cyrtopodium glutiniferum,Raddi,"Couto, D.R.",2013,08,09,,"Couto, D.R. 2369; Manhães, V.C.",,,2013,08,08,,,Brasil,Rio de Janeiro,"Campos dos Goytacazes, distrito Morro do Coco",Pedra Lisa,0,-21.346111,41°56W,21°20'46S,,,496,496,,,,,,,,,,R010070104,,
2021-06-28 11:19:59-03,MN,R,239596,PreservedSpecimen,Plantae,,,,Orchidaceae,Cyrtopodium,glutiniferum,,Cyrtopodium glutiniferum,Raddi,"Couto, D.R.",2013,08,06,,"Couto, D.R. 2333; Manhães, V.C.",,,2013,08,05,,,Brasil,Espírito Santo,Jerônimo Monteiro,Pedra da Andorinha,0,-20.766667,41°W,20°46'S,,,282,282,,,,,,,,,,R010070103,,
2021-06-28 11:19:59-03,MN,R,239601,PreservedSpecimen,Plantae,,,,Orchidaceae,Cyrtopodium,glutiniferum,,Cyrtopodium glutiniferum,Raddi,"Couto, D.R.",2013,12,10,,"Couto, D.R. 2422; Paixão-Souza, B.; Jacques, S. & Uribbe, F.P.",,,2013,09,07,,,Brasil,Minas Gerais,Pedra Azul,Pedra da Cabeça Torta,0,-16.025,41°50W,16°1'30S,,,890,890,,,,,,,,,,R010070105,,
2021-06-28 11:19:59-03,MN,R,239600,PreservedSpecimen,Plantae,,,,Orchidaceae,Cyrtopodium,glutiniferum,,Cyrtopodium glutiniferum,Raddi,"Couto, D.R.",2013,12,10,,"Couto, D.R. 2411; Paixão-Souza, B.; Jacques, S. & Uribbe, F.P.",,,2013,09,07,,,Brasil,Minas Gerais,Pedra Azul,Pedra da Cabeça Torta,0,-16.025,41°50W,16°1'30S,,,890,890,,,,,,,,,,R010070147,,
2021-06-28 11:19:59-03,MN,R,239598,PreservedSpecimen,Plantae,,,,Orchidaceae,Cyrtopodium,glutiniferum,,Cyrtopodium glutiniferum,Raddi,"Couto, D.R.",2013,11,07,,"Couto, D.R. 2403; Paixão-Souza, B.; Jacques, S. & Uribbe, F.P.",,,2013,09,06,,,Brasil,Minas Gerais,Pedra Azul,Morro do Cruzeiro,0,-16.02,41°40W,16°1'12S,,,920,920,,,,,,,,,,R010070106,,
2021-06-28 11:19:59-03,MN,R,239606,PreservedSpecimen,Plantae,,,,Orchidaceae,Cyrtopodium,glutiniferum,,Cyrtopodium glutiniferum,Raddi,"Couto, D.R.",2013,12,05,,"Couto, D.R.; Paixão-Souza, B.",2509 -,,2013,11,12,,,Brasil,Bahia,Andaraí,Cânion do Rio Paraguaçú,-39.9,-12.756944,39°54'W,12°45'25S,,,570,570,,,,,,,,,,R010070121,,
2021-06-28 11:19:59-03,MN,R,172547,PreservedSpecimen,Plantae,,,,Orchidaceae,Cyrtopodium,glutiniferum,,Cyrtopodium glutiniferum,Raddi,"Batista, J.A.N.",2002,06,24,,"Laclette, P.P.H.",845,,1986,09,,,,Brasil,Rio de Janeiro,Rio Bonito,Braçanã,-42.6096992492676,-22.7085990905762,,,20195,,,,,,,,,,,,,,,auto
2021-06-28 11:19:59-03,MN,R,220524,PreservedSpecimen,Plantae,,,,Orchidaceae,Cyrtopodium,glutiniferum,,Cyrtopodium glutiniferum,Raddi,"Batista, J.A.N.",2002,06,24,,"Santos, E.A.A.; Flaster, B. 1095 & Pereira, C.",2058,,1964,09,27,,,Brasil,Rio de Janeiro,Santa Maria Madalena,,-42.0080986022949,-21.9552993774414,,,30526,,,,,,,,,,,,,,,auto
2019-11-21 14:40:40-03,UFJF,CESJ,66151,PreservedSpecimen,Plantae,Angiosperma,,,Orchidaceae,Cyrtopodium,glutiniferum,,Cyrtopodium glutiniferum,Raddi,L. Menini Neto,2011,,,,C.S. Paula,s.n.,,2011,,,,América do Sul,Brasil,Minas Gerais,Lima Duarte,Pão de Angu,-43.793098449707,-21.8425006866455,0,0,30417,,,,,,,,,,,,"Erva rupícola, no afloramento. Flores amarelas.",CESJ066151,,auto
2019-11-21 14:40:40-03,UFJF,CESJ,63588,PreservedSpecimen,Plantae,Angiosperma,,,Orchidaceae,Cyrtopodium,glutiniferum,,Cyrtopodium glutiniferum,Raddi,J.A.N. Batista,2018,12,14,,F.R.G. Salimena; M. Silva; M.C.A. Mota; P.H. Nobre,3644,,2013,09,14,,América do Sul,Brasil,Minas Gerais,Rio Preto,"Vila do Funil, RPPN São Lourenço Do Funil e RPPN Serrinha",-43.8278007507324,-22.0891990661621,0,0,20815,,,,,,,,,,,,"Erva ,terrestre, flores amarelas. Pseudo bulbo amarelo ca. 20 cm. Campo rupestre entre gramíneas",CESJ063588,,auto
2019-11-21 14:40:40-03,UFJF,CESJ,71990,PreservedSpecimen,Plantae,Angiosperma,,,Orchidaceae,Cyrtopodium,glutiniferum,,Cyrtopodium glutiniferum,Raddi,D.E.F. Barbosa,2018,09,25,,D.E.F. Barbosa; A.L. Barbosa,565,,2018,09,25,,América do Sul,Brasil,Minas Gerais,Itamarati de Minas,"RPPN Usina Maurício, Floresta semidecidual",-42.832778,-21.470278,-42.832778,-21.470278,,,250,250,,,,,,,,,Saxícola. Flores com sépalas e pétalas amarelas. Labelo amarelo com pintas avermelhadas na base. Borda de floresta a margem de leito seco.,CESJ071990,,
2019-11-21 14:40:40-03,UFJF,CESJ,51836,PreservedSpecimen,Plantae,Angiosperma,,,Orchidaceae,Cyrtopodium,glutiniferum,,Cyrtopodium glutiniferum,Raddi,J.A.N. Batista,2018,12,14,,N.L. Abreu; C.N. Matozinhos; J. Miloski; J.H.C. Ribeiro; S.M. Dutra,271,,2008,08,31,,América do Sul,Brasil,Minas Gerais,Rio Preto,"Serra Negra, Canion do Funil.",-43.8278007507324,-22.0891990661621,0,0,20815,,,,,,,,,,,,"Erva terrestre em campo. Folhas e paseudobulbo verdes, brácteas do escapo castanhas, sépalas amarelo-esverdeadascom máculas castanhas na face abaxial, pétalas e labelo amarelos, calo de amarelo a alvo, pintalgado de castanho. Grande população.",CESJ051836,,auto
2020-12-11 11:44:26-03,UFMG,BHCB,93984,PreservedSpecimen,Plantae,Monocotyledon,,,Orchidaceae,Cyrtopodium,glutiniferum,,Cyrtopodium glutiniferum,Raddi,,2017,12,07,,"Melo, PHA de; et al.",896,,2003,10,20,,Southern America,Brasil,Minas Gerais,Pains,,-45.671083,-20.262778,-45.671083,-20.262778,,,750,750,,,,,,,,,"Herbácea crescendo sobre rochas calcarias, flores amarelas.",BHCB034083,,
2020-12-11 11:44:26-03,UFMG,BHCB,159481,PreservedSpecimen,Plantae,Monocotyledon,,,Orchidaceae,Cyrtopodium,glutiniferum,,Cyrtopodium glutiniferum,Raddi,,2012,03,01,,"Paula, LFA de; Mota, NFO; Viana, PL; Jorge, TB; Burkowski, PM",115,,2011,01,08,,Southern America,Brasil,Minas Gerais,Teófilo Otoni,"Afloramento rochoso lado esquerdo da MG 418, cerca de 30 km norte de Teófilo Otoni",-41.260944,-17.855972,-41.260944,-17.855972,,,560,560,,,,,,,,,,BHCB005949,,
2020-12-11 11:44:26-03,UFMG,BHCB,159484,PreservedSpecimen,Plantae,Monocotyledon,,,Orchidaceae,Cyrtopodium,glutiniferum,,Cyrtopodium glutiniferum,Raddi,,2012,04,01,,"Paula, LFA de; Augsten, M",316,,2011,04,16,,Southern America,Brasil,Minas Gerais,Teófilo Otoni,"Afloramento rochoso lado esquerdo da MG 418, cerca de 30 km norte de Teófilo Otoni",-41.260944,-17.855972,-41.260944,-17.855972,,,560,560,,,,,,,,,,BHCB005939,,
2020-12-11 11:44:26-03,UFMG,BHCB,176913,PreservedSpecimen,Plantae,Monocotyledon,,,Orchidaceae,Cyrtopodium,glutiniferum,,Cyrtopodium glutiniferum,Raddi,,2016,06,01,,"Paiva, JAM; Pivari, MOD; Tomich, S; Nascimento, L",202,,2015,04,09,,Southern America,Brasil,Minas Gerais,Rio Acima,RPPN Andaime,-43.824167,-20.175,-43.824167,-20.175,,,983,983,,,,,,,,,Prensado no álcool; Erva; frutos imaturos verdes.; Campo Rupestre Quartzitico,,,
2020-12-11 11:44:26-03,UFMG,BHCB,180149,PreservedSpecimen,Plantae,Monocotyledon,,,Orchidaceae,Cyrtopodium,glutiniferum,,Cyrtopodium glutiniferum,Raddi,,2013,09,14,,"Batista, JAN; Carvalho, BM de; Paula, MV de",3290,,2013,09,14,,Southern America,Brasil,Minas Gerais,São Gonçalo do Rio Preto,"Parque Estadual do Rio Preto, Em areião acessado a partir da sede do parque.",-43.346408,-18.089456,-43.346408,-18.089456,,,829,829,,,,,,,,,"Erva terrestre.Pouco comum, observado cerca de 6 plantas. Pseudobulbos completamente expostos. Em plena floração. Flor amarela; sépalas com a face externa amarela densamente pintalgadas de vermelho-castanho, face interna completamente amarela; pétala",,,
2021-01-29 17:16:17-03,UFMG,BHCB,194348,PreservedSpecimen,Plantae,Monocotyledon,,,Orchidaceae,Cyrtopodium,glutiniferum,,Cyrtopodium glutiniferum,Raddi,,2019,04,,,"Ferreira, VL; Stehmann, JR",37,,2018,09,18,,Southern America,Brasil,Minas Gerais,Pedro Leopoldo,Lapa do Baú,-43.9925,-19.548333,-43.9925,-19.548333,,,733,733,,,,,,,,,"Escapo flora com flores amarelas.; Afloramento de calcáreo. Maciço, ilha de solo.",BHCB194348,BHCB194348,
2021-01-29 17:16:17-03,UFMG,BHCB,199678,PreservedSpecimen,Plantae,Monocotyledon,,,Orchidaceae,Cyrtopodium,glutiniferum,,Cyrtopodium glutiniferum,Raddi,,2019,08,22,,"Ferreira, VL; Stehmann, JR",415,,2019,08,21,,Southern America,Brasil,Minas Gerais,Pedro Leopoldo,Lapa do Baú,-43.9925,-19.548333,-43.9925,-19.548333,,,756,756,,,,,,,,,"Flores amarelas.; Afloramento de calcário, em ilha de solo no maciço.",BHCB199678,,
2020-12-11 11:44:26-03,UFMG,BHCB,113719,PreservedSpecimen,Plantae,Monocotyledon,,,Orchidaceae,Cyrtopodium,glutiniferum,,Cyrtopodium glutiniferum,Raddi,,,,,,"Batista, JAN",1649,,2006,10,,,Southern America,Brasil,Minas Gerais,Belo Horizonte,Procedência desconhecida. Em cultivo nos jardins d,-43.937801361084,-19.9207992553711,0,0,17082,,0,0,,,,,,,,,"Pseudobulbos fusiformes, expostos. Inflorescência com até 6 ramificações laterais. Flores completamente amarelas.",BHCB001165,BHCB001165,auto
2020-12-11 11:44:26-03,UFMG,BHCB,64323,PreservedSpecimen,Plantae,Monocotyledon,,,Orchidaceae,Cyrtopodium,glutiniferum,,Cyrtopodium glutiniferum,Raddi,,2011,06,03,,"Barreto, HLM",4827,,1933,09,01,,Southern America,Brasil,Minas Gerais,Conceição do Mato Dentro,Estrada de Conceição; Ponte do Santo Antônio.,-43.4249992370605,-19.0372009277344,0,0,60318,,0,0,,,,,,,,,"Frequente, flor amarela, herbácea.; Na pedra",BHCB001156,BHCB001156,auto
2020-12-11 11:44:26-03,UFMG,BHCB,63712,PreservedSpecimen,Plantae,Monocotyledon,,,Orchidaceae,Cyrtopodium,glutiniferum,,Cyrtopodium glutiniferum,Raddi,,,,,,"Salimena, FRG; Nobre, PH",933,,2001,10,21,,Southern America,Brasil,Minas Gerais,Descoberto,Reserva Biológica da Represa do Grama.,-42.9674987792969,-21.4596996307373,0,0,11991,,0,0,,,,,,,,,"Epilítica, em afloramento. Flores amarela, labelo pintalgado de vinho. Escapo ca. 1 m.",,,auto
2020-12-11 11:44:26-03,UFMG,BHCB,89465,PreservedSpecimen,Plantae,Monocotyledon,,,Orchidaceae,Cyrtopodium,glutiniferum,,Cyrtopodium glutiniferum,Raddi,,,,,,"Borba, EL",s.n.,,1998,07,,,Southern America,Brasil,Minas Gerais,Juiz de Fora,,-43.3502998352051,-21.7642002105713,0,0,36144,,0,0,,,,,,,,,"Pseudobulbos expostos, fusiformes, grandes, 30-45 x 5-7 cm. Folhas articuladas, verdes. Inflorescência 1,7-2,4 m compr., com uma ramificação lateral de 65-75 cm compr. Flores amarelas. Sépalos amarelo-esverdeados. Pétalos amarelos com as nervuras lig",,,auto
2020-12-11 11:44:26-03,UFMG,BHCB,16427,PreservedSpecimen,Plantae,Monocotyledon,,,Orchidaceae,Cyrtopodium,glutiniferum,,Cyrtopodium glutiniferum,Raddi,,2011,06,03,,"Grandi, TSM; Teixeira, EM; Braga, MMN",2653,,1989,09,30,,Southern America,Brasil,Minas Gerais,Rio Preto,Gruta do Funil,-43.8278007507324,-22.0891990661621,0,0,20815,,0,0,,,,,,,,,"Flores amarelas; Campo rupestre, sub-arbustivo",,,auto
2010-02-05 20:37:00-02,MO,MOBOT,2816981,PreservedSpecimen,Plantae,,,,Orchidaceae,Cyrtopodium,glutiniferum,,Cyrtopodium glutiniferum,Raddi,G. Carnevali,,,,,"John James Pipoly, III|Ganeshwar Gharbarran",Pipoly 9564,,1987,1,1,,South America,Guyana,,,"Upper Demerara-Berbice Region:+ 15 km E of Rockstone, on Linden-Rockstone Road. Adv. 2 Eperua forest, Dimorphandra thickets & savanna. Deep white sand, sandy loam sand.",-58.5,5.96666,,,,,1.00000000,50.00000000,,,,,,,,,,,,
2008-05-27 22:02:00-03,MO,MOBOT,665698,PreservedSpecimen,Plantae,,,,Orchidaceae,Cyrtopodium,glutiniferum,,Cyrtopodium glutiniferum,Raddi,G. Carnevali & I. Ramirez,,,,,Ronald L. Liesner,Liesner 18733,85-32,1985,3,15,,South America,Venezuela,Amazonas,,"Atabapo. Salto Yureba, Cerro Yureba, lower Ventuari. Hard, igneous rock banks of river and waterfall, patches of soil along river, and adjacent forest. ca 4º03'N, 66º01'W, elev. 350 m.",-66.01666,4.05,,,,,350.00000000,,,,,,4,,,,,,,
2021-02-09 10:13:42-03,UENF,HUENF,5788,PreservedSpecimen,Plantae,,,,Orchidaceae,Cyrtopodium,glutiniferum,,Cyrtopodium glutiniferum,Raddi,,,,,,"Nascimento, M.T.; Pessanha, A.S.;",47,,2008,09,20,,,Brasil,Rio de Janeiro,Campos dos Goytacazes,Morro Itaoca - Morro do macaco,-41.448056,-21.797222,41º26'53''W,21º47'50''S,,,201,201,,,,,,,,,"rupícola de pseudobulbos robustos, bainhas com acúleos pontiagudos, folhas bem nervuradas na face inferior, flores amarelas em grandes panículas, sol pleno",HUENF00005791,,
2021-04-06 18:56:46-03,UENF,HUENF,11652,PreservedSpecimen,Plantae,,,,Orchidaceae,Cyrtopodium,glutiniferum,,Cyrtopodium glutiniferum,Raddi,D.R. Couto,2019,05,12,,D.R. Couto; H. Viana; M. Paixão & T. Paixão,4439,,2019,05,11,,,Brasil,Rio de Janeiro,Campos dos Goytacazes,Ibitioca. Cume do Morro do Rato (Vegetação de Inselberg). Maciço do Itaoca,-41.453889,-21.792222,41º27'14''W,21º47'32''S,,,283,283,,,,,,,,,"Erva rupícola, heliófila, em ilhas de vegetação rupícola. Lâmina verde concolor; pedúnculo verde, ereto; brácteas florais verde-amareladas; flores amarelas. Comum.",HUENF00012533,,
2021-02-09 10:13:42-03,UENF,HUENF,12052,PreservedSpecimen,Plantae,,,,Orchidaceae,Cyrtopodium,glutiniferum,,Cyrtopodium glutiniferum,Raddi,D.R. Couto & H. Viana,2019,08,31,,D.R. Couto; H. Viana,4680,,2019,08,31,,,Brasil,Rio de Janeiro,Campos dos Goytacazes,"Ibitioca, Maciço do Itaoca. Morro do Rato, afloramento rochoso com Vellozia, Selaginella sellowii, Coleocephalocereus e Anthurium.",-41.455,-21.7925,41º27'18''W,21º47'33''S,,,240,240,,,,,,,,,"Erva rupícola, heliófila. Flores amarelas. Abundante.",HUENF00012884,,
2021-02-09 10:13:42-03,UENF,HUENF,5567,PreservedSpecimen,Plantae,,,,Orchidaceae,Cyrtopodium,glutiniferum,,Cyrtopodium glutiniferum,Raddi,"Braga, J.M.A.",2010,06,21,,"Mauad, L.P.; Souza, T.P., Reis, M.P.",174,,2010,04,20,,,Brasil,Rio de Janeiro,Campos dos Goytacazes,Morro Itaoca,-41.448056,-21.797222,41º26'53''W,21º47'50''S,,,201,201,,,,,,,,,"Planta herbácea, 90 cm de altura, fruto cor verde e flor amarela, coletada no paredão de pedra, local ensolarado sem cobertura arbórea",HUENF00005570,,
2021-02-09 10:13:42-03,UENF,HUENF,5786,PreservedSpecimen,Plantae,,,,Orchidaceae,Cyrtopodium,glutiniferum,,Cyrtopodium glutiniferum,Raddi,,,,,,"Nascimento, M.T.; Pessanha, A.S.;",40,,2008,08,23,,,Brasil,Rio de Janeiro,Campos dos Goytacazes,Morro Itaoca - Morro do macaco,-41.448056,-21.797222,41º26'53''W,21º47'50''S,,,201,201,,,,,,,,,"rupícola de pseudobulbos robustos, bainhas com acúleos pontiagudos, folhas bem nervuradas na face inferior, flores amarelas em grandes panículas, sol pleno",HUENF00005789,,
2021-02-09 10:13:42-03,UENF,HUENF,5787,PreservedSpecimen,Plantae,,,,Orchidaceae,Cyrtopodium,glutiniferum,,Cyrtopodium glutiniferum,Raddi,,,,,,"Nascimento, M.T.; Pessanha, A.S.;",41,,2008,08,23,,,Brasil,Rio de Janeiro,Campos dos Goytacazes,Morro Itaoca - Morro do macaco,-41.448056,-21.797222,41º26'53''W,21º47'50''S,,,201,201,,,,,,,,,"rupícola de pseudobulbos robustos, bainhas com acúleos pontiagudos, folhas bem nervuradas na face inferior, flores amarelas em grandes panículas, sol pleno",HUENF00005790,,
2019-11-21 10:13:06-03,IBt,SP,45997,S,Plantae,,,,Orchidaceae,Cyrtopodium,glutiniferum,,Cyrtopodium glutiniferum,Raddi,"Batista, JAN",2001,01,,,"Heringer, EP",671,,,,,,,Brasil,Minas Gerais,Coronel Pacheco,Estação Experimental de Café,-43.2655982971191,-21.5877990722656,0,0,10350,,,,,,,,,,,,,,,auto
2019-11-21 10:13:06-03,IBt,SP,360975,S,Plantae,,,,Orchidaceae,Cyrtopodium,glutiniferum,,Cyrtopodium glutiniferum,Raddi,"Mamede, MCH",2011,03,08,,"Salimena, FRG; Nobre, PH",933,,2001,10,21,,,Brasil,Minas Gerais,Descoberto,Reserva Biológica da represa do Grama,-42.9674987792969,-21.4596996307373,0,0,11991,,,,,,,,,,,,,,,auto
2019-11-21 10:13:06-03,IBt,SP,369157,S,Plantae,,,,Orchidaceae,Cyrtopodium,glutiniferum,,Cyrtopodium glutiniferum,Raddi,"Mamede, MCH",2011,03,,,"Borba, E",s.n.,,2003,11,,,,Brasil,Minas Gerais,Juiz de Fora,,-43.3502998352051,-21.7642002105713,0,0,36144,,,,,,,,,,,,,,,auto
2019-11-21 10:13:06-03,IBt,SP,373457,S,Plantae,,,,Orchidaceae,Cyrtopodium,glutiniferum,,Cyrtopodium glutiniferum,Raddi,"Bocayuca, M",,,,,"Bocayuva, M; Saddi, E; Zaldini, CA",43,,2003,08,22,,,Brasil,Rio de Janeiro,Rio de Janeiro,Parque Natural Municipal da Prainha. Trilha (ponto de partida na ponte) pelo meio do Parque chegando em um paredão,-43.2075004577637,-22.9027996063232,0,0,57442,,,,,,,,,,,,,,,auto
2019-11-06 09:56:50-03,UFOP,OUPR,9671,PreservedSpecimen,Plantae,,,,Orchidaceae,Cyrtopodium,glutiniferum,,Cyrtopodium glutiniferum,Raddi,"Barros, F.; Vinhos, F.; Rodrigues, VT (LEFB)",2012,,,,"Pinheiro, M.E.S.",s.n.,,,,,,,Brasil,Minas Gerais,Mariana,Entre Águas Claras e Paracatu,-43.4160995483398,-20.377799987793,0,0,33524,,0,0,,,,,,,,,Sobre rocha.Erva. Flores amarelas,,,auto
2020-07-10 09:48:15-03,MBML,MBML-HERBARIO,27202,,Plantae,,,,Orchidaceae,Cyrtopodium,cf. glutiniferum,,Cyrtopodium cf. glutiniferum,Raddi,A. P. Fontana/Março-2007,,,,,"V. Demuner; L.F.S. Magnago, T. Cruz, Elias Bausen",2704,,2006,08,23,,,Brasil,Espírito Santo,Governador Lindenberg,"Pedra de Santa Luzia, prop.: Firmino Sottele",-40.463333,-19.275833,40W27'48,19S16'33,,,350,350,,,,,,,,,"Terrestre botões florais, flores amarelas. Base de afloramento rochoso.",MBML027202,MBML027202_1 MBML027202_2,
2020-07-22 20:15:30-03,MBML,MBML-HERBARIO,11184,,Plantae,,,,Orchidaceae,Cyrtopodium,glutiniferum,,Cyrtopodium glutiniferum,Raddi,C. N. de Fraga/09-11-2002,,,,,Cintia C. Chamas; et al,329,,1994,12,13,,,Brasil,Espírito Santo,Santa Teresa,Estação Biológica de Santa Lúcia,-40.530278,-19.971389,40W31'49,19S58'17,,,,,,,,,,,,,"Herbácea, labelo amarelo forte e centro com manchas vermelhas, pétalas amarelo claro, sépala amarelo esverdeado e verso amarronzado, pendúnculo verde, raquis roxa. Borda de mata em regeneração, sol filtrado, altitude 735m.",MBML011184,MBML011184_1 MBML011184_2,
2020-07-22 20:15:30-03,MBML,MBML-HERBARIO,12776,,Plantae,,,,Orchidaceae,Cyrtopodium,glutiniferum,,Cyrtopodium glutiniferum,Raddi,Fraga/09-11-2002,,,,,C. N. de Fraga; et al,481,,1999,08,21,,,Brasil,Espírito Santo,Ibiraçu,Estação Ecológica Mosteiro Zem Morro da Vargem,-40.376944,-19.889444,40W22'37,19S53'22,,,,,,,,,,,,,"Vegetação rupestre. Mata Atlântica. Terrestre em solo raso, sobre rocha, escapo de ca. 1,50m, flores amarelas.",MBML012776,MBML012776_1 MBML012776_2,
2020-07-22 20:15:30-03,MBML,MBML-HERBARIO,13098,,Plantae,,,,Orchidaceae,Cyrtopodium,glutiniferum,,Cyrtopodium glutiniferum,Raddi,C. N. de Fraga/09-11-2002,,,,,C. N. de Fraga; et al,663,,2000,07,16,,,Brasil,Espírito Santo,Santa Teresa,Estação Biológica de Santa Lúcia,-40.530278,-19.971389,40W31'49,19S58'17,,,,,,,,,,,,,Mata Atlântica de encosta. Flores amarelas.,MBML013098,MBML013098,
