MODIFIED,INSTITUTIONCODE,COLLECTIONCODE,CATALOGNUMBER,BASISOFRECORD,KINGDOM,PHYLUM,CLASS,ORDER,FAMILY,GENUS,SPECIFICEPITHET,INFRASPECIFICEPITHET,SCIENTIFICNAME,SCIENTIFICNAMEAUTHORSHIP,IDENTIFIEDBY,YEARIDENTIFIED,MONTHIDENTIFIED,DAYIDENTIFIED,TYPESTATUS,RECORDEDBY,RECORDNUMBER,FIELDNUMBER,YEAR,MONTH,DAY,EVENTTIME,CONTINENTOCEAN,COUNTRY,STATEPROVINCE,COUNTY,LOCALITY,DECIMALLONGITUDE,DECIMALLATITUDE,VERBATIMLONGITUDE,VERBATIMLATITUDE,COORDINATEPRECISION,BOUNDINGBOX,MINIMUMELEVATIONINMETERS,MAXIMUMELEVATIONINMETERS,MINIMUMDEPTHINMETERS,MAXIMUMDEPTHINMETERS,SEX,PREPARATIONTYPE,INDIVIDUALCOUNT,PREVIOUSCATALOGNUMBER,RELATIONSHIPTYPE,RELATEDCATALOGITEM,OCCURRENCEREMARKS,BARCODE,IMAGECODE,GEOFLAG
2020-12-11 11:44:47-03,UFMG,BHCB,178927,PreservedSpecimen,Plantae,Monocotyledon,,,Orchidaceae,Octomeria,crassifolia,,Octomeria crassifolia,Lindl.,,2015,11,,,"Paiva, JAM; Pivari, MOD; Tomich, S; Nascimento, L",926,,2015,09,30,,Southern America,Brasil,Minas Gerais,Ouro Preto,RPPN Capanema,-43.605,-20.197222,-43.605,-20.197222,,,0,0,,,,,,,,,Prensada em álcool; Erva epífita; frutos passados castanhos.; Mata em enconsta de Campo Rupestre Quartzítico,,,
2020-12-11 11:44:47-03,UFMG,BHCB,82699,PreservedSpecimen,Plantae,Monocotyledon,,,Orchidaceae,Octomeria,crassifolia,,Octomeria crassifolia,Lindl.,,2014,04,29,,"Lombardi, JA; Stehmann, JR; Mota, RC da; Temponi, LG",5402,,2003,08,23,,Southern America,Brasil,Minas Gerais,Santa Maria do Salto,Fazenda Duas Barras,-40.047361,-16.411306,-40.047361,-16.411306,,,774,940,,,,,,,,,"Erva epífita, flores verde-amareladas; Mata hidrófila, encosta",BHCB014448,,
2020-12-11 11:44:47-03,UFMG,BHCB,199442,PreservedSpecimen,Plantae,Monocotyledon,,,Orchidaceae,Octomeria,crassifolia,,Octomeria crassifolia,Lindl.,,,,,,"Barbosa, AR; Batista, JAN; Carvalho, BM de; Martins, CAN",169,,2016,07,18,,Southern America,Brasil,Minas Gerais,Aiuruoca,Pico do Papagaio,-44.603099822998,-21.9755992889404,0,0,27460,,0,0,,,,,,,,,Planta em cultivo no Museu de História Natural e Jardim Botânico da UFMG número MHNJB00785.; Sépalas e pétalas brancas amareladas no ápice; labelo amarelo com duas manchas rosas centrais; coluna branca; Erva epífita associada a mata d,BHCB199442,,auto
2020-12-11 11:44:47-03,UFMG,BHCB,27994,PreservedSpecimen,Plantae,Monocotyledon,,,Orchidaceae,Octomeria,crassifolia,,Octomeria crassifolia,Lindl.,,,,,,"Rocha, CLM",s.n.,,1989,04,12,,Southern America,Brasil,Minas Gerais,Caeté,Serra da Piedade,-43.6697006225586,-19.8799991607666,0,0,22051,,0,0,,,,,,,,,campo rupestre; saxícola ; heliófila,,,auto
2020-12-11 11:44:47-03,UFMG,BHCB,199441,PreservedSpecimen,Plantae,Monocotyledon,,,Orchidaceae,Octomeria,crassifolia,,Octomeria crassifolia,Lindl.,,2016,,,,"Cabral, SOF",24,,2016,07,18,,Southern America,Brasil,Minas Gerais,Caeté,Serra da Piedade,-43.6697006225586,-19.8799991607666,0,0,22051,,0,0,,,,,,,,,Planta em cultivo no Museu de História Natural e Jardim Botânico da UFMG número MHNJB00739.; Sépalas e pétalas brancas amareladas no ápice; labelo amarelo com duas manchas rosas centrais; coluna branca; Erva epífita associada a campo,BHCB199441,,auto
2020-12-11 11:44:47-03,UFMG,BHCB,181982,PreservedSpecimen,Plantae,Monocotyledon,,,Orchidaceae,Octomeria,crassifolia,,Octomeria crassifolia,Lindl.,,,,,,"Gontijo, SL",s.n.,,,,,,Southern America,Brasil,Minas Gerais,Caeté,Serra da Piedade,-43.6697006225586,-19.8799991607666,0,0,22051,,0,0,,,,,,,,,"Planta em cultivo no Museu de História Natural e Jardim Botânico da UFMG número MHNJB00727 a MHNJB00745. Coleta original por Borba, E.L.; Erva epífita associada a campo rupestre.",,,auto
2020-12-11 11:44:47-03,UFMG,BHCB,57828,PreservedSpecimen,Plantae,Monocotyledon,,,Orchidaceae,Octomeria,crassifolia,,Octomeria crassifolia,Lindl.,,,,,,"Salino, A; Melo, LCN",6421,,2001,03,30,,Southern America,Brasil,Minas Gerais,Camanducaia,"Bairro do mato, sítio do mato, mata da nascente do",-46.1446990966797,-22.7553005218506,0,0,22140,,1950,1950,,,,,,,,,"Epífita a 4m de altura, flores amarelas, interior de mata.",,,auto
2020-12-11 11:44:47-03,UFMG,BHCB,52813,PreservedSpecimen,Plantae,Monocotyledon,,,Orchidaceae,Octomeria,crassifolia,,Octomeria crassifolia,Lindl.,,2008,09,,,"Vasconcelos, MF de",s.n.,,2000,02,17,,Southern America,Brasil,Minas Gerais,Catas Altas,Serra do Caraça. Pico do Inficionado,-43.4075012207031,-20.0746994018555,0,0,11966,,2010,2010,,,,,,,,,"rupícula, corola amarela; Campo Rupestre",BHCB001444,BHCB001444,auto
2020-12-11 11:44:47-03,UFMG,BHCB,181975,PreservedSpecimen,Plantae,Monocotyledon,,,Orchidaceae,Octomeria,crassifolia,,Octomeria crassifolia,Lindl.,,,,,,"Gontijo, SL",s.n.,,,,,,Southern America,Brasil,Minas Gerais,Catas Altas,"Serra do Caraça, RPPN Caraça",-43.4075012207031,-20.0746994018555,0,0,11966,,0,0,,,,,,,,,"Planta em cultivo no Museu de História Natural e Jardim Botânico da UFMG número MHNJB00757 a MHNJB00771. Coleta original por Borba, E.L.; Erva epífita associada a mata de galeria",,,auto
2020-12-11 11:44:47-03,UFMG,BHCB,181962,PreservedSpecimen,Plantae,Monocotyledon,,,Orchidaceae,Octomeria,crassifolia,,Octomeria crassifolia,Lindl.,,,,,,"Cabral, SOF",12,,2016,05,16,,Southern America,Brasil,Minas Gerais,Catas Altas,"Serra do Caraça, RPPN Caraça",-43.4075012207031,-20.0746994018555,0,0,11966,,0,0,,,,,,,,,"Planta em cultivo no Museu de História Natural e Jardim Botânico da UFMG número MHNJB00757. Coleta original por Borba, E.L.; Sépalas e pétalas brancas amareladas no ápice; labelo amarelo com duas manchas rosas centrais; coluna branca.",BHCB037948,,auto
2020-12-11 11:44:47-03,UFMG,BHCB,149976,PreservedSpecimen,Plantae,Monocotyledon,,,Orchidaceae,Octomeria,crassifolia,,Octomeria crassifolia,Lindl.,,2014,04,29,,"Lau, BL; Mota, NFO; Almeida, TE; Ramalho, AJ",45,,2011,03,22,,Southern America,Brasil,Minas Gerais,Delfim Moreira,"Fazenda Boa Esperança, Trilha do Marlon",-45.2799987792969,-22.5091991424561,0,0,20219,,0,0,,,,,,,,,"Erva epífita, flores creme com calo vinho; Floresta Ombrófila Densa em regeneração",BHCB014453,,auto
2020-12-11 11:44:47-03,UFMG,BHCB,26520,PreservedSpecimen,Plantae,Monocotyledon,,,Orchidaceae,Octomeria,crassifolia,,Octomeria crassifolia,Lindl.,,,,,,"Teixeira, WA",s.n.,,1995,02,25,,Southern America,Brasil,Minas Gerais,Itabirito,Pico do Itabirito,-43.801399230957,-20.2532997131348,0,0,20553,,0,0,,,,,,,,,"coletada sobre afloramento de hematita, MBR. Flores amarelas.",,,auto
2020-12-11 11:44:47-03,UFMG,BHCB,199449,PreservedSpecimen,Plantae,Monocotyledon,,,Orchidaceae,Octomeria,crassifolia,,Octomeria crassifolia,Lindl.,,2016,,,,"Cabral, SOF",33,,2016,10,17,,Southern America,Brasil,Minas Gerais,Itamarandiba,"Parque Estadual da Serra Negra, Serra Negra",-42.8588981628418,-17.8572006225586,0,0,39586,,0,0,,,,,,,,,"Planta em cultivo no Museu de História Natural e Jardim Botânico da UFMG número MHNJB00746. Coleta original por Batista, J.A.N.; Erva epífita. Sépalas e pétalas brancas amareladas no ápice; labelo amarelo com duas manchas rosas centra",BHCB199449,,auto
2020-12-11 11:44:47-03,UFMG,BHCB,181968,PreservedSpecimen,Plantae,Monocotyledon,,,Orchidaceae,Octomeria,crassifolia,,Octomeria crassifolia,Lindl.,,,,,,"Gontijo, SL",s.n.,,,,,,Southern America,Brasil,Minas Gerais,Itamarandiba,"Serra Negra, Parque Estadual da Serra Negra, parte de cima da serra, após as torres de transmissão.",-42.8588981628418,-17.8572006225586,0,0,39586,,0,0,,,,,,,,,"Planta em cultivo no Museu de História Natural e Jardim Botânico da UFMG número MHNJB00746 a MHNJB00756. Coleta original por Batista, J.A.N. 2043.; Erva epífita.",,,auto
2020-12-11 11:44:47-03,UFMG,BHCB,92479,PreservedSpecimen,Plantae,Monocotyledon,,,Orchidaceae,Octomeria,crassifolia,,Octomeria crassifolia,Lindl.,,2014,04,29,,"Mota, RC da",2600,,2002,06,19,,Southern America,Brasil,Minas Gerais,Raul Soares,PCH Granada,-42.4524993896484,-20.101900100708,0,0,33728,,0,0,,,,,,,,,Erva epífita; flores amarelas; Planta coletada em mata de galeria,BHCB014451,,auto
2021-06-26 01:37:06-03,UENF,HUENF,12443,PreservedSpecimen,Plantae,,,,Orchidaceae,Octomeria,crassifolia,,Octomeria crassifolia,Lindl.,H.B.M.Viana,2019,08,06,,H.B.M. Viana,129,,2019,08,06,,,Brasil,Rio de Janeiro,Campos dos Goytacazes,"Ibitioga, Morro do Itaóca. Vegetação sobre Afloramento rochoso (inselberg).",-41.4575,-21.791944,41º27'27''W,21º47'31''S,,,300,300,,,,,,,,,"Erva, epífita de pequeno porte, pseudobulbo recoberto por bracteas paliçosas, flores em forma de estrela, perianto e labelo de cor uniforme, amarelo-esverdiado semi-transparente, medindo aprox 0,5mm de raio. Floresceu in cultivo.",HUENF00013265,,
2020-07-23 12:17:23-03,CEPLAC,CEPEC,115417,PreservedSpecimen,Plantae,,,,Orchidaceae,Octomeria,crassifolia,,Octomeria crassifolia,,Sem Informação,,,,,"Thomas, W.W.",14606,,2006,01,19,,,Brasil,Bahia,arataca,"Serra Peito de moça, 9,7 km NE of Arataca, on dirt road to Una, then 8,8 km NW (left) on road through Faz. Sta. Rita to Reserva do IESB (Faz. Palmeira.)",-39.343889,-15.161111,39W20'38,15S9'40,,,850,850,,,,,,,,,,,,
2020-07-23 12:17:23-03,CEPLAC,CEPEC,116508,PreservedSpecimen,Plantae,,,,Orchidaceae,Octomeria,crassifolia,,Octomeria crassifolia,,Sem Informação,,,,,"Fontana, A. P.",2643,,2007,01,17,,,Brasil,Bahia,ALMADINA,"Serra do Corcovado. 13,8km ao sw de Coaraci na estrada para Almadina. Fazenda São José.",-39.602222,-14.703056,39W36'8,14S42'11,,,470,470,,,,,,,,,UNICATA.,,,
2020-07-23 12:17:23-03,CEPLAC,CEPEC,116519,PreservedSpecimen,Plantae,,,,Orchidaceae,Octomeria,crassifolia,,Octomeria crassifolia,,Sem Informação,,,,,"Fontana, A. P.",2657,,2007,01,20,,,Brasil,Bahia,arataca,"Serra do Peito-de-Moça. Estrada que liga Arataca à Una, ramal ca. 22,4km de Arataca, com entrada no Assentamento Santo Antônio. RPPN Caminho das Pedras. Trilha de acesso ao mormaço.",-39.343611,-15.160833,39W20'37,15S9'39,,,500,500,,,,,,,,,Material em álcool 70%. UNICATA.,,,
2020-07-23 12:17:23-03,CEPLAC,CEPEC,30715,PreservedSpecimen,Plantae,,,,Orchidaceae,Octomeria,crassifolia,,Octomeria crassifolia,,W. Forster,,,,,R. M. Harley,22811,,1980,05,30,,,Brasil,Bahia,MORRO DO CHAPÉU,"Topo do Morro do Chapéu. Ca. 8Km ao SW da cidade, ao W da Rod. p/ Utinga.",-41.2,-11.583333,41W12',11S35',,,,,,,,,,,,29/07/2003,,,,
2020-07-23 12:17:23-03,CEPLAC,CEPEC,96762,PreservedSpecimen,Plantae,,,,Orchidaceae,Octomeria,crassifolia,,Octomeria crassifolia,,L. Menini Neto,,,,,"Fiaschi, P.",1559,,2003,08,13,,,Brasil,Bahia,Barro Preto,"Ca. 13,5 Km da estrada de Barro Preto, até o acesso à Serra da Pedra Lascada.",-39.537778,-14.772778,39W32'16,14S46'22,,,,,,,,,,,,,,,,
2020-08-20 20:37:56-03,UFSC,FLOR,39568,PreservedSpecimen,Plantae,,,Asparagales,Orchidaceae,Octomeria,crassifolia,,Octomeria crassifolia,Lindl.,"Lenzi, M.",2011,,,,"Lenzi, M.; Fraga, A.M.",56,,2010,05,01,,,Brasil,Santa Catarina,Palhoça,,-48.653056,-27.800556,48º39'11''W,27º48'2''S,,,100,100,,,,,,,,,epífito. Holoepífito. Floração observada nos meses de março a maio.,FLOR0039568,,
2020-08-20 14:54:47-03,UFSC,FLOR,37760,PreservedSpecimen,Plantae,,,Asparagales,Orchidaceae,Octomeria,crassifolia,,Octomeria crassifolia,Lindl.,"Siqueira, C.E.",2013,10,09,,"Siqueira, C.E.",71,,2010,04,26,,,Brasil,Santa Catarina,Florianópolis,"Campeche, Ilha de Santa Catarina.",-48.391667,-27.506389,48º23'30''W,27º30'23''S,,,2,2,,,,,,,,,"epífita, flor amarelada, sápalas e pétalas iguais.",FLOR0037760,,
2020-08-20 20:37:56-03,UFSC,FLOR,41641,PreservedSpecimen,Plantae,,,Asparagales,Orchidaceae,Octomeria,crassifolia,,Octomeria crassifolia,Lindl.,"Lenzi, M.",2011,,,,"Lenzi, M.",98,,2010,04,03,,,Brasil,Santa Catarina,Palhoça,,-48.696111,-27.725833,48º41'46''W,27º43'33''S,,,75,75,,,,,,,,,epifítico facultativo/herbáceo terrestre. Floração observada nos meses de março a maio.,FLOR0041641,,
2020-08-20 14:54:47-03,UFSC,FLOR,37761,PreservedSpecimen,Plantae,,,Asparagales,Orchidaceae,Octomeria,crassifolia,,Octomeria crassifolia,Lindl.,"Siqueira, C.E.",2010,04,26,,"Siqueira, C.E.",74,,2010,04,26,,,Brasil,Santa Catarina,Florianópolis,"Campeche, Ilha de Santa Catarina.",-48.506389,-27.691667,48º30'23''W,27º41'30''S,,,2,2,,,,,,,,,"epífita, flor amarelada, sápalas e pétalas iguaisEm tronco de Ocotea Pulchella a 40 cm do solo. Bainha do remicaule tubular, cartácea. Perfume sutilmente adocicado",FLOR0037761,,
2020-08-20 14:54:47-03,UFSC,FLOR,22568,PreservedSpecimen,Plantae,,,Asparagales,Orchidaceae,Octomeria,crassifolia,,Octomeria crassifolia,Lindl.,"Santos, T.F.",2017,03,16,,"Falkenberg, D.B.",5848,,1992,05,23,,,Brasil,Santa Catarina,Florianópolis,"Em frente à sede da Estação Ecológica Carijós, Ratones, Ilha de Santa Catarina.",-48.5491981506348,-27.596700668335,,,27000,,5,5,,,,,,,,,"epífita sobre tronco principal de uma árvore, a 2 m altura do solo, flor perianto amarelo",FLOR0022568,,auto
2020-08-20 14:54:48-03,UFSC,FLOR,3828,PreservedSpecimen,Plantae,,,Asparagales,Orchidaceae,Octomeria,crassifolia,,Octomeria crassifolia,Lindl.,"Pabst, G.",2011,10,27,,"Klein, R.M.; Bresolin, A.",7723,,1968,05,23,,,Brasil,Santa Catarina,Florianópolis,"Morro Costa da Lagoa, Ilha de Santa Catarina.",-48.5491981506348,-27.596700668335,,,27000,,400,400,,,,,,,,,"epífito, flor amarela",FLOR0003828,,auto
2020-08-20 14:54:48-03,UFSC,FLOR,4015,PreservedSpecimen,Plantae,,,Asparagales,Orchidaceae,Octomeria,crassifolia,,Octomeria crassifolia,Lindl.,"Santos, T.F.",2017,03,16,,"Klein, R.M.",7398,,1967,05,16,,,Brasil,Santa Catarina,Florianópolis,"Morro do ribeirão, Ilha de Santa Catarina.",-48.5491981506348,-27.596700668335,,,27000,,350,350,,,,,,,,,"epífito, flor amarelada",FLOR0004015,,auto
2020-08-20 14:54:47-03,UFSC,FLOR,1543,PreservedSpecimen,Plantae,,,Asparagales,Orchidaceae,Octomeria,crassifolia,,Octomeria crassifolia,Lindl.,"Pabst, G.",2011,10,27,,"Klein, R.M.",7395,,1967,05,16,,,Brasil,Santa Catarina,Florianópolis,"Morro do Ribeirão, Ilha de Santa Catarina.",-48.5491981506348,-27.596700668335,,,27000,,300,300,,,,,,,,,"epífita, flor amarelada",FLOR0001543,,auto
2020-08-20 14:54:47-03,UFSC,FLOR,2536,PreservedSpecimen,Plantae,,,Asparagales,Orchidaceae,Octomeria,crassifolia,,Octomeria crassifolia,Lindl.,"Pabst, G.",2011,10,27,,"Klein, R.M.; Bresolin, A.",9559,,1971,05,19,,,Brasil,Santa Catarina,Governador Celso Ramos,Jordão.,-48.5592002868652,-27.3146991729736,,,13751,,150,150,,,,,,,,,"epífita, flor creme",FLOR0002536,,auto
2020-08-20 14:54:47-03,UFSC,FLOR,2527,PreservedSpecimen,Plantae,,,Asparagales,Orchidaceae,Octomeria,crassifolia,,Octomeria crassifolia,Lindl.,"Pabst, G.",2011,10,27,,"Klein, R.M.; Bresolin, A.",9411,,1971,05,18,,,Brasil,Santa Catarina,Palhoça,Morro da Cambirela.,-48.6678009033203,-27.645299911499,,,31105,,700,700,,,,,,,,,"epífita, flor creme",FLOR0002527,,auto
2020-08-20 14:54:47-03,UFSC,FLOR,2547,PreservedSpecimen,Plantae,,,Asparagales,Orchidaceae,Octomeria,crassifolia,,Octomeria crassifolia,Lindl.,"Pabst, G.",2011,10,27,,"Klein, R.M.; Bresolin, A.",9390,,1971,05,18,,,Brasil,Santa Catarina,Palhoça,Morro do Cambirela.,-48.6678009033203,-27.645299911499,,,31105,,400,400,,,,,,,,,"epífito, flor amarela",FLOR0002547,,auto
2020-08-20 14:54:47-03,UFSC,FLOR,2529,PreservedSpecimen,Plantae,,,Asparagales,Orchidaceae,Octomeria,crassifolia,,Octomeria crassifolia,Lindl.,"Santos, T.F.",2017,03,16,,"Klein, R.M.; Bresolin, A.",9408,,1971,05,18,,,Brasil,Santa Catarina,Palhoça,"Morro do cambirela, Palhoça, SC.",-48.6678009033203,-27.645299911499,,,31105,,700,700,,,,,,,,,"epífita, flor amarelada",FLOR0002529,,auto
2020-08-20 14:54:47-03,UFSC,FLOR,2539,PreservedSpecimen,Plantae,,,Asparagales,Orchidaceae,Octomeria,crassifolia,,Octomeria crassifolia,Lindl.,"Santos, T.F.",2017,03,16,,"Klein, R.M.",9487,,1971,05,20,,,Brasil,Santa Catarina,Paulo Lopes,Costa do Morro de Paulo Lopes.,-48.6836013793945,-27.9617004394531,,,23385,,50,50,,,,,,,,,"epífita, flor creme",FLOR0002539,,auto
2020-08-20 14:54:48-03,UFSC,FLOR,38488,PreservedSpecimen,Plantae,,,Asparagales,Orchidaceae,Octomeria,crassifolia,,Octomeria crassifolia,Lindl.,,,,,,"Matos, J.Z. de; Venturi, S.",85,,2007,05,02,,,Brasil,Santa Catarina,Santo Amaro da Imperatriz,Área do Hotel Plaza Caldas da Imperatriz.,-48.7785987854004,-27.6881008148193,,,22435,,,,,,,,,,,,"sobre rocha, flor amarela, com parte bordô no interior do labelo. Tem fotos da planta viva.",FLOR0038488,FLOR0038488_v1 FLOR0038488_v2 FLOR0038488_v3 FLOR0038488_v4 FLOR0038488_v5 FLOR0038488_v6 FLOR0038488_v7 FLOR0038488_v8,auto
2017-09-11 17:12:03-03,UnB,HBVIRTFLBRAS,,O,Plantae,,,,Orchidaceae,Octomeria,crassifolia,,Octomeria crassifolia,Lindl.,,,,,,"Moura, JT de",85,,,,,,Southern America,Brazil,Rio de Janeiro,Teresópolis,in arboribus ad Serra dos Orgãos prope Theresopolis et ad Serra das Araras,-42.9656,-22.4122,0,0,38539,,,,,,,,,,,,,,P03P4N0128,auto
2017-09-11 17:12:03-03,UnB,HBVIRTFLBRAS,,O,Plantae,,,,Orchidaceae,Octomeria,crassifolia,,Octomeria crassifolia,Lindl.,,,,,,"Schenck, JHR",2767,,,,,,Southern America,Brazil,Rio de Janeiro,Teresópolis,in arboribus ad Serra dos Orgãos prope Theresopolis,-42.9656,-22.4122,0,0,38539,,,,,,,,,,,,Floret Januario - Junio,,P03P4N0128,auto
2017-09-11 17:12:03-03,UnB,HBVIRTFLBRAS,,O,Plantae,,,,Orchidaceae,Octomeria,crassifolia,,Octomeria crassifolia,Lindl.,,,,,,"Riedel, L",57?,,,,,,Southern America,Brazil,Rio de Janeiro,Magé,"IBB/Fazenda da Mandioca, Magé, RJ, in rupibus arboribusque prope Mandiocca prov. Rio de Janeiro",-43.166667,-22.566667,-43.166667,-22.566667,,,,,,,,,,,,,,,P03P4N0128,
2017-09-11 17:12:03-03,UnB,HBVIRTFLBRAS,,O,Plantae,,,,Orchidaceae,Octomeria,crassifolia,,Octomeria crassifolia,Lindl.,,,,,,"Moura, JT de",40,,,,,,Southern America,Brazil,Rio de Janeiro,Teresópolis,in arboribus ad Serra dos Orgãos prope Theresopolis et ad Serra das Araras,-42.9656,-22.4122,0,0,38539,,,,,,,,,,,,,,P03P4N0128,auto
2017-09-11 17:12:03-03,UnB,HBVIRTFLBRAS,,O,Plantae,,,,Orchidaceae,Octomeria,crassifolia,,Octomeria crassifolia,Lindl.,,,,,,"Moura, JT de",112,,,,,,Southern America,Brazil,Rio de Janeiro,Teresópolis,in arboribus ad Serra dos Orgãos prope Theresopolis et ad Serra das Araras,-42.9656,-22.4122,0,0,38539,,,,,,,,,,,,,,P03P4N0128,auto
2017-09-11 17:12:03-03,UnB,HBVIRTFLBRAS,,O,Plantae,,,,Orchidaceae,Octomeria,crassifolia,,Octomeria crassifolia,Lindl.,,,,,,"Mosén, CWH",3687,,,,,,Southern America,Brazil,São Paulo,Santos,in sylvis virgineis ad Sorocaba et in ripis amnis Buturoca prope Santos prov. S. Paulo,-46.33,-23.96,0,0,26836,,,,,,,,,,,,,,P03P4N0128,auto
2017-09-11 17:12:03-03,UnB,HBVIRTFLBRAS,,O,Plantae,,,,Orchidaceae,Octomeria,crassifolia,,Octomeria crassifolia,Lindl.,,,,,,"Mosén, CWH",3799,,,,,,Southern America,Brazil,São Paulo,Santos,in sylvis virgineis ad Sorocaba et in ripis amnis Buturoca prope Santos prov. S. Paulo,-46.33,-23.96,0,0,26836,,,,,,,,,,,,,,P03P4N0128,auto
2019-11-21 10:13:36-03,IBt,SP,193024,S,Plantae,,,,Orchidaceae,Octomeria,crassifolia,,Octomeria crassifolia,Lindl.,"Forster, W",2008,09,,,"Macedo, ICC; Custodio Filho, A",39,,1983,07,07,,,Brasil,São Paulo,Biritiba-Mirim,Estação Biológica de Boracéia,-45.866667,-23.633333,-45.866667,-23.633333,,,890,950,,,,,,,,,,,,
2019-11-21 10:13:37-03,IBt,SP,413081,S,Plantae,,,,Orchidaceae,Octomeria,crassifolia,,Octomeria crassifolia,Lindl.,"Barros, F",2009,05,06,,"Guimarães, LRS; Laitano, TL",72,,,,,,,Brasil,Minas Gerais,Santana do Riacho,"Serra do Cipó, Região de Serra Morena, mata ciliar próximo à Cachoeira Cornélio",-43.556806,-19.271167,-43.556806,-19.271167,,,1232,1232,,,,,,,,,,,,
2019-11-21 10:13:37-03,IBt,SP,401791,S,Plantae,,,,Orchidaceae,Octomeria,crassifolia,,Octomeria crassifolia,Lindl.,"Barros, F",2007,,,,"Barros, F",s.n.,,2007,05,02,,,Brasil,Bahia,Itagi,"18 km de Itagi-Mirim, entre Salto da Divisa e Itagi-Mirim, Fazenda Jaime Fernández",-40.0060997009277,-14.1627998352051,0,0,19304,,,,,,,,,,,,,,,auto
2019-11-21 10:13:37-03,IBt,SP,366387,S,Plantae,,,,Orchidaceae,Octomeria,crassifolia,,Octomeria crassifolia,Lindl.,"Mamede, MCH",2011,03,,,"Bicalho, HD",s.n.,,1961,11,13,,,Brasil,Minas Gerais,Camanducaia,Vila Monte Verde,-46.1446990966797,-22.7553005218506,0,0,22140,,,,,,,,,,,,,,,auto
2019-11-21 10:13:37-03,IBt,SP,40496,S,Plantae,,,,Orchidaceae,Octomeria,crassifolia,,Octomeria crassifolia,Lindl.,"Forster, W",2008,09,,,"Hatschbach, A",s.n.,,1936,05,11,,,Brasil,Paraná,Curitiba,,-49.2731018066406,-25.4277992248535,0,0,25180,,,,,,,,,,,,,,,auto
2019-11-21 10:13:36-03,IBt,SP,196428,S,Plantae,,,,Orchidaceae,Octomeria,crassifolia,,Octomeria crassifolia,Lindl.,"Forster, W",2008,09,,,"Hatschbach, G",44951,,1982,05,18,,,Brasil,Paraná,Morretes,Serra Marumbi; Ninho do Gavião,-48.834400177002,-25.476900100708,0,0,30514,,1100,1100,,,,,,,,,,,,auto
2019-11-21 10:13:36-03,IBt,SP,192509,S,Plantae,,,,Orchidaceae,Octomeria,crassifolia,,Octomeria crassifolia,Lindl.,"Forster, W",2008,09,,,"Hatschbach, G",43879,,1981,05,14,,,Brasil,Paraná,Paranaguá,Pontal do Poço,-48.5092010498047,-25.5200004577637,0,0,24916,,3,5,,,,,,,,,,,,auto
2019-11-21 10:13:37-03,IBt,SP,69732,S,Plantae,,,,Orchidaceae,Octomeria,crassifolia,,Octomeria crassifolia,Lindl.,"Forster, W",2008,09,,,"Hatschbach, G",2249,,1951,05,01,,,Brasil,Paraná,Paranaguá,Rio Cachoeirinha,-48.5092010498047,-25.5200004577637,0,0,24916,,,,,,,,,,,,Anotações de Hoehne: As flores e a planta concordam mas o labelo pelos bordos erosos e nervura mediana discorda. A estudar 14/06/1957,,,auto
2019-11-21 10:13:37-03,IBt,SP,69667,S,Plantae,,,,Orchidaceae,Octomeria,crassifolia,,Octomeria crassifolia,Lindl.,"Forster, W",2008,09,,,"Hatschbach, G",1406,,1949,05,01,,,Brasil,Paraná,Piraquara,Rio do Corvo,-49.0633010864258,-25.4416999816895,0,0,12577,,,,,,,,,,,,,,,auto
2019-11-21 10:13:37-03,IBt,SP,25553,S,Plantae,,,,Orchidaceae,Octomeria,crassifolia,,Octomeria crassifolia,Lindl.,"Forster, W",2008,09,,,"Spannagel, C",184,,,,,,,Brasil,Rio de Janeiro,Petrópolis,,-43.1786003112793,-22.5049991607666,0,0,36524,,,,,,,,,,,,,,,auto
2019-11-21 10:13:37-03,IBt,SP,29291,S,Plantae,,,,Orchidaceae,Octomeria,crassifolia,,Octomeria crassifolia,Lindl.,"Forster, W",2008,09,,,"Spannagel, C",2,,,,,,,Brasil,Rio de Janeiro,Petrópolis,,-43.1786003112793,-22.5049991607666,0,0,36524,,,,,,,,,,,,,,,auto
2019-11-21 10:13:37-03,IBt,SP,2168,S,Plantae,,,,Orchidaceae,Octomeria,crassifolia,,Octomeria crassifolia,Lindl.,"Forster, W",2008,09,,,"Magalhães, AAB",s.n.,,1918,06,27,,,Brasil,Rio de Janeiro,Rio de Janeiro,,-43.2075004577637,-22.9027996063232,0,0,57442,,,,,,,,,,,,,,,auto
2019-11-21 10:13:37-03,IBt,SP,56263,S,Plantae,,,,Orchidaceae,Octomeria,crassifolia,,Octomeria crassifolia,Lindl.,"Forster, W",2008,09,,,"Heringer, EP",2720,,1951,05,,,,Brasil,Rio de Janeiro,Rio de Janeiro,"Ilha da Água, Baía de Guanabara",-43.2075004577637,-22.9027996063232,0,0,57442,,,,,,,,,,,,,,,auto
2019-11-21 10:13:37-03,IBt,SP,50489,S,Plantae,,,,Orchidaceae,Octomeria,crassifolia,,Octomeria crassifolia,Lindl.,"Forster, W",2008,09,,,"Orth, C",s.n.,,1936,02,29,,,Brasil,Rio Grande do Sul,São Leopoldo,Capão do Frade,-51.1472015380859,-29.7602996826172,0,0,10287,,,,,,,,,,,,,,,auto
2019-11-21 10:13:37-03,IBt,SP,22558,S,Plantae,,,,Orchidaceae,Octomeria,crassifolia,,Octomeria crassifolia,Lindl.,"Forster, W",2008,09,,,"Recch, P",1,,,,,,,Brasil,São Paulo,Amparo,,-46.7599983215332,-22.7000007629395,0,0,18036,,,,,,,,,,,,,,,auto
2019-11-21 10:13:37-03,IBt,SP,401874,S,Plantae,,,,Orchidaceae,Octomeria,crassifolia,,Octomeria crassifolia,Lindl.,"Barros, F",2007,11,23,,"Barros, F",s.n.,,,,,,,Brasil,São Paulo,Anhembi,"Fazenda Barreiro Rico. Cultivada na Seção do Orquidário do Instituto de Botânica sob nº 3766, florescendo em 24-IV-2006",-48.1199989318848,-22.7800006866455,0,0,25656,,,,,,,,,,,,,,,auto
2019-11-21 10:13:37-03,IBt,SP,244255,S,Plantae,,,,Orchidaceae,Octomeria,crassifolia,,Octomeria crassifolia,Lindl.,"Santos, TF",2016,07,14,,"Kirizawa, M; Angelo, J",2298,,1990,05,29,,,Brasil,São Paulo,Bertioga,"Rodovia 101 (SP-RJ), loteamento Guaratuba",-46.138599395752,-23.8544006347656,0,0,37616,,,,,,,,,,,,,,,auto
2019-11-21 10:13:37-03,IBt,SP,491570,S,Plantae,,,,Orchidaceae,Octomeria,crassifolia,,Octomeria crassifolia,Lindl.,"Foster, W",2008,09,,,"Blanco, NG",s.n.,,1939,04,22,,,Brasil,São Paulo,Campinas,Arraial dos Souzas. Rio Atibaia,-47.060001373291,-22.8999996185303,0,0,23900,,,,,,,,,,,,,,,auto
2019-11-21 10:13:37-03,IBt,SP,43532,S,Plantae,,,,Orchidaceae,Octomeria,crassifolia,,Octomeria crassifolia,Lindl.,"Forster, W",2008,09,,,"Blanco, NG",s.n.,,,,,,,Brasil,São Paulo,Campinas,"Rio Atibaia, Arraial dos Souzas",-47.060001373291,-22.8999996185303,0,0,23900,,,,,,,,,,,,,,,auto
2019-11-21 10:13:37-03,IBt,SP,54038,S,Plantae,,,,Orchidaceae,Octomeria,crassifolia,,Octomeria crassifolia,Lindl.,"Forster, W",2008,09,,,"Pabst, GFJ",329,,,,,,,Brasil,São Paulo,Campos do Jordão,,-45.5900001525879,-22.7299995422363,0,0,21048,,,,,,,,,,,,,,,auto
2019-11-21 10:13:36-03,IBt,SP,21019,S,Plantae,,,,Orchidaceae,Octomeria,crassifolia,,Octomeria crassifolia,Lindl.,"Forster, W",2008,09,,,"Hoehne, FC",s.n.,,1926,03,18,,,Brasil,São Paulo,Campos do Jordão,,-45.5900001525879,-22.7299995422363,0,0,21048,,,,,,,,,,,,,,,auto
2019-11-21 10:13:37-03,IBt,SP,401853,S,Plantae,,,,Orchidaceae,Octomeria,crassifolia,,Octomeria crassifolia,Lindl.,"Barros, F",2007,11,23,,"Barros, F",s.n.,,,,,,,Brasil,São Paulo,Campos do Jordão,"Horto Florestal. Cultivada na Seção do Orquidário do Instituto de Botânica sob nº 12169, florescendo em 24-IV-2006",-45.5900001525879,-22.7299995422363,0,0,21048,,,,,,,,,,,,,,,auto
2019-11-21 10:13:37-03,IBt,SP,254836,S,Plantae,,,,Orchidaceae,Octomeria,crassifolia,,Octomeria crassifolia,Lindl.,"Udulutsch, RG",2001,12,,,"Jouy, A",B483,,1987,11,01,,,Brasil,São Paulo,Campos do Jordão,Pico do Itapeva,-45.5900001525879,-22.7299995422363,0,0,21048,,,,,,,,,,,,Referência das fotografias: 884324 / 884326 / 884602 / 884605,,,auto
