MODIFIED,INSTITUTIONCODE,COLLECTIONCODE,CATALOGNUMBER,BASISOFRECORD,KINGDOM,PHYLUM,CLASS,ORDER,FAMILY,GENUS,SPECIFICEPITHET,INFRASPECIFICEPITHET,SCIENTIFICNAME,SCIENTIFICNAMEAUTHORSHIP,IDENTIFIEDBY,YEARIDENTIFIED,MONTHIDENTIFIED,DAYIDENTIFIED,TYPESTATUS,RECORDEDBY,RECORDNUMBER,FIELDNUMBER,YEAR,MONTH,DAY,EVENTTIME,CONTINENTOCEAN,COUNTRY,STATEPROVINCE,COUNTY,LOCALITY,DECIMALLONGITUDE,DECIMALLATITUDE,VERBATIMLONGITUDE,VERBATIMLATITUDE,COORDINATEPRECISION,BOUNDINGBOX,MINIMUMELEVATIONINMETERS,MAXIMUMELEVATIONINMETERS,MINIMUMDEPTHINMETERS,MAXIMUMDEPTHINMETERS,SEX,PREPARATIONTYPE,INDIVIDUALCOUNT,PREVIOUSCATALOGNUMBER,RELATIONSHIPTYPE,RELATEDCATALOGITEM,OCCURRENCEREMARKS,BARCODE,IMAGECODE,GEOFLAG
2021-03-24 17:08:38-03,UFES,SAMES,1474,PreservedSpecimen,Plantae,,,,Araceae,Philodendron,edmundoi,,Philodendron edmundoi,G.M.Barroso,"Valadares,R.T.",2020,03,12,,"Pinto Junior, H.V.; Covre, C.",151,,2015,06,25,,,Brasil,Espírito Santo,Águia Branca,Região dos Três Pontões de Águia Branca.,-40.7402992248535,-18.9831008911133,,,19701,,,,,,,,,,,,Herbácea habitando ilha de vegetação em afloramento rochoso; folhas verdes com pecíolo roxo; sem inflorescência; abundante; sol pleno.,SAMES01474,,auto
2021-03-24 17:08:38-03,UFES,SAMES,8184,PreservedSpecimen,Plantae,,,,Araceae,Philodendron,edmundoi,,Philodendron edmundoi,G.M.Barroso,"Valadares,R.T.",2020,03,12,,"Pinto Junior,H.V.; W.S.Justino.;T.Sperandio.;N.S.S.braga.",362,,2017,12,08,,,Brasil,Espírito Santo,Nova Venécia,APA PEDRA DO ELEFANTE.,-40.4006004333496,-18.710599899292,-404575000.0,-187638889.0,42400,,,,,,,,,,,,"Folhas verdes pilosa, urticante, fruto seco, sombra, abundante.",SAMES08184,,auto
2021-03-24 17:08:38-03,UFES,SAMES,1701,PreservedSpecimen,Plantae,,,,Araceae,Philodendron,edmundoi,,Philodendron edmundoi,G.M.Barroso,"Valadares,R.T.",2020,03,12,,"Pinto Junior, H.V.; Luber, J.",229,,2016,03,16,,,Brasil,Espírito Santo,Águia Branca,Santa Luzia. Antiga propriedade do Sr. Ciro Ferreira; afloramento próximo a cachoeira do Arco-íris.,-40.7402992248535,-18.9831008911133,,,19701,,,,,,,,,,,,Herbácea habitando ilha de vegetação em afloramento rochoso; folhas verde claro; sol pleno; abundante.,SAMES01701,,auto
2021-03-24 17:08:38-03,UFES,SAMES,6241,PreservedSpecimen,Plantae,,,,Araceae,Philodendron,edmundoi,,Philodendron edmundoi,G.M.Barroso,"Valadares,R.T.",2020,03,12,,"Pinto Junior,H.V.; Cruz,G.P.R;Justino,W.S.",287,,2016,05,26,,,Brasil,Espírito Santo,Castelo,,-41.184700012207,-20.6035995483398,-410544444.0,-203066667.0,23588,,,,,,,,,,,,Folhas verdes. Habito: Herbácea,SAMES06241,,auto
2021-03-24 17:08:38-03,UFES,SAMES,446,PreservedSpecimen,Plantae,,,,Araceae,Philodendron,edmundoi,,Philodendron edmundoi,G.M.Barroso,"Valadares,R.T.",2020,03,12,,"Giaretta,A.O.; Ribeiro,M.;Menezes,L.F.T.;Rossini,J.",907,,2010,11,04,,,Brasil,Espírito Santo,Nova Venécia,"Vertente oeste na Pedra do Elefante. Próximo a uma pedreira às margens da ES 137, Elevação de 144M.",-40.4006004333496,-18.710599899292,,,42400,,,,,,,,,,,,"Erva terrestre, base interna da sépala vinosa, exsudade alaranjado.",SAMES00446,,auto
2021-03-24 17:08:38-03,UFES,SAMES,1471,PreservedSpecimen,Plantae,,,,Araceae,Philodendron,edmundoi,,Philodendron edmundoi,G.M.Barroso,"Valadares,R.T.",2020,03,12,,"Pinto Junior, H.V.; Menezes, L.F.T.; Covre, C.;",193,,2015,09,18,,,Brasil,Espírito Santo,Vila Pavão,Pedra Tri-gêmea. Afloramento granítico.,-40.611400604248,-18.6149997711182,,,19647,,,,,,,,,,,,Herbácea habitando ilha de vegetação em afloramento granítico; folhas verdes; abundante; sol pleno.,SAMES01471,,auto
2019-11-01 15:12:54-03,UnB,UB,,PreservedSpecimen,Plantae,Monocotyledonae,,,Araceae,Philodendron,edmundoi,,Philodendron edmundoi,G.M.Barroso,"Gonçalves, EG",2000,02,,,"Gonçalves, EG; Salviani, ER; Leoni, LS; Peixoto, M",726,,2001,02,01,,Southern America,Brasil,Minas Gerais,Alto Caparaó,"Parque Nacional do Caparaó, Vale Verde",-41.8683013916016,-20.4333000183105,0,0,21645,,1100,1100,,,,,,,,,"Rupícola. Caule até 5 cm de diâmetro. Entrenós até 3 cm de comprimento. Pecíolo canaliculado adaxialmente, com vários nectários e um anel vináceo no ápice. Nervuras não proeminentes",UB0001391,UB0001391,auto
2020-06-29 11:29:00-03,UFRJ,RFA,37022,PreservedSpecimen,Plantae,,,,Araceae,Philodendron,edmundoi,,Philodendron edmundoi,G.M.Barroso,L.S.B. Calazans,2011,06,27,,L.S.B. Calazans; M.O.O. Pellegrini,45,,2010,07,05,,,Brasil,Rio de Janeiro,Petrópolis,"Vale das Videiras, Cume do Morro do Cuca",-43.162222,-22.250556,43º9'44''W,22º15'2''S,,,1703,1703,,,,,,,,,"Pequena população rupícola, sob forte luminosidade direta, formando uma pequena moita em conjunto com orquídeas, bromélias e antúrio. Folhas sub-coriáceas. Inflorescência fechada",RFA23757,,
2020-06-29 11:29:00-03,UFRJ,RFA,37023,PreservedSpecimen,Plantae,,,,Araceae,Philodendron,edmundoi,,Philodendron edmundoi,G.M.Barroso,L.S.B. Calazans,2019,06,27,,L.S.B. Calazans; M.O.O. Pellegrini,44,,2010,07,05,,,Brasil,Rio de Janeiro,Petrópolis,"Vale das Videiras, Mirante do Morro do Cuca",-43.173889,-22.252222,43º10'26''W,22º15'8''S,,,1280,1280,,,,,,,,,"Pequena população rupícola. Profilo persistente ou decíduo, de coloração clara com nuances vináceas, fracamente bicarenado. Folhas com nectários roxos na nervural central; ápice do pecíolo com anel roxo bem marcado, ligeiramente intumes",RFA23758,,
2020-06-29 11:29:00-03,UFRJ,RFA,37024,PreservedSpecimen,Plantae,,,,Araceae,Philodendron,edmundoi,,Philodendron edmundoi,G.M.Barroso,L.S.B. Calazans,2010,06,27,,L.S.B. Calazans; M.O.O. Pellegrini,43,,2010,07,05,,,Brasil,Rio de Janeiro,Petrópolis,"Vale das Videiras, Mirante do Morro do Cuca",-43.173889,-22.252222,43º10'26''W,22º15'8''S,,,1280,1280,,,,,,,,,"Pequena população rupícola. Folhas discolores, lados ligeiramente assimétricos; pecíolo verde-arroxeado a fortemente roxo, com nectários vináceos até a nervura central. Profilo arroxeado, persistente. Espata com constrição média, verde",RFA23759,,
2021-07-02 09:31:54-03,UFRJ,RFA,24829,PreservedSpecimen,Plantae,,,,Araceae,Philodendron,edmundoi,,Philodendron edmundoi,G.M.Barroso,M. Nadruz,2000,10,02,,A. Quinet,46327,,2000,07,30,,,Brasil,Rio de Janeiro,Nova Friburgo,"5° Distrito, Santa Lúcia.",-42.291667,-22.384444,42º17'30''W,22º23'4''S,,,600,600,,,,,,,,,"Planta herbácea, folhas discolor verde, inflorescência verde, comum no local.",RFA32426,,
2019-12-06 19:29:12-03,UFES,VIES,41543,S,Plantae,,,,Araceae,Philodendron,edmundoi,,Philodendron edmundoi,G.M.Barroso,"Calazans, L.S.B.",2016,,,,"Cardoso, W.C.; Borges, W.S.",417,,2015,11,25,,,Brasil,Espírito Santo,Santa Maria de Jetibá,Pedra do Garrafão.,-40.919722,-20.178333,40º55'11''W,20º10'42''S,,,,,,,,,,,,,,VIES041543,VIES041543,
2020-04-27 16:08:43-03,UFES,VIES,19292,S,Plantae,,,,Araceae,Philodendron,edmundoi,,Philodendron edmundoi,G.M.Barroso,"Valadares, R.T.",2010,04,20,,"Krahl, A.H.",143,,2008,12,07,,,Brasil,Espírito Santo,Cachoeiro de Itapemirim,Burarama.,-41.1128005981445,-20.8488998413086,,,35694,,,,,,,,,,,,,VIES019292,VIES019292,auto
2019-06-27 10:24:02-03,UFES,VIES,33516,S,Plantae,,,,Araceae,Philodendron,edmundoi,,Philodendron edmundoi,G.M.Barroso,"Nadruz, M.",2013,,,,"Zorzanelli, J.P.F.",951,,2013,11,25,,,Brasil,Espírito Santo,Iúna,Serra do Valentim.,-41.5358009338379,-20.3458003997803,,,32198,,1533,1533,,,,,,,,,,VIES033516,VIES033516,auto
2020-04-27 16:08:43-03,UFES,VIES,33513,S,Plantae,,,,Araceae,Philodendron,edmundoi,,Philodendron edmundoi,G.M.Barroso,"Nadruz, M.",2014,01,30,,"Zorzanelli, J.P.F.",929,,2014,01,27,,,Brasil,Espírito Santo,Iúna,Serra do Valentim.,-41.5358009338379,-20.3458003997803,,,32198,,1303,1303,,,,,,,,,,VIES033513,VIES033513,auto
2020-04-27 16:08:43-03,UFES,VIES,33512,S,Plantae,,,,Araceae,Philodendron,edmundoi,,Philodendron edmundoi,G.M.Barroso,"Nadruz, M.",2014,01,30,,"Zorzanelli, J.P.F.",934,,2014,01,27,,,Brasil,Espírito Santo,Iúna,Serra do Valentim.,-41.5358009338379,-20.3458003997803,,,32198,,1358,1358,,,,,,,,,,VIES033512,VIES033512,auto
2019-06-27 10:24:02-03,UFES,VIES,9108,S,Plantae,,,,Araceae,Philodendron,edmundoi,,Philodendron edmundoi,G.M.Barroso,"Valadares, R.T.",,,,,"Sarnaglia Júnior, V.B.",411,,2011,08,27,,,Brasil,Espírito Santo,Laranja da Terra,Cinco Pontões.,-41.0567016601562,-19.8988990783691,,,17356,,,,,,,,,,,,,VIES009108,VIES009108,auto
2020-04-27 16:08:43-03,UFES,VIES,30956,S,Plantae,,,,Araceae,Philodendron,edmundoi,,Philodendron edmundoi,G.M.Barroso,"Couto, D.R.",2011,05,05,,"Couto, D.R.",1556,,2010,04,21,,,Brasil,Espírito Santo,Mimoso do Sul,Pedra dos Pontões.,-41.3664016723633,-21.0641994476318,,,29430,,730,730,,,,,,,,,,VIES030956,VIES030956,auto
2020-04-27 16:08:43-03,UFES,VIES,16751,S,Plantae,,,,Araceae,Philodendron,edmundoi,,Philodendron edmundoi,G.M.Barroso,"Calazans, L.S.B.",2014,08,03,,"Gomes, J.M.L.",3063,,2006,10,01,,,Brasil,Espírito Santo,Muniz Freire,São Simão.,-41.4131011962891,-20.4641990661621,,,30072,,,,,,,,,,,,,VIES016751,VIES016751,auto
2020-04-27 16:08:43-03,UFES,VIES,40897,S,Plantae,,,,Araceae,Philodendron,edmundoi,,Philodendron edmundoi,G.M.Barroso,"Pena, N.T.L.",2015,06,11,,"Pena, N.T.L.; Alves-Araújo, A.; Souza, W.O. & Luber, J.",236,,2015,05,05,,,Brasil,Espírito Santo,Nova Venécia,APA Pedra do Elefante.,-40.4006004333496,-18.710599899292,,,42400,,,,,,,,,,,,,VIES040897,VIES040897,auto
2020-04-27 16:08:43-03,UFES,VIES,28276,S,Plantae,,,,Araceae,Philodendron,edmundoi,,Philodendron edmundoi,G.M.Barroso,L.S.B. Calazans,2018,05,23,,"Giaretta, A.O.; Ribeiro, M.; Menezes, L.F.T. & Rossini, J.",907,,2010,11,04,,,Brasil,Espírito Santo,Nova Venécia,Vertente oeste na Pedra do Elefante.,-40.4006004333496,-18.710599899292,,,42400,,,,,,,,,,,,,VIES028276,VIES028276,auto
2019-06-27 10:24:02-03,UFES,VIES,27851,S,Plantae,,,,Araceae,Philodendron,edmundoi,,Philodendron edmundoi,G.M.Barroso,"Valadares, R.T.",2009,,,,"Lorencini, T.S.; Siqueira, V.B.",347,,2009,08,08,,,Brasil,Espírito Santo,Santa Maria de Jetibá,Garrafão.,-40.7461013793945,-20.040599822998,,,31867,,,,,,,,,,,,,VIES027851,VIES027851,auto
2019-06-27 10:24:02-03,UFES,VIES,27850,S,Plantae,,,,Araceae,Philodendron,edmundoi,,Philodendron edmundoi,G.M.Barroso,"Valadares, R.T.",2009,,,,"Lorencini, T.S.; Siqueira, V.B.",343,,2009,08,08,,,Brasil,Espírito Santo,Santa Maria de Jetibá,Garrafão.,-40.7461013793945,-20.040599822998,,,31867,,,,,,,,,,,,,VIES027850,VIES027850,auto
2020-04-27 16:08:43-03,UFES,VIES,22338,S,Plantae,,,,Araceae,Philodendron,edmundoi,,Philodendron edmundoi,G.M.Barroso,"Valadares, R.T.",2009,11,08,,"Valadares, R.T.; Gomes, J.M.L.",923,,2009,11,08,,,Brasil,Espírito Santo,Serra,APA Mestre Álvaro.,-40.3078002929688,-20.1285991668701,,,16451,,,,,,,,,,,,,VIES022338,VIES022338,auto
2020-04-27 16:08:43-03,UFES,VIES,16270,S,Plantae,,,,Araceae,Philodendron,edmundoi,,Philodendron edmundoi,G.M.Barroso,"Valadares, R.T.",2010,07,07,,"Pereira, O.J.",7744,,1997,04,22,,,Brasil,Espírito Santo,Serra,Mestre Álvaro.,-40.3078002929688,-20.1285991668701,,,16451,,,,,,,,,,,,,VIES016270,VIES016270,auto
2020-01-09 11:37:24-03,UNIOESTE,UNOP,10498,S,Plantae,,,,Araceae,Philodendron,edmundoi,,Philodendron edmundoi,G.M. Barroso,"Nadruz, M.",2018,11,14,,"Camelo, M.C.; Temponi, L.G.; Nadruz, M.; Ribeiro, R.; Temponi, L.G.; Nadruz, M.; Ribeiro, R.",43,,2018,11,14,,,Brasil,Minas Gerais,Araponga,Parque Estadual Serra do Brigadeiro. Trilha do Carvão,-42.481111,-20.719444,-42.481111,-20.719444,,,1316,1316,,,,,,,,,"Bainha curta, se estendendo apenas na base do pecíolo, pecíolo verde com pontuações vináceas, anel vináceo no ápice próximo a lâmina foliar, lâmina verde, discolor, cartácea, alíptica e oblonga, ápice agudo, acuminado, base aguda, nervura central ver",,,
2020-02-21 10:41:47-03,UNIOESTE,UNOP,10517,S,Plantae,,,,Araceae,Philodendron,edmundoi,,Philodendron edmundoi,G.M.Barroso,"Temponi, L.G.; Nadruz, M.; Camelo.M.C.",,,,,"Camelo, M.C.; Temponi, L.G.; Nadruz, M.; Ribeiro, R.; Temponi, L.G.; Nadruz, M.; Ribeiro, R.",14,,,,,,,Brasil,Espírito Santo,Ibitirama,"Parque Nacional do Caparaó. Pedra Roxa, Rio Pedra Roxa.",-41.755556,-20.395556,-41.755556,-20.395556,,,1600,1600,,,,,,,,,"Próximo a mata ciliar, em paredão rochoso. Profilo vinho, pecíolo verde com máculas vinho, anel na região do ápice do pecíolo vinho, sem nervura primária lateral. Lamina foliar cartácea, verde, discolor, com máculas vinho na adaxial e abaxial. Inflor",,,
2020-01-09 11:37:24-03,UNIOESTE,UNOP,10500,S,Plantae,,,,Araceae,Philodendron,edmundoi,,Philodendron edmundoi,G.M. Barroso,"Temponi, L.G.; Nadruz, M.; Camelo M.C.",2017,11,15,,"Camelo, M.C.; Temponi, L.G.; Nadruz, M.; Ribeiro, R.; Temponi, L.G.; Nadruz, M.; Ribeiro, R.",16,,2017,11,15,,,Brasil,Espírito Santo,Divino de São Lourenço,"Parque Nacional do Caparaó. Limo Verde, próximo a zona de abastecimento de água.",-41.775,-20.399444,-41.775,-20.399444,,,990,990,,,,,,,,,"Interior da mata. Pecíolo verde com máculas vinho, lamina foliar cartácea a levemente coriácea, verde discolor. Inflorescência unissexual com flores femininas férteis amareladas-esverdeadas, flores estéreis femininas alvas, anel na região do ápice do",,,
2020-11-04 11:00:28-03,ESALQ,ESA,86053,PreservedSpecimen,Plantae,Magnoliophyta,,,Araceae,Philodendron,edmundoi,,Philodendron edmundoi,Barroso,Nadruz,2011,05,27,,"Forster, W. ; Romão, G.O.",749.0,,2000,10,18,,,Brasil,Espírito Santo,Alegre,Parque Nacional do Caparaó. Pedra Roxa. Floresta Ombrófila Densa. Margem do Rio Pedra Roxa.,-41.5331001281738,-20.763599395752,,,26101,,,,,,,,,,,,Trepadeira,ESA086053,ESA086053,auto
2021-06-28 10:48:27-03,MN,R,234882,PreservedSpecimen,Plantae,,,,Araceae,Philodendron,edmundoi,,Philodendron edmundoi,G.M. Barroso,,,,,,"Couto, D.R.",2915,,2014,08,25,,,Brasil,Espírito Santo,Nova Venécia,Serra de Cima,-40.4006004333496,-18.710599899292,,,42400,,,,,,,,,,,,,R010055644,,auto
2020-12-11 11:43:23-03,UFMG,BHCB,163514,PreservedSpecimen,Plantae,Monocotyledon,,,Araceae,Philodendron,edmundoi,,Philodendron edmundoi,G. M. Barroso,,2012,03,01,,"Paula, LFA de; Augsten, M",328,,2011,04,16,,Southern America,Brasil,Minas Gerais,Teófilo Otoni,"MG-418, Em afloramento granitico.",-41.260944,-17.855972,-41.260944,-17.855972,,,560,560,,,,,,,,,Rupicola. Flores masculinas brancas e flores femininas imaturas brancas. Espata branca na base e internamente vermelha. Margem da bainha da folha e da intersecao do peciolo com a folha sao avermelhados.,BHCB006834,,
2020-12-11 11:43:23-03,UFMG,BHCB,163522,PreservedSpecimen,Plantae,Monocotyledon,,,Araceae,Philodendron,edmundoi,,Philodendron edmundoi,G. M. Barroso,,2012,03,01,,"Paula, LFA de; Augsten, M",345,,2011,04,16,,Southern America,Brasil,Minas Gerais,Teófilo Otoni,"MG-418, Em afloramento granitico. Lado esquerdo da MG 418, cerca de 30 km norte de Teofilo Otoni,",-41.260944,-17.855972,-41.260944,-17.855972,,,560,560,,,,,,,,,"Rupicola. Flores masculinas brancas e flores femininas imaturas brancas. Espata branca na base e internamente vermelha. Margem da bainha da folha e da intersecao do peciolo com a folha sao avermelhados.; Rupicola, Flores masculinas br",BHCB006868,,
2018-12-10 13:05:00-02,MO,MOBOT,101085710,PreservedSpecimen,Plantae,,,,Araceae,Philodendron,edmundoi,,Philodendron edmundoi,G.M. Barroso,,,,,,Maria M. Arbo|et al.,Arbo 5594,,,,,,South America,Brazil,Espírito Santo,Colatina,,-40.6305999755859,-19.539400100708,,,57036,,,,,,,,,,,,,,,auto
2018-12-10 13:05:00-02,MO,MOBOT,101086985,PreservedSpecimen,Plantae,,,,Araceae,Philodendron,edmundoi,,Philodendron edmundoi,G.M. Barroso,,,,,,Rafaela C. Forzza|et al.,Forzza 2804,,,,,,South America,Brazil,Rio de Janeiro,Nova Friburgo,,-42.5311012268066,-22.2819004058838,,,33190,,,,,,,,,,,,,,,auto
2021-02-09 10:12:11-03,UENF,HUENF,11915,PreservedSpecimen,Plantae,,,,Araceae,Philodendron,edmundoi,,Philodendron edmundoi,G.M.Barroso,L. Calazans,2020,02,01,,D.R. Couto; H. Viana & P.M. Santos,5208,,2020,01,30,,,Brasil,Rio de Janeiro,São Francisco de Itabapoana,"Santa Luzia, Mata do Mico. Floresta Estacional Semidecidual, com muito cipós e presença de corte seletivo. Região da parcela 26.",-41.221667,-21.331667,41º13'18''W,21º19'54''S,,,70,70,,,,,,,,,"Erva holoepífita, vegetando na copa interna de grandes forófitos, semi-heliófila, ca. 15 m do solo. Pecíolo verde, base da lâmina com círculo vinho, lâmina verde discolor; caule prostrado com raízes vinosas. Pedúnculo verde, espata",HUENF00012769,,
2020-07-23 11:57:55-03,CEPLAC,CEPEC,104692,PreservedSpecimen,Plantae,,,,Araceae,Philodendron,edmundoi,,Philodendron edmundoi,,A. M. Amorim,,,,,"Amorim, A. M.",4820,,2005,02,07,,,Brasil,Bahia,Barro Preto,"Localidade&nf;Serra da Pedra Lascada. 13,7 Km de Barro Preto, na estrada que passa pela fazenda São Miguel e sobe até o acesso a serra.",-39.202778,-14.770278,39W12'10,14S46'13,,,600,600,,,,,,,,,,,,
2020-07-23 11:57:55-03,CEPLAC,CEPEC,110019,PreservedSpecimen,Plantae,,,,Araceae,Philodendron,edmundoi,,Philodendron edmundoi,,Sem Informação,,,,,"Jardim, J. G.",4898,,2005,12,18,,,Brasil,Bahia,arataca,"Rod. Arataca/Una entrada à direta no assentamento Santo Antônio 9,5 km, vicinal para a Fazenda Palmeira 8,9km da entrada. Serra do Peito de Moça, RPPN Palmeira/IESB. Coletas efetuadas próximo ao córrega ca. 2km da sede. Topo da serra.",-39.343611,-15.161944,39W20'37,15S9'43,,,800,800,,,,,,,,,,,,
2020-07-23 11:57:55-03,CEPLAC,CEPEC,114638,PreservedSpecimen,Plantae,,,,Araceae,Philodendron,edmundoi,,Philodendron edmundoi,,Sem Informação,,,,,"Amorim, A. M.",6516,,2006,10,22,,,Brasil,Bahia,CAMACAN,"RPPN Serra Bonita. 9,7 km de Camacan na estrada para Jacarecí. Daí 6 km SW na estrada para a RPPN e torre da Embratel.",-39.565278,-15.391667,39W33'55,15S23'30,,,900,900,,,,,,,,,,,,
2020-07-23 11:57:55-03,CEPLAC,CEPEC,135582,PreservedSpecimen,Plantae,,,,Araceae,Philodendron,edmundoi,,Philodendron edmundoi,,Sem Informação,,,,,M.M. Coelho,849,,2012,06,08,,,Brasil,Bahia,ALMADINA,"Serra do Corcovado, acesso pela vertente oposta à de Seu Francisco. Área denominada de Corcovado São Domingos, acesso pela Fazenda Aleluia, proprietário Sérgio Brito, Contato seu China.",-39.603333,-14.701667,39W36'12,14S42'6,,,,,,,,,,,,,Material prensado com álcool.,,,
2020-07-23 11:57:55-03,CEPLAC,CEPEC,131576,PreservedSpecimen,Plantae,,,,Araceae,Philodendron,edmundoi,,Philodendron edmundoi,,M. Nadruz,,,,,P. Leitman,163,,2011,02,27,,,Brasil,Bahia,arataca,"Parque Nacional da Serra das Lontras, trilha para o Peito de Moça.",-39.4143981933594,-15.2632999420166,,,19859,,,,,,,,,,,,<ll>dwc_commonname:</ll>,,,auto
2020-07-23 11:57:55-03,CEPLAC,CEPEC,129581,PreservedSpecimen,Plantae,,,,Araceae,Philodendron,edmundoi,,Philodendron edmundoi,,M. Nadruz,,,,,C. N. Fraga,1989,,,,,,,Brasil,Espírito Santo,castelo,,-41.184700012207,-20.6035995483398,,,23588,,,,,,,,,,,,<ll>dwc_commonname:</ll>,,,auto
2020-07-23 11:57:55-03,CEPLAC,CEPEC,129468,PreservedSpecimen,Plantae,,,,Araceae,Philodendron,edmundoi,,Philodendron edmundoi,,M. Nadruz,,,,,L. Kollmann,10691,,,,,,,Brasil,Espírito Santo,NOVA VENÉCIA,,-40.4006004333496,-18.710599899292,,,42400,,,,,,,,,,,,<ll>dwc_commonname:</ll>,,,auto
2019-06-10 10:10:56-03,FZB-BH,CVJBFZB,2552,S,Plantae,Magnoliophyta,Equisetopsida,Alismatales,Araceae,Philodendron,edmundoi,,Philodendron edmundoi,G.M.Barroso,Eduardo G. Gonçalves,2011,,,,Eduardo G. Gonçalves;,,,,,,,,Brasil,Minas Gerais,Caparaó,,-41.9043998718262,-20.523099899292,,,15056,,,,,,,,1,,,,254,,,auto
2020-07-10 09:43:34-03,MBML,MBML-HERBARIO,19829,,Plantae,,,,Araceae,Philodendron,cf. edmundoi,,Philodendron cf. edmundoi,G.M.Barroso,L.S.B. Calazans/28-06-2012,,,,,L. Kollmann; et al,6011,,2003,02,27,,,Brasil,Espírito Santo,Santa Maria de Jetibá,Belém,-40.697222,-20.043333,40W41'50,20S2'36,,,,,,,,,,,,,"Epífita, na sombra. Frutos verdes.",MBML019829,MBML019829,
2020-07-10 09:43:34-03,MBML,MBML-HERBARIO,11155,,Plantae,,,,Araceae,Philodendron,edmundoi,,Philodendron edmundoi,G.M. Barroso,L.S.B. Calazans/28-06-2012,,,,,Cintia C. Chamas; et al,333,,1994,12,14,,,Brasil,Espírito Santo,Santa Teresa,Estação Biológica de Santa Lúcia,-40.530278,-19.971389,40W31'49,19S58'17,,,,,,,,,,,,,"Epífita, entre-nó 7 a 8cm. Caule cilindrico verde amarronzado com manchas vermelhas. Folha verde escuro com nervura verde claro, face inferior com indumento branco e pontos vermelhos, pecíolo verde arroxeado com pequenas manchas vermel",MBML011155,MBML011155,
2020-07-10 09:43:34-03,MBML,MBML-HERBARIO,11156,,Plantae,,,,Araceae,Philodendron,edmundoi,,Philodendron edmundoi,G.M. Barroso,L.S.B. Calazans/28-06-2012,,,,,Cintia C. Chamas; et al,113,,1994,02,22,,,Brasil,Espírito Santo,Santa Teresa,Estação Biológica de Santa Lúcia,-40.530278,-19.971389,40W31'49,19S58'17,,,,,,,,,,,,,"Epífita, entre-nó 7 a 8cm. Caule cilindrico verde amarronzado com manchas vermelhas. Folha verde escuro com nervura verde claro, face inferior com indumento branco e pontos vermelhos, pecíolo verde arroxeado com pequenas manchas vermel",MBML011156,MBML011156,
2020-07-10 09:43:34-03,MBML,MBML-HERBARIO,11817,,Plantae,,,,Araceae,Philodendron,edmundoi,,Philodendron edmundoi,G.M. Barroso,L.S.B. Calazans/28-06-2012,,,,,V. Demuner; et al,343,,1999,12,16,,,Brasil,Espírito Santo,Santa Teresa,"São Lourenço, Country Club",-40.635556,-19.925556,40W38'8,19S55'32,,,,,,,,,,,,,"Planta terrestre apresentando folhas bicolor, face inf.verde claro, face sup.verde escuro. Folha que envolve a inflorescencia verde claro.",MBML011817,MBML011817,
2020-07-10 09:43:34-03,MBML,MBML-HERBARIO,1209,,Plantae,,,,Araceae,Philodendron,edmundoi,,Philodendron edmundoi,G.M.Barroso,M. Nadruz/25-05-1999,,,,,W. Pizziolo,307,,1986,03,13,,,Brasil,Espírito Santo,Santa Teresa,Valsugana Velha,-40.576944,-19.963056,40W34'37,19S57'47,,,,,,,,,,,,,"Trepadeira com raizes, espatas fechadas verdes, heliófila, capoeirão seco, encosta, declive suave.",MBML001209,MBML001209,
2020-07-10 09:43:34-03,MBML,MBML-HERBARIO,1315,,Plantae,,,,Araceae,Philodendron,edmundoi,,Philodendron edmundoi,G.M.Barroso,M. Nadruz/25-05-1999,,,,,H. Q. Boudet Fernandes,1773,,1986,01,15,,,Brasil,Espírito Santo,Santa Teresa,Estação Biológica de Santa Lúcia,-40.530278,-19.971389,40W31'49,19S58'17,,,,,,,,,,,,,"Trepadeira sobre arbusto, pecíolo com anel e manchas vináceas próximo ao limbo, este verde claro inferiormente, espata verde com pedúnculo com manchas vináceas, semi-sombra, terreno íngreme arenoso.",MBML001315,MBML001315,
2020-07-10 09:43:34-03,MBML,MBML-HERBARIO,13615,,Plantae,,,,Araceae,Philodendron,edmundoi,,Philodendron edmundoi,G.M. Barroso,L.S.B. Calazans/25-06-2012,,,,,L. Kollmann; et al,3187,,2000,10,13,,,Brasil,Espírito Santo,Castelo,Parque Estadual do Forno Grande,-41.100556,-20.519167,41W6'2,20S31'9,,,,,,,,,,,,,"Brácteas amarela com pintas marrons, folhas amareladas.",MBML013615,MBML013615,
2020-07-10 09:43:34-03,MBML,MBML-HERBARIO,20481,,Plantae,,,,Araceae,Philodendron,edmundoi,,Philodendron edmundoi,G.M. Barroso,L.S.B. Calazans/28-06-2012,,,,,R.R. Vervloet; et al,2315,,2003,04,29,,,Brasil,Espírito Santo,Santa Teresa,Reserva Biológica Augusto Ruschi - Nova Lombardia,-40.553056,-19.9075,40W33'11,19S54'27,,,,,,,,,,,,,"Epífita, a 2m de altura, inflorescência fechada, de cor verde. Topo de morro, dossel 8m.",MBML020481,MBML020481,
2020-07-10 09:43:34-03,MBML,MBML-HERBARIO,20697,,Plantae,,,,Araceae,Philodendron,edmundoi,,Philodendron edmundoi,G.M. Barroso,L.S.B. Calazans/28-06-2012,,,,,R.R. Vervloet; et al,2361,,2003,05,07,,,Brasil,Espírito Santo,Santa Teresa,Reserva Biológica Augusto Ruschi - Nova Lombardia,-40.553056,-19.9075,40W33'11,19S54'27,,,,,,,,,,,,,"Epífita, a 2m de altura, espádice fechada de cor verde, inflorescência amarelada. Topo de morro, dossel 18m.",MBML020697,MBML020697,
2020-07-10 09:43:34-03,MBML,MBML-HERBARIO,23152,,Plantae,,,,Araceae,Philodendron,edmundoi,,Philodendron edmundoi,G.M. Barroso,L.S.B. Calazans/28-06-2012,,,,,A. P. Fontana; et al,875,,2004,04,10,,,Brasil,Espírito Santo,Itaguaçu,Pedra do Caparaó,-40.981111,-19.741389,40W58'52,19S44'29,,,,,,,,,,,,,"Rupestre, bráctea floral com base verde e ápice amarelo pintas vermelhas.",MBML023152,MBML023152,
2020-07-10 09:43:34-03,MBML,MBML-HERBARIO,23529,,Plantae,,,,Araceae,Philodendron,edmundoi,,Philodendron edmundoi,G.M.Barroso,Nadruz/10-07-2008,,,,,L. Kollmann; et al,7176,,2004,10,30,,,Brasil,Espírito Santo,Castelo,Parque Estadual do Forno Grande,-41.100556,-20.519167,41W6'2,20S31'9,,,,,,,,,,,,,Rupestre ao sol. Espiga verde.,MBML023529,MBML023529,
2020-07-10 09:43:34-03,MBML,MBML-HERBARIO,23704,,Plantae,,,,Araceae,Philodendron,edmundoi,,Philodendron edmundoi,G.M.Barroso,L.S.B. Calazans/28-06-2012,,,,,L. Kollmann; et al,7579,,2005,03,25,,,Brasil,Espírito Santo,Castelo,Parque Estadual do Forno Grande,-41.100556,-20.519167,41W6'2,20S31'9,,,,,,,,,,,,,Rupestre no sol. Brácteas verdes.,MBML023704,MBML023704,
2020-07-10 09:43:34-03,MBML,MBML-HERBARIO,23918,,Plantae,,,,Araceae,Philodendron,edmundoi,,Philodendron edmundoi,G.M. Barroso,L.S.B. Calazans/28-06-2012,,,,,L. Kollmann; et al,7517,,2005,03,11,,,Brasil,Espírito Santo,Santa Teresa,Lombardia,-40.553056,-19.820556,40W33'11,19S49'14,,,,,,,,,,,,,"Epífita na sombra, espata verde.",MBML023918,MBML023918,
2020-07-10 09:43:34-03,MBML,MBML-HERBARIO,24085,,Plantae,,,,Araceae,Philodendron,edmundoi,,Philodendron edmundoi,G.M. Barroso,L.S.B. Calazans/28-06-2012,,,,,A. P. Fontana; et al,1006,,2004,11,01,,,Brasil,Espírito Santo,Castelo,Parque Estadual do Forno Grande,-41.100556,-20.519167,41W6'2,20S31'9,,,,,,,,,,,,,"Rupicola, heliófila, inflorescência branca.",MBML024085,MBML024085,
2020-07-10 09:43:34-03,MBML,MBML-HERBARIO,26084,,Plantae,,,,Araceae,Philodendron,edmundoi,,Philodendron edmundoi,G.M. Barroso,L.S.B. Calazans/28-06-2012,,,,,L. Kollmann; et al,8994,,2006,05,04,,,Brasil,Espírito Santo,Santa Teresa,Goiapaba-Açu,-40.479444,-19.919722,40W28'46,19S55'11,,,,,,,,,,,,,Erva rupestre no sol.,MBML026084,MBML026084,
