MODIFIED,INSTITUTIONCODE,COLLECTIONCODE,CATALOGNUMBER,BASISOFRECORD,KINGDOM,PHYLUM,CLASS,ORDER,FAMILY,GENUS,SPECIFICEPITHET,INFRASPECIFICEPITHET,SCIENTIFICNAME,SCIENTIFICNAMEAUTHORSHIP,IDENTIFIEDBY,YEARIDENTIFIED,MONTHIDENTIFIED,DAYIDENTIFIED,TYPESTATUS,RECORDEDBY,RECORDNUMBER,FIELDNUMBER,YEAR,MONTH,DAY,EVENTTIME,CONTINENTOCEAN,COUNTRY,STATEPROVINCE,COUNTY,LOCALITY,DECIMALLONGITUDE,DECIMALLATITUDE,VERBATIMLONGITUDE,VERBATIMLATITUDE,COORDINATEPRECISION,BOUNDINGBOX,MINIMUMELEVATIONINMETERS,MAXIMUMELEVATIONINMETERS,MINIMUMDEPTHINMETERS,MAXIMUMDEPTHINMETERS,SEX,PREPARATIONTYPE,INDIVIDUALCOUNT,PREVIOUSCATALOGNUMBER,RELATIONSHIPTYPE,RELATEDCATALOGITEM,OCCURRENCEREMARKS,BARCODE,IMAGECODE,GEOFLAG
2021-03-24 17:08:41-03,UFES,SAMES,8202,PreservedSpecimen,Plantae,,,,Arecaceae,Syagrus,ruschiana,,Syagrus ruschiana,(Bondar) Glassman,,,,,,"Pinto Junior,H.V.; W.S.Justino.;T.Sperandio.",380,,2018,03,20,,,Brasil,Espírito Santo,Águia Branca,REGIÃOS DOS 3 PONTÕES DE ÁGUIA BRANCA.,-40.7402992248535,-18.9831008911133,-407122222.0,-189786111.0,19701,,,,,,,,,,,,"Palmeira com mais de 2 metros, frutos laranjas (na carpoteca), sol, habitando ilha de vegetação em inselberg.",SAMES08202,,auto
2021-03-24 17:08:41-03,UFES,SAMES,8232,PreservedSpecimen,Plantae,,,,Arecaceae,Syagrus,ruschiana,,Syagrus ruschiana,(Bondar) Glassman,,,,,,"Pinto Junior,H.V.; W.S.Justiuno.;T.Sperandio.;Menezes,L.F.T.",410,,2018,03,22,,,Brasil,Espírito Santo,Vila Pavão,PEDRA DO VIADINHO.,-40.611400604248,-18.6149997711182,-405558333.0,-186230556.0,19647,,,,,,,,,,,,"Folhas verdes, frutos verdes (na carpoteca). Sol habitando ilha de vegetação inselberg.",SAMES08232,,auto
2021-03-24 17:08:41-03,UFES,SAMES,6932,PreservedSpecimen,Plantae,,,,Arecaceae,Syagrus,ruschiana,,Syagrus ruschiana,(Bondar) Glassman,"Ribeiro, M.",2019,07,11,,"Coelho,R.",404,,2014,05,02,,,Brasil,Espírito Santo,Nova Venécia,APA Pedra do Elefante.,-40.4006004333496,-18.710599899292,,,42400,,,,,,,,,,,,,SAMES06932,,auto
2021-04-20 15:47:15-03,IAC,IAC,37382,PreservedSpecimen,Plantae,Tracheophyta,Magnoliopsida,Arecales,Arecaceae,Syagrus,ruschiana,,Syagrus ruschiana,(Bondar) Glassman,H.Q.B. Fernandes,1988,12,09,,H.Q.B. Fernandes,2678,,1988,12,09,,,Brasil,Espírito Santo,Pancas,"estrada Pancas, Vila Verde, cerca 2 km da Sede Municipal",-40.8514,-19.225,-40.8514,-19.2250,,,,,,,,,,,,,"Estipe 8, a 40x90 cm comCicatrizes foliares agudas Fruto: Frtos verdes,Alaran/C/Epicarpo Fendido em Tres Quando maduro Ambiente de coleta: Ao sol, sobre rocha Nua (grande população) HÃ¡bito vegetativo: Arbusto, 3 m alt., folhas arqueadas <ll>dwc_commonname:</ll> Coco De Pedra",,,
2016-09-28 16:11:00-03,NY,NYBG,00568002,PreservedSpecimen,Plantae,Magnoliophyta,,Arecales,Arecaceae,Syagrus,ruschiana,,Syagrus ruschiana,,,,,,,L. R. Noblick,4838,,1992,03,10,,South America,Brazil,Espírito Santo,Pancas,3 km NW of town on the road Pancas/Vila Verde.,-40.87,-19.25,,,,,250,400,,,,packeted,,,,,<a href='http://sweetgum.nybg.org/science/vh/specimen_details.php?irn=193691' target='other'> <mi>dwc_moreinfo</mi></a>,NY00568002,NY00568002_01 NY00568002_02 NY00568002_03 NY00568002_04 NY00568002_05 NY00568002_06 NY00568002_07 NY00568002_08,
2016-09-30 22:29:00-03,NY,NYBG,2480152,PreservedSpecimen,Plantae,Magnoliophyta,,Arecales,Arecaceae,Syagrus,ruschiana,,Syagrus ruschiana,,,,,,,M. O. de O. Pellegrini,369,,2013,04,22,,South America,Brazil,Espírito Santo,Água Doce do Norte,Morro da torre de celular,-40.9853,-18.5697,,,,,624,,,,,sheet,,,,,<a href='http://sweetgum.nybg.org/science/vh/specimen_details.php?irn=2700133' target='other'> <mi>dwc_moreinfo</mi></a>,NY02480152,NY02480152_01,
2016-09-30 22:29:00-03,NY,NYBG,2480153,PreservedSpecimen,Plantae,Magnoliophyta,,Arecales,Arecaceae,Syagrus,ruschiana,,Syagrus ruschiana,,,,,,,M. O. de O. Pellegrini,369,,2013,04,22,,South America,Brazil,Espírito Santo,Água Doce do Norte,Morro da torre de celular,-40.9853,-18.5697,,,,,624,,,,,sheet,,,,,<a href='http://sweetgum.nybg.org/science/vh/specimen_details.php?irn=2700134' target='other'> <mi>dwc_moreinfo</mi></a>,NY02480153,NY02480153_01,
2021-06-17 11:42:28-03,CVRD,CVRD,6476,PreservedSpecimen,Plantae,Magnoliophyta,Liliopsida,Arecales,Arecaceae,Syagrus,ruschiana,,Syagrus ruschiana,(Bondar) Glassman,,,,,,"Folli, D.A.",3600,,2000,04,11,,América do Sul,BRASIL,ES,Linhares,Palmeto,-40.0722007751465,-19.3910999298096,,,48094,,,,,,,,,,,,<ll>dwc_commonname:</ll> Côco de pedra,CVRD006476,,auto
2020-01-22 14:50:14-03,USP,SPF,209517,PreservedSpecimen,Plantae,,,,Arecaceae,Syagrus,ruschiana,,Syagrus ruschiana,(Bondar) Glassman,"Medeiros, BAS",2013,12,02,,"Medeiros, BAS; Gudin, FM",110,,2013,12,02,,,Brasil,Espírito Santo,Águia Branca,À beira da rodovia ES-334.,-40.762328,-18.997903,-40.762328,-18.997903,,,159,159,,,,,,,,,,SPF00209517,,
2021-03-15 18:25:15-03,USP,SPF,209554,PreservedSpecimen,Plantae,,,,Arecaceae,Syagrus,ruschiana,,Syagrus ruschiana,(Bondar) Glassman,"Medeiros, BAS",2013,11,05,,"Medeiros, BAS; Fonseca, LHM",42,,2013,11,05,,,Brasil,Espírito Santo,Pancas,Inselberg à beira da rodovia ES-341.,-40.879767,-19.231667,-40.879767,-19.231667,,,285,285,,,,,,,,,"Caule cespitoso sobre rocha exposta. Folhas verdes, espata marrom externamente e amarelo-esverdeada internamente, inflorescência amarela. Frutos imaturos globosos, verdes. Mesma população que Medeiros 110.",SPF00209554,,
2015-07-02 14:42:03-03,JBP,HPL,11954,S,Plantae,,,,Arecaceae,Syagrus,ruschiana,,Syagrus ruschiana,,H. Lorenzi,2010,02,08,,"H. Lorenzi, K. Soares, T.B. Flores",6831,,2010,02,08,,,Brasil,MG,Teófilo Ottoni,Na beira da BR 418.,-41.5053,-17.8575,"41° 03#?#04,0 W","17° 52#?#23,4 S",62594,,318,318,,,,,,,,,,,,auto
2020-12-11 11:43:27-03,UFMG,BHCB,169243,PreservedSpecimen,Plantae,Monocotyledon,,,Arecaceae,Syagrus,ruschiana,,Syagrus ruschiana,(Bondar) Glassman,,2014,02,25,,"Paula, LFA de; Azevedo, L; Porembski, S",713,,2014,02,22,,Southern America,Brasil,Minas Gerais,Teófilo Otoni,"MG, Em ilha de vegetacao de afloramento granitico.",-41.241833,-17.7915,-41.241833,-17.7915,,,300,300,,,,,,,,,Palmeira de aprox. 5m. Folha de aprox. 2m. Frutos maduros laranja e frutos imaturos verdes.,,,
2020-12-11 11:43:27-03,UFMG,BHCB,169244,PreservedSpecimen,Plantae,Monocotyledon,,,Arecaceae,Syagrus,ruschiana,,Syagrus ruschiana,(Bondar) Glassman,,,,,,"Paula, LFA de; Azevedo, L; Porembski, S",714,,2014,02,22,,Southern America,Brasil,Minas Gerais,Teófilo Otoni,"Afloramento rochoso lado esquerdo MG-418, na estrada em direção ao vilarejo Brejão.",-41.241833,-17.7915,-41.241833,-17.7915,,,300,300,,,,,,,,,Palmeira de aprox. 5m. Folha de aprox. 2m. Frutos maduros laranja e frutos imaturos verdes.; Em ilha de vegetação de afloramento granítico.,BHCB050531,BHCB050531 BHCB050531_1 BHCB050531_2 BHCB050531_3 BHCB050531_4,
2020-07-23 11:58:19-03,CEPLAC,CEPEC,129835,PreservedSpecimen,Plantae,,,,Arecaceae,Syagrus,ruschiana,,Syagrus ruschiana,,L. Kollmann,,,,,P. H. Labiak,4685,,,,,,,Brasil,Espírito Santo,NOVA VENÉCIA,,-40.4006004333496,-18.710599899292,,,42400,,,,,,,,,,,,<ll>dwc_commonname:</ll>,,,auto
2020-07-23 11:58:19-03,CEPLAC,CEPEC,124409,PreservedSpecimen,Plantae,,,,Arecaceae,Syagrus,ruschiana,,Syagrus ruschiana,,C. N. Fraga,,,,,C. N. Fraga,2079,,,,,,,Brasil,Espírito Santo,NOVA VENÉCIA,,-40.4006004333496,-18.710599899292,,,42400,,,,,,,,,,,,<ll>dwc_commonname:</ll>,,,auto
2019-02-15 11:33:27-02,IPA,IPA,57336,S,Plantae,Plantae,,,Arecaceae,Syagrus,ruschiana,,Syagrus ruschiana,(Bondar) Glassman,,,,,,"Noblick, L.R.",5169,,1997,08,03,,Southern America,Brasil,Espirito Santo,Colatina,14 km N of the turn off for Baixo Guando and Aimores on the ES-080 just N of the Polícia Militar post.,-40.683333,-19.407778,-40.683333,-19.407778,,,200,500,,,,,,,,,"Palm clustering to 9 trunk with 1,5 - 2,5 m x 5-7cm trunk. Leaves 5-7in crown, spirally arranged and spreading. Androgynous inflorescence with 50 cm long by 1 x 0,5 cm diam. peduncle and 38 cm long rachis. Fruit reddish orange in colo",IPA0057336,,
2019-02-15 11:33:27-02,IPA,IPA,59148,S,Plantae,Plantae,,,Arecaceae,Syagrus,ruschiana,,Syagrus ruschiana,(Bondar) Glassman,,,,,,"Noblick, L.R.",5169,,1997,08,03,,Southern America,Brasil,Espirito Santo,Colatina,14 km N of the turn off for Baixo Guando and Aimores on the ES-080 just N of the Polícia Militar post.,-40.683333,-19.407778,-40.683333,-19.407778,,,200,500,,,,,,,,,"Palm clustering to 9 trunk with 1,5 - 2,5 m x 5-7cm trunk. Leaves 5-7in crown, spirally arranged and spreading. Androgynous inflorescence with 50 cm long by 1 x 0,5 cm diam. peduncle and 38 cm long rachis. Fruit reddish orange in colo",IPA0059148,,
2020-07-10 09:48:44-03,MBML,MBML-HERBARIO,26782,,Plantae,,,,Palmae,Syagrus,ruschiana,,Syagrus ruschiana,(Bondar) Glassman,H.Q.Boudet Fernandes/19-02-2008,,,,,"V. Demuner; L.F.S Magnago, T. Cruz, Elias Bausen e Alex",2195,,2006,04,25,,,Brasil,Espírito Santo,Águia Branca,"Córrego do Trinta (CEIER), Prop.: Alex Sandro",-40.648,-19.022833,"40W38'52,8","19S1'22,2",,,170,170,,,,,,,,,"Touceira 5 indivíduos 6m, inflorescência com botões femininos e flores masculinas amarelas. Ambiente rochoso.",MBML026782,,
2020-07-10 09:48:44-03,MBML,MBML-HERBARIO,27382,,Plantae,,,,Palmae,Syagrus,ruschiana,,Syagrus ruschiana,(Bondar) Glassman,H.Q.Boudet Fernandes/19-02-2008,,,,,"V. Demuner; L.F.S. Magnago, T. Cruz, Elias Bausen",2931,,2006,10,18,,,Brasil,Espírito Santo,Águia Branca,"Santa Luzia, prop.: Ciro Ferreira",-40.665556,-18.977778,40W39'56,18S58'40,,,170,170,,,,,,,,,"Multicaule 3m, botões florais, flores masculinas amarelas, odor agradável. Vegetação rupestre.",MBML027382,,
2020-07-10 09:48:44-03,MBML,MBML-HERBARIO,27883,,Plantae,,,,Palmae,Syagrus,ruschiana,,Syagrus ruschiana,(Bondar) Glassman,H.Q.Boudet Fernandes/19-02-2008,,,,,"L. F. S. Magnago; V. Demuner, T. Cruz e Elias Bausen",1134,,2006,07,26,,,Brasil,Espírito Santo,Águia Branca,"Pedra da Bandeira, Santa Luzia, prop.: Ciro Ferreira.",-40.665556,-18.977778,40W39'56,18S58'40,,,170,170,,,,,,,,,Multi-caule com 3m de alt. Botões florais amarelos. Vegetação rupestre.,MBML027883,,
2021-06-08 14:02:16-03,MBML,MBML-HERBARIO,30470,,Plantae,,,,Palmae,Syagrus,ruschiana,,Syagrus ruschiana,(Bondar) Glassman,V. Demuner 04/07/2007,2007,07,04,,"R.R. Vervloet; V. Demuner, E. Bausen, T. A. Cruz",2776,,2007,07,04,,,Brasil,Espírito Santo,Águia Branca,"Santa Luzia, Prop. Ciro Ferreira",-40.665556,-18.978056,40W39'56,18S58'41,,,170,170,,,,,,,,,"Planta com 3m, botões florais masculinos e femininos de cor amarelo.",MBML030470,,
2020-07-10 09:48:44-03,MBML,MBML-HERBARIO,33889,,Plantae,,,,Palmae,Syagrus,ruschiana,,Syagrus ruschiana,(Bondar) Glassman,L. Kollmann/11-11-2008,,,,,P. Labiak; et al,4685,,2008,02,18,,,Brasil,Espírito Santo,Nova Venécia,Área de Proteção Ambiental da Pedra do Elefante,-40.446389,-18.782778,40W26'47,18S46'58,,,,,,,,,,,,,"Estipite ca. 3m altura, isolados. Folhas ca. 2,5m compr. Flores creme. Rupicola. Material prensado em álcool.",MBML033889,,
2020-07-10 09:48:44-03,MBML,MBML-HERBARIO,34369,,Plantae,,,,Palmae,Syagrus,ruschiana,,Syagrus ruschiana,(Bondar) Glassman,,,,,,C. N. de Fraga; et al,2079,,2008,05,09,,,Brasil,Espírito Santo,Nova Venécia,Área de Proteção Ambiental da Pedra do Elefante,-40.483333,-18.8,40W28'60,18S48'0,,,,,,,,,,,,,,MBML034369,,
2021-06-08 14:02:16-03,MBML,MBML-HERBARIO,37227,,Plantae,,,,Palmae,Syagrus,ruschiana,,Syagrus ruschiana,(Bondar) Glassman,A. P. Fontana/27-abr-08,2008,04,27,,"A. P. Fontana; L. Kollmann, E. Leme, M. Zanoni, O. Ribeiro & N.F.B.Botelho",5056,,2008,04,27,,,Brasil,Espírito Santo,Água Doce do Norte,"Córrego Havaí, afloramento rochoso para torre de celular/rampa de voo livre",-40.993097,-18.575017,"40W59'35,15","18S34'30,06",,,,,,,,,,,,,"Arbusto, ca 3m. Rupícola no sol. Flores amarelas. Frutos verdes.",MBML037227,,
2020-07-10 09:48:44-03,MBML,MBML-HERBARIO,47444,,Plantae,,,,Palmae,Syagrus,ruschiana,,Syagrus ruschiana,(Bondar) Glassman,,,,,,A. M. Assis; K.F.O. Faria,1713,,2008,07,15,,,Brasil,Espírito Santo,Colatina,Jequitibá (Torre 45/2 - LT 230 Kv Mascarenhas x Verona),-40.637806,-19.233972,"40W38'16,1","19S14'2,3",,,,,,,,,,,,,Palmeira sem caule aparente. Folhas com 3 m compr. Bractea da inflor. Marrom. Frutos verdes. Floresta Estacional Semidecidual. Afloramento Rochoso,MBML047444,,
2020-09-14 16:46:06-03,MBML,MBML-HERBARIO,5447,,Plantae,,,,Palmae,Syagrus,ruschiana,,Syagrus ruschiana,(Bondar) Glassman,,,,,,H. Q. Boudet Fernandes,2685,,1988,12,09,,,Brasil,Espírito Santo,Colatina,"Colatina, estrada Colatina x Ângelo Freschiani, cerca de 3 km após a Ponte do Pancas. Cerca de 200 m/s.m.. Vegetação campestre em afloramento gneissico.",-40.681944,-19.403611,40W40'55,19S24'13,,,,,,,,,,,,,"Nome vulgar: coco de pedra. Arbustiva, cespitosa, até cerca de 3m (população). Estipe com cicatrizes foliares agudas. Folhas arqueadas. Folíolos pêndulos nos 2/3 distais e deflexos no 1/3 proximal. Espadice sub-ereta. Flores amarelas.",MBML005447,,
2020-09-14 16:46:06-03,MBML,MBML-HERBARIO,5448,,Plantae,,,,Palmae,Syagrus,ruschiana,,Syagrus ruschiana,(Bondar) Glassman,,,,,,H. Q. Boudet Fernandes,2678,,1988,12,09,,,Brasil,Espírito Santo,Pancas,"estrada Pancas x Vila Verde, a cerca de 2 Km da sede municipal. Serra Alto Mutum Preto. Cerca de 300 m/s.m.",-40.870278,-19.217778,40W52'13,19S13'4,,,,,,,,,,,,,"Nome vulgar: coco de pedra. Arbustiva 3m. Estipes 8, até 40 x 90cm com cicatrizes foliares agudas. Folhas arqueadas, 14 por estipe. Folíolos (aproximadamente dos 2/3 distais) pêndulos, os outros deflexos. Frutos verdes, alaranjados e c",MBML005448,,
2020-07-10 09:48:44-03,MBML,MBML-HERBARIO,5712,,Plantae,,,,Palmae,Syagrus,ruschiana,,Syagrus ruschiana,(Bondar) Glassman,H.Q.B. Fernandes/Set.1989,,,,,H. Q. Boudet Fernandes; et al,2796,,1989,09,07,,,Brasil,Espírito Santo,Nova Venécia,Serra de Baixo,-41.432778,-18.7825,41W25'58,18S46'57,,,,,,,,,,,,,"Arbustiva, 1,8m, cespitosa com 5 estipes até 7cm x 1,2m. Raque 1,1m, pecíolo com bainha 1m. Frutos verdes.",MBML005712,,
2020-09-14 16:46:06-03,MBML,MBML-HERBARIO,5816,,Plantae,,,,Palmae,Syagrus,ruschiana,,Syagrus ruschiana,(Bondar) Glassman,,,,,,H. Q. Boudet Fernandes; et al,2827,,1989,09,08,,,Brasil,Espírito Santo,Nova Venécia,"a 3 Km de Todos os Santos, lado esquedo, indo para Paulista. Altitude ca. 200 m. 18º37'S, 40º43'W. Vegetação rupestre com formações de moitas de arbustos.",-40.7175,-18.607222,40W43'3,18S36'26,,,,,,,,,,,,,"Arbustiva, cespitosa, até 3m. Estipe 2m x 11cm. Inflorescência amarelo esverdeada, intrafoliar, erete. Flores amarelas.",MBML005816,,
2020-07-10 09:48:44-03,MBML,MBML-HERBARIO,6326,,Plantae,,,,Palmae,Syagrus,ruschiana,,Syagrus ruschiana,(Bondar) Glassman,,,,,,L. R. Noblick; et al,4838,,1992,03,10,,,Brasil,Espírito Santo,Pancas,3 KM NW of town on the road Pancas/Vila Verde,-40.8513984680176,-19.2250003814697,,,32475,,,,,,,,,,,,"Palmeirinho is the common name. Clustered palm with 2-5m x 8-10cm trunk. 7-11 LEAVES in crown, spirally arranged and spreading. Leaf sheath plus petiole is 80-100cm long with a true leaf petiole only 18-30cm long with smooth margins an",MBML006326,,auto
2020-01-30 12:40:15-03,UFES,SAMES-CARPOTECA,90050,PreservedSpecimen,Plantae,,,,Arecaceae,Syagrus,ruschiana,,Syagrus ruschiana,(Bondar) Glassman,,,,,,"Pinto Junior,H.V.; W.S.Justiuno.;T.Sperandio.;Menezes,L.F.T.",410,,2018,03,22,,,Brasil,Espírito Santo,Vila Pavão,PEDRA DO VIADINHO.,-40.555833,-18.623056,40º33'21''W,18º37'23''S,,,,,,,,,,,,,"Folhas verdes, frutos verdes. Sol habitando ilha de vegetação inselberg. Exsicata SAMES 8232",SAMEScarpo90050,,
2020-01-30 12:40:15-03,UFES,SAMES-CARPOTECA,90051,PreservedSpecimen,Plantae,,,,Arecaceae,Syagrus,ruschiana,,Syagrus ruschiana,(Bondar) Glassman,,,,,,"Pinto Junior,H.V.; W.S.Justino.;T.Sperandio.",380,,2018,03,20,,,Brasil,Espírito Santo,Águia Branca,REGIÃOS DOS 3 PONTÕES DE ÁGUIA BRANCA.,-40.712222,-18.978611,40º42'44''W,18º58'43''S,,,,,,,,,,,,,"Palmeira com mais de 2 metros, frutos laranjas, sol, habitando ilha de vegetação em inselberg. Exsicata SAMES 8202",SAMEScarpo90051,,
