MODIFIED,INSTITUTIONCODE,COLLECTIONCODE,CATALOGNUMBER,BASISOFRECORD,KINGDOM,PHYLUM,CLASS,ORDER,FAMILY,GENUS,SPECIFICEPITHET,INFRASPECIFICEPITHET,SCIENTIFICNAME,SCIENTIFICNAMEAUTHORSHIP,IDENTIFIEDBY,YEARIDENTIFIED,MONTHIDENTIFIED,DAYIDENTIFIED,TYPESTATUS,RECORDEDBY,RECORDNUMBER,FIELDNUMBER,YEAR,MONTH,DAY,EVENTTIME,CONTINENTOCEAN,COUNTRY,STATEPROVINCE,COUNTY,LOCALITY,DECIMALLONGITUDE,DECIMALLATITUDE,VERBATIMLONGITUDE,VERBATIMLATITUDE,COORDINATEPRECISION,BOUNDINGBOX,MINIMUMELEVATIONINMETERS,MAXIMUMELEVATIONINMETERS,MINIMUMDEPTHINMETERS,MAXIMUMDEPTHINMETERS,SEX,PREPARATIONTYPE,INDIVIDUALCOUNT,PREVIOUSCATALOGNUMBER,RELATIONSHIPTYPE,RELATEDCATALOGITEM,OCCURRENCEREMARKS,BARCODE,IMAGECODE,GEOFLAG
2021-03-24 17:08:44-03,UFES,SAMES,1210,PreservedSpecimen,Plantae,,,,Bignoniaceae,Tabebuia,reticulata,,Tabebuia reticulata,A.H.Gentry,,,,,,"Pinto Junior, H.V.",201,,2015,09,28,,,Brasil,Espírito Santo,Águia Branca,Região dos Três Pontões de Águia Branca.,-40.7402992248535,-18.9831008911133,,,19701,,,,,,,,,,,,Arbusto habitando ilha de vegetação em alforamento granítico; folhas verde escuro; flores roxas com estames amarelos; sol pleno.,SAMES01210,,auto
2020-06-29 09:29:50-03,UFRRJ,RBR,3020,S,Plantae,,,,Bignoniaceae,Tabebuia,reticulata,,Tabebuia reticulata,A.H.Gentry,,,,,,A. Gentry,49657,,1985,01,18,,,Brasil,Minas Gerais,Além Paraíba,"'Estrada Além Paraíba - Leopoldina, Leopoldina - Além Paraíba highway, large igneus ''morros'' along road. 22 km N of Além Paraíba, alt. 340 m.21°40#?# S - 42°50#?# W'",-42.7043991088867,-21.8878002166748,,,24865,,,,,,,,,,,,,RBR00003020,RBR00003020,auto
2019-06-10 10:10:24-03,FZB-BH,BHZB,3097,S,Plantae,,,,Bignoniaceae,Tabebuia,reticulata,,Tabebuia reticulata,,M. Assis,2006,09,01,,"Andrade, I.R.",508,,2003,10,13,,,Brasil,MG,Pedra Azul,Bom Jardim,-41.2971992492676,-16.0053005218506,,,39993,,,,,,,,,,,,Endêmica da Caatinga afloramentos do estado de Minas Gerais (espécie Tipo RB 152386). <ll>dwc_commonname:</ll> Ipê de flor rosa,,,auto
2017-11-24 14:10:16-02,UFLA,ESAL,20122,S,Plantae,,,,Bignoniaceae,Tabebuia,reticulata,,Tabebuia reticulata,A.H.Gentry,R.M.Santos,,,,,"Santos, RM",s.n.,,,,,,,Brasil,Minas Gerais,Juvenilia,,-44.1603012084961,-14.2624998092651,0,0,40104,,,,,,,,,,,,árvore; ; ;; caatinga,,,auto
2021-03-15 18:26:08-03,USP,SPF,195089,PreservedSpecimen,Plantae,,,,Bignoniaceae,Tabebuia,reticulata,,Tabebuia reticulata,A.H.Gentry,"Almeida, RF",2010,,,,"Demuner, V",2588,,2006,07,12,,,Brasil,Espírito Santo,Colatina,"Alto Moacir, PropLalau.",-40.552923,-19.339071,-40.552923,-19.339071,,,250,550,,,,,,,,,"Arvoreta, 5 m, botões florais, flores roxas.; Ambiente rupestre",SPF00195089,,
2019-11-13 11:16:55-03,USP,SPF,229612,PreservedSpecimen,Plantae,,,,Bignoniaceae,Tabebuia,reticulata,,Tabebuia reticulata,A.H.Gentry,"Paula, LFA",2016,03,,,"Paula, LFA",916,,2016,03,15,,,Brasil,Espírito Santo,Vila Pavão,,-40.553611,-18.653333,-40.553611,-18.653333,,,173,173,,,,,,,,,,SPF00229612,,
2021-01-22 18:29:53-03,USP,SPF,233160,PreservedSpecimen,Plantae,,,,Bignoniaceae,Tabebuia,reticulata,,Tabebuia reticulata,A.H.Gentry,"Stehmann, JR",2013,02,,,"Teixeira, WA",s.n.,,2012,09,12,,,Brasil,Minas Gerais,Ponto dos Volantes,,-41.421111,-17.005833,-41.421111,-17.005833,,,,,,,,,,,,,,SPF00233160,,
2021-03-15 18:26:08-03,USP,SPF,194995,PreservedSpecimen,Plantae,,,,Bignoniaceae,Tabebuia,reticulata,,Tabebuia reticulata,A.H.Gentry,"Almeida, RF",2010,,,,"Kollmann, L",4344,,2001,08,14,,,Brasil,Espírito Santo,Santa Teresa,Toma Vento.,-40.6002998352051,-19.9356002807617,0,0,23813,,910,910,,,,,,,,,"Arbusto, 2,5 m alt. Flores vináceas.; Rupícola no sol.",SPF00194995,,auto
2021-05-18 10:43:21-03,UEFS,HUEFS,166595,PreservedSpecimen,Plantae,Angiospermae,Asteranae,Lamiales,Bignoniaceae,Tabebuia,reticulata,,Tabebuia reticulata,A.H.Gentry,F.S.Espírito-Santo,2011,08,,,"Harley, R.M.",56194,,2010,11,04,,,Brasil,Bahia,Contendas do Sincorá,"Na beira da estrada próximo a Contendas do Sincorá, na estrada de Sussuarana",-41.0410995483398,-13.7628002166748,,,27330,,,,,,,,,,,,Caatinga,HUEFS0166595,HUEFS0166595,auto
2021-05-18 10:43:21-03,UEFS,HUEFS,109771,PreservedSpecimen,Plantae,Angiospermae,Asteranae,Lamiales,Bignoniaceae,Tabebuia,reticulata,,Tabebuia reticulata,A.H.Gentry,A.R.Zuntini,2014,10,,,"Fontana, A.P.",1536,,2005,07,08,,,Brasil,Espírito Santo,Santa Teresa,"Vale do Canaã, afloramento rochoso com vegetação rupestre, próximo do terreno do Coqueto e Belumat.",-40.6002998352051,-19.9356002807617,,,23813,,,,,,,,,,,,,HUEFS0109771,HUEFS0109771,auto
2020-12-11 11:34:05-03,UFMG,BHCB,161995,PreservedSpecimen,Plantae,Dicotyledon,,,Bignoniaceae,Tabebuia,reticulata,,Tabebuia reticulata,A.H.Gentry,,2013,02,,,"Teixeira, WA",s.n.,,2012,09,12,,Southern America,Brasil,Minas Gerais,Ponto dos Volantes,,-41.421111,-17.005833,-41.421111,-17.005833,,,0,0,,,,,,,,,,,,
2020-12-11 11:34:05-03,UFMG,BHCB,163537,PreservedSpecimen,Plantae,Dicotyledon,,,Bignoniaceae,Tabebuia,reticulata,,Tabebuia reticulata,A.H.Gentry,,2012,04,01,,"Paula, LFA de; Paula, ALFA de; Paula, MA de",401,,2011,09,09,,Southern America,Brasil,Minas Gerais,Teófilo Otoni,"MG-418, Em ilha de vegetação de afloramento granitico.",-41.260944,-17.855972,-41.260944,-17.855972,,,560,560,,,,,,,,,"Arvore 3m. Flores roxas com gargante amarela, frutos imaturos verdes. Comum localmente nas varias ilhas de vegetação.",BHCB006856,,
2020-12-11 11:34:05-03,UFMG,BHCB,190501,PreservedSpecimen,Plantae,Dicotyledon,,,Bignoniaceae,Tabebuia,reticulata,,Tabebuia reticulata,A.H.Gentry,,2016,03,15,,"Paula, LFA de; Azevedo, LO; Forzza, RC",916,,2016,03,15,,Southern America,Brasil,Espírito Santo,Vila Pavão,Povoado de Figueira,-40.553611,-18.653333,-40.553611,-18.653333,,,173,173,,,,,,,,,Flores rosa escuro com false amarela. Alt.: 2m. Arbórea.; Em ilha de vegetação sobre inselberg.,BHCB190501,,
2020-12-11 11:34:05-03,UFMG,BHCB,64836,PreservedSpecimen,Plantae,Dicotyledon,,,Bignoniaceae,Tabebuia,reticulata,,Tabebuia reticulata,A.H.Gentry,,,,,,"Lombardi, JA; Dulith, JHA; Semir, J",4444,,2001,10,19,,Southern America,Brasil,Minas Gerais,Jaíba,Furados.,-43.859167,-15.210278,-43.859167,-15.210278,,,0,0,,,,,,,,,"Lageado, terreno argiloso. Arvoreta, ca. 3 m, folhas papiráceas, cálice avermelhado, corola lilás com garganta amarela, frutos imaturos verdes",,,
2021-06-26 01:36:14-03,UENF,HUENF,12448,PreservedSpecimen,Plantae,,,,Bignoniaceae,Tabebuia,reticulata,,Tabebuia reticulata,A.H.Gentry,D.R.Couto,2019,08,31,,H.B.M. Viana; D.R. Couto,144,,2019,08,31,,,Brasil,Rio de Janeiro,Campos dos Goytacazes,"Ibitioga, Morro do Itaóca. Vegetação sobre Afloramento rochoso (inselberg).",-41.4575,-21.791944,41º27'27''W,21º47'31''S,,,150,150,,,,,,,,,"Arbusto, rupícola, aprox. 4m de alt. Multiramificado com dap#?#s aproximados de 15cm. Flores do tipo campânula ode coloração rosea-vinácea com mácula amarela no interior da corola, expecificamente na pétala inferior. Flores de fragra",HUENF00013269,,
2021-02-09 10:12:20-03,UENF,HUENF,12000,PreservedSpecimen,Plantae,,,,Bignoniaceae,Tabebuia,reticulata,,Tabebuia reticulata,A.H.Gentry,D.R. Couto,2019,09,03,,D.R. Couto; H. Viana,4679,,2019,08,31,,,Brasil,Rio de Janeiro,Campos dos Goytacazes,"Ibitioca. Morro do Itaoca, afloramento rochoso.",-41.455,-21.7925,41º27'18''W,21º47'33''S,,,240,240,,,,,,,,,"Arvoreta rupícola, heliófila, ca. 4 m altura. Lâmina verde, corola lilás com fauce amarela.",HUENF00012819,,
2020-11-19 14:06:03-03,Unimontes,MCMG,443,PreservedSpecimen,Plantae,,,,Bignoniaceae,Tabebuia,reticulata,,Tabebuia reticulata,A.H.Gentry.,"Santos,R.M.",2011,0,,,"Rodrigues,R.",,,2011,,,,,Brasil,Minas Gerais,Jaíba,Reserva Biológica de Jaíba,-43.6744003295898,-15.3382997512817,,,47016,,,,,,,,,,,,,,,auto
2020-07-10 09:44:10-03,MBML,MBML-HERBARIO,13194,,Plantae,,,,Bignoniaceae,Tabebuia,reticulata,,Tabebuia reticulata,A.H.Gentry,R.F. Almeida/20-01-2010,,,,,V. Demuner; et al,1341,,2000,08,03,,,Brasil,Espírito Santo,Santa Teresa,São João de Petrópolis,-40.678056,-19.814167,40W40'41,19S48'51,,,,,,,,,,,,,"Arbusto 4m, botões florais, flores com corola roxa (vinosas), com listras amarelas no interior. Sobre rocha, aberto ensolarado.",MBML013194,MBML013194,
2020-07-10 09:44:10-03,MBML,MBML-HERBARIO,14958,,Plantae,,,,Bignoniaceae,Tabebuia,reticulata,,Tabebuia reticulata,A.H.Gentry,R.F. Almeida/20-01-2010,,,,,L. Kollmann; et al,4344,,2001,08,14,,,Brasil,Espírito Santo,Santa Teresa,Toma Vento,-40.806944,-19.910833,40W48'25,19S54'39,,,,,,,,,,,,,"Arbusto 2,5m rupícola no sol. Flores vináceas.",MBML014958,MBML014958_1 MBML014958_2,
2020-07-10 09:44:10-03,MBML,MBML-HERBARIO,24858,,Plantae,,,,Bignoniaceae,Tabebuia,reticulata,,Tabebuia reticulata,A.H.Gentry,R.F. Almeida/20-01-2010,,,,,L. Kollmann; et al,8341,,2005,09,23,,,Brasil,Espírito Santo,Santa Teresa,Cachoeira do Strut,-40.731389,-19.833333,40W43'53,19S50'0,,,,,,,,,,,,,"Arvoreto 2m, rupestre no sol. Flores lilás com 2 listras amarelas.",MBML024858,MBML024858,
2020-07-10 09:44:10-03,MBML,MBML-HERBARIO,25381,,Plantae,,,,Bignoniaceae,Tabebuia,reticulata,,Tabebuia reticulata,A.H.Gentry,M. Kaehler/20-07-2007,,,,,A. P. Fontana; et al,1536,,2005,07,08,,,Brasil,Espírito Santo,Santa Teresa,Vale do Canaã,-40.601944,-19.906111,40W36'7,19S54'22,,,,,,,,,,,,,"Arbusto 3m, flores roxas.",MBML025381,MBML025381,
2020-07-10 09:44:10-03,MBML,MBML-HERBARIO,27244,,Plantae,,,,Bignoniaceae,Tabebuia,reticulata,,Tabebuia reticulata,A.H.Gentry,R.F. Almeida/20-01-2010,,,,,"V. Demuner; L.F.S Magnago, T. Cruz e Elias Bausen",2588,,2006,07,12,,,Brasil,Espírito Santo,Colatina,"Alto Moacir, Prop.: Lalau",-40.558611,-19.339167,40W33'31,19S20'21,,,270,270,,,,,,,,,"Arvoreta 5m, botões florais, flores roxas. Ambiente rupestre.",MBML027244,MBML027244,
2020-07-10 09:44:10-03,MBML,MBML-HERBARIO,27318,,Plantae,,,,Bignoniaceae,Tabebuia,reticulata,,Tabebuia reticulata,A.H.Gentry,R.F. Almeida/20-01-2010,,,,,"V. Demuner; L.F.S Magnago, T. Cruz e Elias Bausen",2601,,2006,07,13,,,Brasil,Espírito Santo,Marilândia,"Liberdade (Água.Viva, Pedra do Cruzeiro), Prop.: Aguilar A. Lovucini",-40.551111,-19.348333,40W33'4,19S20'54,,,150,150,,,,,,,,,"Arbusto 1m, botões florais, flores roxas. Afloramento rochso, leve camada de solo.",MBML027318,MBML027318 MBML027318_1,
2020-07-10 09:44:10-03,MBML,MBML-HERBARIO,28711,,Plantae,,,,Bignoniaceae,Tabebuia,reticulata,,Tabebuia reticulata,A.H.Gentry,R.F. Almeida/20-01-2010,,,,,"L. F. S. Magnago; V. Demuner, T. Cruz, Elias Bausen",1354,,2006,09,06,,,Brasil,Espírito Santo,Águia Branca,"Rochedo, área de afloramento rochoso, propr.: Ailton Corteleti.",-40.798611,-18.944167,40W47'55,18S56'39,,,300,300,,,,,,,,,Arbusto 2m de alt. Flor lilás. Vegetação rupestre.,MBML028711,MBML028711,
2020-07-10 09:44:10-03,MBML,MBML-HERBARIO,30824,,Plantae,,,,Bignoniaceae,Tabebuia,reticulata,,Tabebuia reticulata,A.H.Gentry,R.F. Almeida/20-01-2010,,,,,"L. Kollmann; A.P. Fontana, W. Saslawski & A Saslawski",9847,,2007,07,05,,,Brasil,Espírito Santo,São Roque do Canaã,Pedra dos Três Carneiros,-40.739444,-19.760833,40W44'22,19S45'39,,,600,600,,,,,,,,,Flores púrpuras amarelas no centro da corola. Fruto verde.,MBML030824,MBML030824,
2020-07-10 09:44:10-03,MBML,MBML-HERBARIO,31223,,Plantae,,,,Bignoniaceae,Tabebuia,reticulata,,Tabebuia reticulata,A.H.Gentry,R.F. Almeida/20-01-2010,,,,,"L. Kollmann; A.P. Fontana, P. Labiak & F. B. Matos",9910,,2007,07,16,,,Brasil,Espírito Santo,Afonso Cláudio,Três Pontões,-41.046389,-20.076667,41W2'47,20S4'36,,,,,,,,,,,,,"Arvoreto 3,5m no sol. Rupícola, flores lilás escuro.",MBML031223,MBML031223,
2020-07-10 09:44:10-03,MBML,MBML-HERBARIO,31702,,Plantae,,,,Bignoniaceae,Tabebuia,reticulata,,Tabebuia reticulata,A.H. Gentry,R.F. Almeida/20-01-2010,,,,,"R.R. Vervloet; V. Demuner, E. Bausen, T. A. Cruz",3472,,2007,09,12,,,Brasil,Espírito Santo,Marilândia,Pedra do Cruzeiro. Aguilar,-40.551111,-19.348333,40W33'4,19S20'54,,,200,200,,,,,,,,,"Arbusto 2m, flores de cor vinho, frutos jóvens. Ambiente rupestre.",MBML031702,MBML031702,
2020-07-10 09:44:10-03,MBML,MBML-HERBARIO,39321,,Plantae,,,,Bignoniaceae,Tabebuia,reticulata,,Tabebuia reticulata,A.H. Gentry,R.F. Almeida/20-01-2010,,,,,L. Kollmann; & E. Leme,11822,,2009,09,12,,,Brasil,Espírito Santo,Boa Esperança,Pedra da Botelha,-40.368889,-18.448056,40W22'8,18S26'53,,,,,,,,,,,,,"Arvoreto 4 m, flores magentas",MBML039321,MBML039321,
2020-07-10 09:44:10-03,MBML,MBML-HERBARIO,39339,,Plantae,,,,Bignoniaceae,Tabebuia,reticulata,,Tabebuia reticulata,A.H. Gentry,R.F. Almeida/20-01-2010,,,,,L. Kollmann; & E. Leme,11793,,2009,09,10,,,Brasil,Espírito Santo,Barra de São Francisco,estrada Ecopóranga/Barra de São Francisco,-40.816944,-18.539167,40W49'1,18S32'21,,,,,,,,,,,,,"Arvoreto 5 m rupícola ao sol, flores grenas de centro amarelado.",MBML039339,MBML039339_1 MBML039339_2,
2020-07-10 09:44:10-03,MBML,MBML-HERBARIO,44936,,Plantae,,,,Bignoniaceae,Tabebuia,reticulata,,Tabebuia reticulata,A. Gentry,L. Kollmann,,,,,L. Kollmann; A.P.Fontana,12495,,2012,09,25,,,Brasil,Espírito Santo,Mantenópolis,São José,-41.088611,-18.899444,41W5'19,18S53'58,,,950,950,,,,,,,,,"Arvoreto 3m. Rupícola ao sol, flores vináceas",MBML044936,MBML044936,
2020-07-10 09:44:10-03,MBML,MBML-HERBARIO,50694,,Plantae,,,,Bignoniaceae,Tabebuia,reticulata,,Tabebuia reticulata,A.Gentry,L. Kollmann,,,,,L. Kollmann,12443,,2012,09,04,,,Brasil,Espírito Santo,Santa Teresa,Alto Rio Perdido,-40.739722,-19.826944,40W44'23,19S49'37,,,700,700,,,,,,,,,"Arvoreto 4 m rupicola ao sol, flores vinaceas.",MBML050694,MBML050694,
2021-01-19 14:30:51-03,MBML,MBML-HERBARIO,54415,,Plantae,,,,Bignoniaceae,Tabebuia,reticulata,,Tabebuia reticulata,A.H. Gentry,"Gonella, P.M., 2020",,,,,"P.M. Gonella; T.H. Condez, C.N. Fraga & D.R. Couto",1115,,2019,10,16,,,Brasil,Espírito Santo,Vila Pavão,"Morro do Cruzeiro, inselberg com antena no topo no centro da cidade.",-40.604944,-18.62375,"40W36'17,8","18S37'25,5",,,190,190,,,,,,,,,Inselberg. Ilhas de vegetação sobre o afloramento rochoso. Arbusto c. 70 cm alt. Flores púrpura com manchas amarelas.,MBML054415,MBML054415,
