MODIFIED,INSTITUTIONCODE,COLLECTIONCODE,CATALOGNUMBER,BASISOFRECORD,KINGDOM,PHYLUM,CLASS,ORDER,FAMILY,GENUS,SPECIFICEPITHET,INFRASPECIFICEPITHET,SCIENTIFICNAME,SCIENTIFICNAMEAUTHORSHIP,IDENTIFIEDBY,YEARIDENTIFIED,MONTHIDENTIFIED,DAYIDENTIFIED,TYPESTATUS,RECORDEDBY,RECORDNUMBER,FIELDNUMBER,YEAR,MONTH,DAY,EVENTTIME,CONTINENTOCEAN,COUNTRY,STATEPROVINCE,COUNTY,LOCALITY,DECIMALLONGITUDE,DECIMALLATITUDE,VERBATIMLONGITUDE,VERBATIMLATITUDE,COORDINATEPRECISION,BOUNDINGBOX,MINIMUMELEVATIONINMETERS,MAXIMUMELEVATIONINMETERS,MINIMUMDEPTHINMETERS,MAXIMUMDEPTHINMETERS,SEX,PREPARATIONTYPE,INDIVIDUALCOUNT,PREVIOUSCATALOGNUMBER,RELATIONSHIPTYPE,RELATEDCATALOGITEM,OCCURRENCEREMARKS,BARCODE,IMAGECODE,GEOFLAG
2021-03-24 17:10:06-03,UFES,SAMES,6203,PreservedSpecimen,Plantae,,,,Velloziaceae,Vellozia,variegata,,Vellozia variegata,Goethart & Henrard,,,,,,"Pinto Juniro,H.V.; Cruz,G.P.R.;Justino,W.S.",274,,2016,05,26,,,Brasil,Espírito Santo,Castelo,Mirante do Parque.,-41.184700012207,-20.6035995483398,-410908333.0,-205111111.0,23588,,,,,,,,,,,,Folhas verdes; flores roxas. Habitat: Ilha de vegetação em afloramento rochoso. Habito: Herbáceo,SAMES06203,,auto
2021-03-24 17:10:06-03,UFES,SAMES,1156,PreservedSpecimen,Plantae,,,,Velloziaceae,Vellozia,variegata,,Vellozia variegata,Goethart & Henrard,,,,,,"Pinto Junior, H.V.; Justino, W.S.",207,,2015,12,04,,,Brasil,Espírito Santo,Mimoso do Sul,Conceição do Muqui. Pedra de pontões.,-41.3664016723633,-21.0641994476318,,,29430,,,,,,,,,,,,"Arbusto habitando afloramento granítico; folhas verdes; flores roxas, estames amarelos; abuntante; sol;.",SAMES01156,,auto
2021-03-24 17:10:06-03,UFES,SAMES,1680,PreservedSpecimen,Plantae,,,,Velloziaceae,Vellozia,variegata,,Vellozia variegata,Goethart & Henrard,,,,,,"Pinto Junior, H.V.; Covre, C.",236,,2016,03,21,,,Brasil,Espírito Santo,Nova Venécia,Pedra do Elefante. Vertente leste da Pedra do Elefante.,-40.4006004333496,-18.710599899292,,,42400,,,,,,,,,,,,Arbusto habitando ilha de vegetação em afloramento rochoso; folhas verdes; flores roxas com estames amarelos; abundante.,SAMES01680,,auto
2018-03-08 09:13:18-03,ASU,ASU-PLANTS,ASU0014871,PreservedSpecimen,Plantae,Magnoliophyta,,Pandanales,Zosteraceae,Vellozia,variegata,,Vellozia variegata,Goethart & Henrard,R. M. Silva & N. Menezes,,,,,G. Hatschbach; J. M. Silva,49961,,1985,10,19,,,Brazil,Espirito Santo,,pedra Azul (mun.Domingos Martina),-40.95,-20.433333,,,,,,,,,,,,,,,"Ramosa, 1 m, pétalas lilas anteras amarelas. Campo rupestre, paradoes, rochosos.",,,
2021-06-30 13:28:55-03,MBM,MBM,302085,S,Plantae,,,,Velloziaceae,Vellozia,variegata,,Vellozia variegata,Goethart & Henrard,"Mello-Silva, R.",2004,,,,"Mello-Silva, R.; Forzza, R.C.; Temponi, L.G.; Calió, M.F.A.; Forzza, R.C.; Temponi, L.G.; Calió, M.F.A.",2644,,2004,06,17,,Southern America,Brazil,Rio de Janeiro,Santa Maria Madalena,"Morro da Torre, No perímetro urbano",-42.0175,-21.9675,-42.0175,-21.9675,,,1004,1004,,,,,,,,,"Grandes populações na rochas expostas. Indivíduos até 50 cm de altura. Folhas espirotrísticas, retas. Frutos maduros castanhos.; Encosta do alto do morro. Afloramentos rochosos com Alcantarea, Pitcairnia encholorioides (Bromeliaceae)",MBM302085,MBM302085,
2021-06-30 13:28:55-03,MBM,MBM,321077,S,Plantae,,,,Velloziaceae,Vellozia,variegata,,Vellozia variegata,Goethart & Henrard,"Mello-Silva, R.",,,,,"Jardim, J.G.; Aguiar, C.; Sant'Ana, S.C.; Juchum, F.; Aguiar, C.; Sant'Ana, S.C.; Juchum, F.",2812,,2000,02,24,,Southern America,Brazil,Bahia,Santa Terezinha,"14,5 km na rodovia Elísio Medrado/Sta. Teresinha. Torre da Embratel, ca. 7 km do Distrito de Pedra Branca. Serra da Giboia",-39.475833,-12.853611,-39.475833,-12.853611,,,,,,,,,,,,,"Subarbuso ca. 60 cm alt. Folhas verdes concolores. Flores com corola lilás. Frutos imatuos verdes, ferrugíneos.; Campos de Altitude.",MBM321077,MBM321077,
2021-06-30 13:28:55-03,MBM,MBM,415190,S,Plantae,,,,Velloziaceae,Vellozia,variegata,,Vellozia variegata,Goethart & Henrard,"Völtz, R.R.",2018,11,26,,"Völtz, R.R.; Brotto, M.L.; Brotto, M.L.",1972,,2015,03,30,,Southern America,Brazil,Rio de Janeiro,São Fidélis,"Parque Estadual do Desengano, Serra Itacolomi, morro Pedra do Macaco",-41.8675,-21.848056,-41.8675,-21.848056,,,1485,1485,,,,,,,,,"Subarbusto 0,3 m alt. crescendo sobre rochas; flores azuladas; fisionomia herbácea de topo de morro.; Refúgio Vegetacional Altomontano.",MBM415190,MBM415190,
2021-06-30 13:28:55-03,MBM,MBM,158745,S,Plantae,,,,Velloziaceae,Vellozia,variegata,,Vellozia variegata,Goethart & Henrard,"Queiróz, L.P. de",,,,,"Queiróz, L.P. de; et al.; et al.",2947,,,,,,Southern America,Brazil,Bahia,Castro Alves,Serra da Jibóia,-39.4282989501953,-12.7656002044678,0,0,26883,,,,,,,,,,,,,MBM158745,MBM158745,auto
2021-06-30 13:28:55-03,MBM,MBM,84993,S,Plantae,,,,Velloziaceae,Vellozia,variegata,,Vellozia variegata,Goethart & Henrard,"Mello-Silva, R.",,,,,"Hatschbach, G.; et al.; et al.",46886,,,,,,Southern America,Brazil,Espírito Santo,Domingos Martins,Pedra Azul,-40.6591987609863,-20.3633003234863,0,0,48150,,,,,,,,,,,,,MBM084993,MBM084993,auto
2021-06-30 13:28:55-03,MBM,MBM,103562,S,Plantae,,,,Velloziaceae,Vellozia,variegata,,Vellozia variegata,Goethart & Henrard,"Mello-Silva, R.; Menezes, N.L.",,,,,"Hatschbach, G.; Silva, J.M.; Silva, J.M.",49961,,,,,,Southern America,Brazil,Espírito Santo,Domingos Martins,Pedra Azul,-40.6591987609863,-20.3633003234863,0,0,48150,,,,,,,,,,,,,MBM103562,MBM103562,auto
2020-10-01 14:26:22-03,JBB,HEPH,5702,S,Plantae,Monocotyledon,,Pandanales,Velloziaceae,Vellozia,variegata,,Vellozia variegata,Goethart & Henrard,"Mello-Silva, R",1986,,,,"Hatschbach, G",49961,,1986,06,18,,Southern America,Brasil,Espírito Santo,Domingos Martins,Pedra Azul,-40.6591987609863,-20.3633003234863,0,0,48150,,,,,,,,,,,,,,,auto
2021-02-11 17:21:59-03,UFPR,UPCB,94745,PreservedSpecimen,Plantae,,,,Velloziaceae,Vellozia,variegata,,Vellozia variegata,,,,,,,"Forzza, R.C. | Amorim, A.M. | Paixão, J.L. | Gomes, L.C.J.",5191,,2008,07,17,,,Brasil,Espírito Santo,Nova Venécia,Área de Proteção Ambiental da Pedra do Elefante,-40.443889,-18.776944,-40.443889,-18.776944,,,400,400,,,,,,,,,"Inselbergue. Rupícola, 20-50 cm alt., formando grande população. Frutos castanhos",UPCB0043176,,
2019-06-10 10:11:47-03,FZB-BH,BHZB,11020,S,Plantae,,,,Velloziaceae,Vellozia Cf.,variegata,,Vellozia Cf. variegata,,,,,,,"Soares, K.P.",,,2016,01,07,,,Brasil,MG,Diamantina,Trecho rod. entre Diamantina /Milho Verde,-43.6002998352051,-18.2493991851807,,,101169,,,,,,,,,,,,Com duplicata,,,auto
2021-06-13 16:41:00-03,NY,NYBG,01093061,PreservedSpecimen,Plantae,Magnoliophyta,,Pandanales,Velloziaceae,Vellozia,variegata,,Vellozia variegata,Goethart & Henrard,R. de Mello-Silva,,,,,R. de Mello-Silva,2644,,2004,06,17,,South America,Brazil,Rio de Janeiro,Santa Maria Madalena,Morro da Torre. No perímetro urbano. Encostas do alto do morro.,-42.0175,-21.9675,,,,,1004,1004,,,,sheet,,,,,<a href='http://sweetgum.nybg.org/science/vh/specimen_details.php?irn=1246920' target='other'> <mi>dwc_moreinfo</mi></a>,NY01093061,NY01093061_01,
2021-06-13 16:41:00-03,NY,NYBG,02641804,PreservedSpecimen,Plantae,Magnoliophyta,,Pandanales,Velloziaceae,Vellozia,variegata,,Vellozia variegata,Goethart & Henrard,,,,,,R. C. Forzza,5442,,2009,01,21,,South America,Brazil,Espírito Santo,Castelo,Trilha para o Foninho. Floresta Ombrófila Densa Altomontana com inselbergues. Parque Estadual do Forno Grande,-41.083611,-20.516111,,,,,,,,,,sheet,,,,,<a href='http://sweetgum.nybg.org/science/vh/specimen_details.php?irn=2948425' target='other'> <mi>dwc_moreinfo</mi></a>,NY02641804,NY02641804_01,
2021-06-13 16:41:00-03,NY,NYBG,1181801,PreservedSpecimen,Plantae,Magnoliophyta,,Pandanales,Velloziaceae,Vellozia,variegata,,Vellozia variegata,Goethart & Henrard,A. P. Fontana,,,,,A. P. Fontana,4854,,2008,02,19,,South America,Brazil,Espírito Santo,Nova Venécia,Área de Proteção Ambiental da Pedra do Elefante. Inselbergue.,-40.4625,-18.7669,,,,,402,653,,,,sheet,,,,,<a href='http://sweetgum.nybg.org/science/vh/specimen_details.php?irn=1387492' target='other'> <mi>dwc_moreinfo</mi></a>,NY01181801,NY01181801_01,
2021-06-13 16:41:00-03,NY,NYBG,376260,PreservedSpecimen,Plantae,Magnoliophyta,,Pandanales,Velloziaceae,Vellozia,variegata,,Vellozia variegata,Goethart & Henrard,R. de Mello-Silva; N. L. de Menezes,,,,,G. G. Hatschbach,49961,,1985,10,19,,South America,Brazil,Espírito Santo,Domingos Martins,Pedra Azul,-41.008089,-20.436427,,,,,,,,,,sheet,,,,,<a href='http://sweetgum.nybg.org/science/vh/specimen_details.php?irn=186231' target='other'> <mi>dwc_moreinfo</mi></a>,NY00376260,NY00376260_01,
2021-06-13 16:41:00-03,NY,NYBG,776982,PreservedSpecimen,Plantae,Magnoliophyta,,Pandanales,Velloziaceae,Vellozia,variegata,,Vellozia variegata,Goethart & Henrard,R. de Mello-Silva,,,,,J. G. Jardim,2812,,2000,02,24,,South America,Brazil,Bahia,Santa Teresinha,"Santa Teresina: 14.5 km na rod. Elísio Medrado/Sta. Teresina. Torre da Embratel, ca. 7 km do Distrito de Pedra Branca. Serra da Giboia",-39.4758,-12.8536,,,,,750,750,,,,sheet,,,,,<a href='http://sweetgum.nybg.org/science/vh/specimen_details.php?irn=186232' target='other'> <mi>dwc_moreinfo</mi></a>,NY00776982,NY00776982_01,
2021-06-25 18:21:57-03,UFV,VIC,52671,PreservedSpecimen,Plantae,,,,Velloziaceae,Vellozia,variegata,,Vellozia variegata,Goethart & Henrard,"Junior, H.V.P.",2019,04,02,,"Junior, H.V.P.",467,,2019,03,18,,,Brasil,Espírito Santo,Brejetuba,Pedra do Submarino,-41.2902984619141,-20.1460990905762,0,0,23265,,,,,,,,,,,,"Cerca de 1,2m, folhas verdes, frutos passados capsulares, sol, abundante.",VIC052671,VIC052671,auto
2021-06-25 18:21:56-03,UFV,VIC,020809,PreservedSpecimen,Plantae,,,,Velloziaceae,Vellozia,variegata,,Vellozia variegata,Goethart & Henrard,,,,,,"Valente, G.E.; Costa, C.A. da",1633,,2005,02,11,,,Brasil,Minas Gerais,Araponga,"PESB, Serra das 3 cabeças,totem deitado.",-42.5208015441895,-20.6667003631592,0,0,16385,,,,,,,,,,,,"Planta rupícola, heliófila, sobre afloramento rochoso granitoide,coletada em platô do Totem deitado, flor de corola lilás.",VIC020809,VIC020809,auto
2021-06-25 18:21:56-03,UFV,VIC,020731,PreservedSpecimen,Plantae,,,,Velloziaceae,Vellozia,variegata,,Vellozia variegata,Goethart & Henrard,,,,,,"Valente, G.E.; et al.",1625,,2004,12,03,,,Brasil,Minas Gerais,Araponga,"PESB, Serra das 3 cabeças,totem deitado.Alt.1722 m.",-42.5208015441895,-20.6667003631592,0,0,16385,,,,,,,,,,,,"Planta variando de 20 a 30 cm de altura, em afloramento granitoide rochoso, cálice verde de pontinhos nigrescentes, corola lilás, anteras e estigma amarelos.",VIC020731,VIC020731,auto
2021-06-25 18:21:56-03,UFV,VIC,025106,PreservedSpecimen,Plantae,,,,Velloziaceae,Vellozia,variegata,,Vellozia variegata,Goethart & Henrard,,,,,,"Valente, G.E.; Caiafa, A.N.",577,,2000,09,16,,,Brasil,Minas Gerais,Araponga,"PESB, Serra das cabeças,1700 m de altitude, platô da serra.",-42.5208015441895,-20.6667003631592,0,0,16385,,,,,,,,,,,,"Rupicola de cerca de 25 cms de altura, crescendo em pequenas touceiras, espalhada sobre laje de pedra,exposta ao sol em solo raso úmido, muito freguente no local de coleta,com resto de fruto velho.",VIC025106,VIC025106,auto
2021-06-25 18:21:56-03,UFV,VIC,025578,PreservedSpecimen,Plantae,,,,Velloziaceae,Vellozia,variegata,,Vellozia variegata,Goethart & Henrard,,,,,,"Caiafa, A.N.",039,,2001,01,16,,,Brasil,Minas Gerais,Araponga,"PESB Serra das cabeças, 3° cabeça.",-42.5208015441895,-20.6667003631592,0,0,16385,,,,,,,,,,,,"Erva de ca de 0.7 m de altura,portando flores roxas, crescendo sobre rocha nua ou em manchas de solo pouco profundas sobre afloramento de rocha granitoide.",VIC025578,VIC025578,auto
2021-06-25 18:21:56-03,UFV,VIC,025579,PreservedSpecimen,Plantae,,,,Velloziaceae,Vellozia,variegata,,Vellozia variegata,Goethart & Henrard,,,,,,"Caiafa, A.N.",040,,2001,01,16,,,Brasil,Minas Gerais,Araponga,"PESB Serra das cabeças, 3° cabeça.",-42.5208015441895,-20.6667003631592,0,0,16385,,,,,,,,,,,,"Erva de ca de 0.7 m de altura,portando flores roxas, crescendo sobre rocha nua ou em manchas de solo pouco profundas sobre afloramento de rocha granitoide.",VIC025579,VIC025579,auto
2021-06-25 18:21:57-03,UFV,VIC,025580,PreservedSpecimen,Plantae,,,,Velloziaceae,Vellozia,variegata,,Vellozia variegata,Goethart & Henrard,,,,,,"Caiafa, A.N.",041,,2001,01,16,,,Brasil,Minas Gerais,Araponga,"PESB Serra das cabeças, 3° cabeça.",-42.5208015441895,-20.6667003631592,0,0,16385,,,,,,,,,,,,"Erva de ca de 0.7 m de altura,portando flores roxas, crescendo sobre rocha nua ou em manchas de solo pouco profundas sobre afloramento de rocha granitoide.",VIC025580,VIC025580,auto
2021-06-25 18:21:57-03,UFV,VIC,027758,PreservedSpecimen,Plantae,,,,Velloziaceae,Vellozia,variegata,,Vellozia variegata,Goethart & Henrard,,,,,,"Valente, G.E.; Batista, M.L.",1364,,2003,06,28,,,Brasil,Minas Gerais,Araponga,"PESB, Serra das cabeças,platô da serra,alt.1723 m.",-42.5208015441895,-20.6667003631592,0,0,16385,,,,,,,,,,,,"Planta de ca de 30 cm, crescendo em mancha de solo raso úmido, sobre afloramento rochoso granitoide, portando frutos de coloração marrom.",VIC027758,VIC027758,auto
2021-06-25 18:21:56-03,UFV,VIC,025413,PreservedSpecimen,Plantae,,,,Velloziaceae,Vellozia,variegata,,Vellozia variegata,Goethart & Henrard,,,,,,"Valente, G.E.; et al.",632,,2001,02,14,,,Brasil,Minas Gerais,Araponga,"PESB, Serra das cabeças,platô da serra,alt.1723 m.",-42.5208015441895,-20.6667003631592,0,0,16385,,,,,,,,,,,,"Planta de ca de 35 cm de altura,crescendo a pleno sol, solo raso, sobre lage de pedra, flor lilás, filetes lilases, anteras e estigma amarelos.",VIC025413,VIC025413,auto
2021-06-25 18:21:57-03,UFV,VIC,038114,PreservedSpecimen,Plantae,,,,Velloziaceae,Vellozia,variegata,,Vellozia variegata,Goethart & Henrard,,,,,,"Tinti, B.V.",s.n.,,2010,04,23,,,Brasil,Minas Gerais,Fervedouro,"Parque Estadual da Serra do Brigadeiro, Pedra do pato.",-42.2789001464844,-20.7255992889404,0,0,20038,,,,,,,,,,,,"Arbustiva de campo rupestre de velósia, pétalas rochas.",VIC038114,VIC038114,auto
2020-11-03 16:40:26-03,UFES,VIES,25353,S,Plantae,,,,Velloziaceae,Vellozia,variegata,,Vellozia variegata,Goethart & Henrard,C.A. Ferreira Jr.,2020,09,22,,"Freitas, J.; Silva, L.A.; Alves-Araújo, A.",269,,2014,09,25,,,Brasil,Espírito Santo,Água Doce do Norte,Estrada para Torre da Vivo.,-40.995833,-18.571944,40º59'45''W,18º34'19''S,,,,,,,,,,,,,,VIES025353,VIES025353,
2020-01-20 11:05:56-03,UFES,VIES,46338,S,Plantae,,,,Velloziaceae,Vellozia,variegata,,Vellozia variegata,Goethart & Henrard,,,,,,"Assis, A.M.; Turma Biologia de Vasculares ESFA",4878,,2013,03,23,,,Brasil,Espírito Santo,Itarana,Pedra da Onça.,-40.815,-19.895278,40º48'54''W,19º53'43''S,,,900,900,,,,,,,,,,VIES046338,,
2020-04-27 16:11:50-03,UFES,VIES,20357,S,Plantae,,,,Velloziaceae,Vellozia,variegata,,Vellozia variegata,Goethart & Henrard,"Couto, D.R.",2012,07,03,,"Dias, H.M.; Silva, A.E.",529,,2010,12,16,,,Brasil,Espírito Santo,Jerônimo Monteiro,Pedra Cristal.,-41.3950004577637,-20.789400100708,,,14151,,400,400,,,,,,,,,,VIES020357,VIES020357,auto
2020-04-27 16:11:50-03,UFES,VIES,20691,S,Plantae,,,,Velloziaceae,Vellozia,variegata,,Vellozia variegata,Goethart & Henrard,"Couto, D.R.",2010,09,,,"Couto, D.R.; Demolinari, F.; Pinto Júnior, H.V. & Pereira, M.C.A.",1642,,2010,09,02,,,Brasil,Espírito Santo,Mimoso do Sul,Conceição de Muqui.,-41.3664016723633,-21.0641994476318,,,29430,,,,,,,,,,,,,VIES020691,VIES020691,auto
2020-04-27 16:11:50-03,UFES,VIES,33562,S,Plantae,,,,Velloziaceae,Vellozia,variegata,,Vellozia variegata,Goethart & Henrard,"Pinto Júnior, H.V.",2013,08,02,,"Pinto Júnior, H.V.; Pereira, M.C.A. & Bernardi, U.C.S.",94,,2013,08,02,,,Brasil,Espírito Santo,Mimoso do Sul,Conceição do Muqui.,-41.3664016723633,-21.0641994476318,,,29430,,977,977,,,,,,,,,,VIES033562,,auto
2019-06-27 10:27:00-03,UFES,VIES,38777,S,Plantae,,,,Velloziaceae,Vellozia,variegata,,Vellozia variegata,Goethart & Henrard,,,,,,"Pena, N.T.L.; Alves-Araújo, A. & Miranda, V.S.",666,,2016,07,26,,,Brasil,Espírito Santo,Nova Venécia,APA Pedra do Elefante.,-40.4006004333496,-18.710599899292,,,42400,,,,,,,,,,,,,VIES038777,VIES038777,auto
2020-11-03 16:40:26-03,UFES,VIES,35899,S,Plantae,,,,Velloziaceae,Vellozia,variegata,,Vellozia variegata,Goethart & Henrard,C.A. Ferreira Jr.,2020,09,22,,"Forzza, R.C.; Amaral, J.A. & Pellegrini, M.O.O.",7640,,2013,04,24,,,Brasil,Espírito Santo,Nova Venécia,Área de Proteção Ambiental Pedra do Elefante.,-40.4006004333496,-18.710599899292,,,42400,,626,626,,,,,,,,,,VIES035899,VIES035899,auto
2020-11-03 16:40:26-03,UFES,VIES,24320,S,Plantae,,,,Velloziaceae,Vellozia,variegata,,Vellozia variegata,Goethart & Henrard,C.A. Ferreira Jr.,2020,09,22,,"Freitas, V.C.",29,,2016,02,15,,,Brasil,Espírito Santo,Serra,APAMA Mestre Álvaro. Trilha principal.,-40.3078002929688,-20.1285991668701,,,16451,,,,,,,,,,,,,VIES024320,VIES024320,auto
2020-11-03 16:40:26-03,UFES,VIES,5353,S,Plantae,,,,Velloziaceae,Vellozia,variegata,,Vellozia variegata,Goethart & Henrard,C.A. Ferreira Jr.,2020,09,22,,"Vinha, P.C.",1170,,1990,11,11,,,Brasil,Espírito Santo,Serra,Mestre Álvaro.,-40.3078002929688,-20.1285991668701,,,16451,,,,,,,,,,,,,VIES005353,VIES005353,auto
2020-04-27 16:11:50-03,UFES,VIES,4661,S,Plantae,,,,Velloziaceae,Vellozia,variegata,,Vellozia variegata,Goethart & Henrard,"Silva, R.M.",1993,05,,,"Pereira, O.J.",2063,,1989,06,24,,,Brasil,Espírito Santo,Serra,Reserva Biológica Mestre Álvaro.,-40.3078002929688,-20.1285991668701,,,16451,,800,800,,,,,,,,,,VIES004661,VIES004661,auto
2015-09-04 13:49:51-03,MNHN,RECOLNAT_MNHN_P,P00039363,PreservedSpecimen,,,,,Velloziaceae,Vellozia,variegata,,Vellozia variegata,Goethart & Henrard,Mello- Silva,,,,,"Pignal, M.|Lechat, F.",,H 560,1993,9,26,,,Brésil,bahia,santa teresinha,"Serra do Gibboia, Morro da Pioneira [Morro da Pioneira, Serra da Jibóia]",-39.46667,-12.85,,,,,850,,,,,hb,,,,,<a href='http://coldb.mnhn.fr/catalognumber/mnhn/p/p00039363' target='other'> <mi>dwc_moreinfo</mi></a>,P00039363,P00039363_01,
2015-09-03 19:25:52-03,MNHN,RECOLNAT_MNHN_P,P02081690,PreservedSpecimen,,,,,Velloziaceae,Vellozia,variegata,,Vellozia variegata,Goethart & Henrard,,,,,,"Mexia, Y.",,4289,1930,1,1,,,Brasil,Minas Gerais,Carangola,Top of Serra da Gramma.,-42.0293998718262,-20.7331008911133,,,21913,,1700,,,,,hb,,,,,<a href='http://coldb.mnhn.fr/catalognumber/mnhn/p/p02081690' target='other'> <mi>dwc_moreinfo</mi></a>,P02081690,P02081690_01,auto
2021-04-21 22:00:02-03,US,US,3140704,PreservedSpecimen,Plantae,,Monocotyledonae,Liliales,Velloziaceae,Vellozia,variegata,,Vellozia variegata,Goethart & Henrard,,,,,,"L. R. Noblick, -- Lemos & -. Valdomiro",4430,,1984,5,16,,South America - Neotropics,Brazil,Bahia,,"Serra da Pioneira, 03 km de P. Branca Santa Terezinha",-39.53,-12.75,,,,,800,,,,,,1,,,,,,,
2021-04-21 22:00:02-03,US,US,1443769,PreservedSpecimen,Plantae,,Monocotyledonae,Liliales,Velloziaceae,Vellozia,variegata,,Vellozia variegata,Goethart & Henrard,,,,,,"L. R. Noblick, -- Lemos & -. Valdomiro",17030,,1984,5,16,,South America - Neotropics,Brazil,Bahia,,"Serra da Pioneira, 03 km de P. Branca, Santa Terezinha",-39.53,-12.75,,,,,,,,,,,1,,,,,,,
2021-04-21 22:00:02-03,US,US,2548804,PreservedSpecimen,Plantae,,Monocotyledonae,Liliales,Velloziaceae,Vellozia,variegata,,Vellozia variegata,Goethart & Henrard,,,,,,Y. Mexia,3513,,1930,2,1,,South America - Neotropics,Brazil,Minas Gerais,Carangola,Top of Serra do Gramma,-42.0293998718262,-20.7331008911133,,,21913,,,,,,,,1,,,,,,,auto
2021-04-21 22:00:02-03,US,US,3193321,PreservedSpecimen,Plantae,,Monocotyledonae,Liliales,Velloziaceae,Vellozia,variegata,,Vellozia variegata,Goethart & Henrard,,,,,,G. Martinelli & C. Farney,4121,,1982,9,25,,South America - Neotropics,Brazil,Rio de Janeiro,Petrópolis,"Araras, Morro da Pedra do Oratório",-43.1786003112793,-22.5049991607666,,,36524,,,,,,,,1,,,,,,,auto
2021-04-21 22:00:02-03,US,US,2593194A,PreservedSpecimen,Plantae,,Monocotyledonae,Liliales,Velloziaceae,Vellozia,variegata,,Vellozia variegata,Goethart & Henrard,,,,,,E. Pereira,58605,,1955,3,22,,South America - Neotropics,Brazil,Rio de Janeiro,Santa Maria Madalena,"E. Santos, Sta. Maria Magdalena. Pedra Dubois",-42.0080986022949,-21.9552993774414,,,30526,,,,,,,,1,,,,,,,auto
2019-10-29 10:08:42-03,UFPR,EFC,17645,PreservedSpecimen,Plantae,,,,Velloziaceae,Vellozia,variegata,,Vellozia variegata,Goethart & Henrard,"Völtz, R.R.",2018,11,26,,"Völtz, R.R.; Brotto, M.L.",1972,,2015,03,30,,,Brasil,Rio de Janeiro,São Fidélis,"Serra Itacolomi, morro Pedra do Macaco, Parque Estadual do Desengano",-41.8675,-21.848,-41.8675,-21.8480,,,1485,1485,,,,,,,,,"Subarbusto 0,3 m alt. crescendo sobre rochas; flores azuladas; fisionomia herbácea de topo de morro. Refúgio Vegetacional Altomontano",EFC017645,,
2019-11-13 11:32:37-03,USP,SPF,228847,PreservedSpecimen,Plantae,,,,Velloziaceae,Vellozia,variegata,,Vellozia variegata,Goethart & Henrard,"Mello-Silva, R",2017,05,,,"Forzza, RC",7640,,2013,04,24,,,Brasil,Espírito Santo,Nova Venécia,APA da Pedra do Elefante,-40.791111,-18.766944,-40.791111,-18.766944,,,626,626,,,,,,,,,,SPF00228847,,
2021-03-15 18:30:17-03,USP,SPF,227149,PreservedSpecimen,Plantae,,,,Velloziaceae,Vellozia,variegata,,Vellozia variegata,Goethart & Henrard,"Mello-Silva, R",2016,12,21,,"Mello-Silva, R",4053,,2016,12,21,,,Brasil,Minas Gerais,Fervedouro,"Parque Estadual da Serra do Brigadeiro, Pedra do Pato. Afloramentos rochosos gnáissicos no topo da montanha, acima da Pedra do Pato.",-42.472194,-20.747778,-42.472194,-20.747778,,,1800,1800,,,,,,,,,"Arbustos até 50 cm alt. Folhas espirotrísticas, retas. Frutos passados ocre.; Vegetação rupícola",SPF00227149,,
2021-03-15 18:30:17-03,USP,SPF,227160,PreservedSpecimen,Plantae,,,,Velloziaceae,Vellozia,variegata,,Vellozia variegata,Goethart & Henrard,"Mello-Silva, R",2016,12,20,,"Mello-Silva, R",4042,,2016,12,20,,,Brasil,Minas Gerais,Araponga,"Parque Estadual da Serra do Brigadeiro, Pedra do Índio.",-42.475806,-20.702833,-42.475806,-20.702833,,,1700,1700,,,,,,,,,"Arbustos até 50 cm alt. Enorme população cobrindo praticamente toda a rocha, em frutificação. Folhas espirotrísticas, retas. Frutos passados ocre.; Afloramento rochoso gnáissico no alto da montanha, tomado por populações de Vellozia",SPF00227160,,
2019-11-13 11:32:37-03,USP,SPF,228784,PreservedSpecimen,Plantae,,,,Velloziaceae,Vellozia,variegata,,Vellozia variegata,Goethart & Henrard,"Paula, LFA",2016,05,,,"Forzza, RC",8781,,2016,03,16,,,Brasil,Espírito Santo,Nova Venécia,Pedra do Elefante,-40.456667,-18.769167,-40.456667,-18.769167,,,620,620,,,,,,,,,,SPF00228784,,
2019-11-13 11:32:37-03,USP,SPF,228830,PreservedSpecimen,Plantae,,,,Velloziaceae,Vellozia,variegata,,Vellozia variegata,Goethart & Henrard,"Mello-Silva, R",2015,12,,,"Cordeiro, I",3454,,2013,09,17,,,Brasil,Bahia,Santa Teresinha,,-39.475,-12.854722,-39.475,-12.854722,,,750,750,,,,,,,,,,SPF00228830,,
2019-11-13 11:32:37-03,USP,SPF,228849,PreservedSpecimen,Plantae,,,,Velloziaceae,Vellozia,variegata,,Vellozia variegata,Goethart & Henrard,"Mello-Silva, R",2017,05,,,"Forzza, RC",7526,,2013,04,19,,,Brasil,Espírito Santo,Itarana,Pedra da Onça,-40.812778,-19.895833,-40.812778,-19.895833,,,892,892,,,,,,,,,,SPF00228849,,
2019-11-13 11:32:37-03,USP,SPF,230180,PreservedSpecimen,Plantae,,,,Velloziaceae,Vellozia,variegata,,Vellozia variegata,Goethart & Henrard,Anônimo,,,,,"Fraga, CN",3512,,2013,04,25,,,Brasil,Espírito Santo,Santa Leopoldina,Pedra Preta.,-40.614444,-20.173056,-40.614444,-20.173056,,,900,900,,,,,,,,,,SPF00230180,,
2019-11-13 11:32:37-03,USP,SPF,230184,PreservedSpecimen,Plantae,,,,Velloziaceae,Vellozia,variegata,,Vellozia variegata,Goethart & Henrard,"Baez, C",2016,05,,,"Baez, C",366,,2016,01,26,,,Brasil,Rio de Janeiro,Santa Maria Madalena,Parque Estadual do Desengano,-41.911944,-21.898889,-41.911944,-21.898889,,,1729,1729,,,,,,,,,,SPF00230184,,
2019-11-13 11:32:37-03,USP,SPF,230185,PreservedSpecimen,Plantae,,,,Velloziaceae,Vellozia,variegata,,Vellozia variegata,Goethart & Henrard,"Baez, C",2016,05,,,"Baez, C",433,,2016,01,27,,,Brasil,Rio de Janeiro,São Fidélis,"Parque Estadual do Desengano, Serra Pedra do Marial.",-41.913333,-21.869444,-41.913333,-21.869444,,,1401,1401,,,,,,,,,,SPF00230185,,
2019-11-13 11:32:37-03,USP,SPF,227405,PreservedSpecimen,Plantae,,,,Velloziaceae,Vellozia,variegata,,Vellozia variegata,Goethart & Henrard,"Mello-Silva, R",2017,01,,,"Rodrigues, MTU",s.n.,,2016,12,30,,,Brasil,Rio de Janeiro,Santa Maria Madalena,"Parque Estadual do Desengano, Pico do Desengano.",-42.0080986022949,-21.9552993774414,0,0,30526,,,,,,,,,,,,,SPF00227405,,auto
2021-05-18 10:52:03-03,UEFS,HUEFS,12741,PreservedSpecimen,Plantae,Angiospermae,Lilianae,Pandanales,Velloziaceae,Vellozia,variegata,,Vellozia variegata,Goethart & Henrard,,,,,,"Queiroz, L.P.de",2947,,1992,12,08,,,Brasil,Bahia,Castro Alves,,-39.466667,-12.85,39W28',12S51',,,,,,,,,,,,,,HUEFS0012741,HUEFS0012741,
2021-05-18 10:52:03-03,UEFS,HUEFS,152828,PreservedSpecimen,Plantae,Angiospermae,Lilianae,Pandanales,Velloziaceae,Vellozia,variegata,,Vellozia variegata,Goethart & Henrard,,,,,,"Forzza, R.C.",5191,,2008,07,17,,,Brasil,Espírito Santo,Nova Venécia,Área de Proteção Ambiental da Pedra do Elefante. Pedra do Elefante. Inselbergue.,-40.443889,-18.776944,40W26'38'',18S46'37'',,,400,400,,,,,,,,,,HUEFS0152828,HUEFS0152828,
2021-05-18 10:52:03-03,UEFS,HUEFS,3379,PreservedSpecimen,Plantae,Angiospermae,Lilianae,Pandanales,Velloziaceae,Vellozia,variegata,,Vellozia variegata,Goethart & Henrard,,,,,,"Noblick, L.R.",3223,,1984,05,16,,,Brasil,Bahia,Santa Terezinha,,-39.533333,-12.75,39W32',12S45',,,,,,,,,,,,,,HUEFS0003379,HUEFS0003379,
2021-05-18 10:52:03-03,UEFS,HUEFS,3456,PreservedSpecimen,Plantae,Angiospermae,Lilianae,Pandanales,Velloziaceae,Vellozia,variegata,,Vellozia variegata,Goethart & Henrard,L.P.de Queiroz,1995,,,,"Noblick, L.R.",3301,,1984,06,06,,,Brasil,Bahia,Santa Terezinha,,-39.533333,-12.75,39W32',12S45',,,,,,,,,,,,,,HUEFS0003456,HUEFS0003456,
